name,id,type,area_id,grade,height,pitches,score,votes,description,star_ratings
Babel Tower,108892490,Sport,107824526,5.9,60,1,2.8,16.0,Bolted arête to the left of the classic dihedral For Whom the Bell Tolls. Pull over a low roof (crux) and follow the arête with great holds on both sides to a set of bolted anchors.,"{107755397: 3, 200099747: 3, 200138493: 3, 110584840: 3, 110148614: 3, 200220853: 3, 111166221: 3, 109423069: 3, 108679988: 3, 107041196: 3, 110213399: 3, 107559987: 3, 108933244: 3, 110755607: 2, 107843504: 2, 109325110: 2}"
Captain Crunch,108907890,Trad,107824526,5.8,55,1,3.0,2.0,"This is an easy jug-lined crack. Rock quality was decent. The route would probably be 5.7, except its a little steep down low. A fun warm up.","{200143486: 4, 107559987: 2}"
Dirty Girl,108051435,Trad,107824526,5.6,45,1,1.0,1.0,Work your way up a the thin flake that starts nearly straight and then begins to pull left.  Easy warmup and nice route for the beginning trad climber.,{111166221: 1}
For Whom the Bell Tolls,108892428,Trad,107824526,5.10a,65,1,3.9,23.0,A classic left facing corner crack with a short offwidth section leading up to a roof system. A leftward underclinging traverse leads to a foot rail then up another short corner to another roof traverse. Move easily to the anchors on the left. This is the must do route at Haw Creek.,"{107755397: 4, 111522632: 4, 107406726: 4, 107955776: 4, 200220853: 4, 110148614: 4, 110584840: 4, 200138493: 4, 109872933: 4, 112207022: 4, 108886549: 4, 110875347: 4, 109423069: 4, 107041196: 4, 109069728: 4, 109169434: 4, 107482343: 4, 110213399: 4, 108679988: 4, 110755607: 4, 109152722: 3, 107559987: 3, 12084: 3}"
Frisbie Golf,108892637,Trad,107824526,5.7,40,1,2.2,5.0,Offwidth left facing corner with lots of face holds requiring no offwidth technique. Kind of a fun little route. Would be awesome if the crack went for a 100 ft. or more.,"{110213399: 3, 107755397: 2, 110755607: 2, 110875347: 2, 200099747: 2}"
Home Sweet Home,119075110,Trad,107824526,5.7,60,1,1.0,1.0,Climb up a flared crack for a short distance before wandering up the top face. This is the most direct line to the anchors on this wall with 4 other routes merge into this and share anchors.,{200099747: 1}
Killer Pillar,112334601,Trad,107824526,5.9,55,1,3.0,1.0,"Obvious pillar/buttress further down the cliff line, climb the left side through a crux or two with solid pro to the anchors",{109855183: 3}
Midday Lightning,108892610,Sport,107824526,5.9,55,1,2.6,14.0,A bolted left angling blunt arête starting off a detached block. Very fun route and a good warm-up.,"{107755397: 3, 200099747: 3, 111166221: 3, 111538009: 3, 109423069: 3, 110755607: 3, 107843504: 3, 109325110: 3, 200138493: 3, 110213399: 2, 110875347: 2, 107559987: 2, 110584840: 2, 109152722: 1}"
No Verguenza,110999684,Trad,107824526,5.10c,60,1,1.0,1.0,"Climb the 5.7 dihedral ""Frisbie Golf"", climb past it's anchors through the roofs.",{110213399: 1}
Pepper and Salt,108069764,Sport,107824526,5.8,40,1,1.8,8.0,From the guide book: Climb the knobby face past low and high cruxes to a set of anchors at mid-height.,"{111166221: 3, 110213399: 2, 107843504: 2, 109423069: 2, 108933244: 2, 107755397: 1, 107559987: 1, 200099747: 1}"
Sangre Americana,111130130,Sport,107824526,5.9,65,1,1.5,2.0,Steady climbing through first two bolts getting easier up high. Goes straight up and meanders to the right and up to anchors.,"{107843504: 2, 111166221: 1}"
Shadow Dancing,108907858,Trad,107824526,5.11a,55,1,2.4,10.0,"Climb up the orange and black flake to a decent stance about 6-7 ft off the ground. There is a finger size crack in back of the flake. Plug in a few small cams. Fire through the delicate layback and clip the first bolt from a solid jug. Move left from the first bolt clipping two more bolts from positive but pumpy holds. After the bulge, run it out through easy terrain to the anchors.","{107559987: 3, 111522632: 3, 110755607: 3, 108679988: 3, 110213399: 3, 109152722: 2, 109169434: 2, 109423069: 2, 200099747: 2, 109069728: 1}"
Broken English,112265114,Trad,110999708,5.8,70,1,2.0,1.0,"Fun but dirty, some loose rock, not well traveled",{110875347: 2}
The Diving Bell and the Butterfly,112350415,Sport,110999708,5.10b,60,1,2.5,2.0,"Very fun climbing through the crux to the 3rd bolt, at which point the grade eases up.  The final slab can be dirty (but easily doable due to the good feet).  Anchors shared with Green Hornet & Lost My Lizard.","{109419855: 3, 111538009: 2}"
Green Hornet,110999739,Trad,110999708,5.8+,65,1,3.0,2.0,"An excellent, dirty, and varied crack. A hard start (for 5.8) followed by a 5.8 layback, followed by a short offwidth section, followed by a moderate roof.","{110213399: 3, 110875347: 3}"
Lost My Lizard,110999755,Sport,110999708,5.10a,60,1,1.3,4.0,"A technical 5.10. At the 5th bolt, traverse to the right and begin to join ""The Diving Bell and the Butterfly""","{107965009: 2, 110213399: 1, 109419855: 1, 108978472: 1}"
No Remorse,110999764,Sport,110999708,5.10c,70,1,3.5,6.0,A sustained 5.10C on positive holds. Get through the V3-4 boulder problem move then bash the overhanging jugs to the last bolt. Pull a spicy move off some pockets and climb easy terrain to the anchors. Beta: Don't slow down.    Some chossy sections. Make sure people are not below the climber and the belayer is wearing a helmet.,"{110213399: 4, 111538009: 4, 108978472: 4, 110755607: 3, 200099747: 3, 108933244: 3}"
Steep Show,110999721,Sport,110999708,5.11d,65,1,3.0,1.0,"Climb a chossy arete. Layback a nice fingercrack. Then power through a horizontal roof section, clipping nearby bolts. Cut feet and pull the roof.",{110213399: 3}
dirt dabber,112306258,Boulder,111679790,V3,0,1,2.0,1.0,"start sitting on the left side of little overhang. work right through some tense moves, then nice holds to the lip and top out.",{108084510: 2}
Kris's traverse,112385495,Boulder,111679790,V4,0,1,3.0,1.0,"traverse the wall right until you get to a shallow dihedral, then go up and top out at the break",{108084510: 3}
Meat nose,112304007,Boulder,111679790,V2,0,1,2.0,1.0,start siting on the right set of underclings and follow neat holds and top out right side,{108084510: 2}
Slopey seconds,112304016,Boulder,111679790,V2,0,1,3.0,1.0,"Fun problem.  start sitting on the left set of underclings, do some moves to get to the sloping bump, then head up and right.",{108084510: 3}
Two-Face,111680039,Boulder,111679790,V2,0,1,3.4,5.0,"Crimpy and tall. stand start on chest height holds, work up and right through some techy crimps and feet, aiming for the break on the right, topout at the break. sustained.","{108084510: 4, 200205291: 4, 108964383: 3, 108962560: 3, 200061347: 3}"
Belly flop,112379753,Boulder,111679769,V4-,0,1,2.0,2.0,"start with a small right hand sidepull and a good left hand side pull. work your way up to a big shelf, then bust a fat awkward dyno to gain the sloper up top.      also, made this name up. definitely done before me.","{108084510: 2, 200138493: 2}"
double aretes,112379682,Boulder,111679769,V1,0,1,1.0,1.0,"right side of the south facing face.  make one move to gain the holds at the bottom of the two arêtes, then use both arêtes to top out.",{108084510: 1}
Gadzoom,112323200,Boulder,111679769,V3,0,1,2.0,1.0,"start with an obvious knob feature in the middle of the wall, make a left hand move to a sloper and make moves aiming at a horn-shaped jug up and to the left.  top out is slopey but will clean up.",{108084510: 2}
Iron Band Dyno,112323210,Boulder,111679769,V3,0,1,2.0,1.0,"fun dyno for the grade. sit start on the left side of the boulder on two large, opposing, and sloping iron bands. get low and throw big for the horn shaped jug and top out.",{108084510: 2}
Pick Up Sticks,112304023,Boulder,111679769,V5,0,1,4.0,1.0,"very beautiful arête. do it when it's cold! left hand and foot on, make a little hop to get right hand on the bubble in the arête, then do whatever you can to fight your way up this thing.",{108084510: 4}
single arete,112379706,Boulder,111679769,V2,0,1,3.0,1.0,"left arête only. start from the obvious hold near the bottom, make a reach to some holds at the base of the arête, then press your way up using only the left arête for hands. not too contrived, though you can bail out by making an awkward reach to the right arête and make it easier.",{108084510: 3}
Stilettos,112379774,Boulder,111679769,V6,0,1,2.0,1.0,"sit start on some sloper crimps and bad feet. move right to some more sloper crimps, set up and make a big move right to a decent hold and get on top.",{108084510: 2}
Warm Up Slab,112306197,Boulder,111679769,V1,0,1,2.0,1.0,"use some bad holds to get established on the slab, then tip toe up little knobs to the good topout. will eventually clean up to a 3 star line with some traffic and consistent cleaning.",{108084510: 2}
(Somewhat Pessimistic) Micro-Flora,112476261,Boulder,111679778,V5,0,1,4.0,1.0,"sit start crossed on the left side of the boulder with the right hand low and the left on a perfectly ergonomic knob. move to the two obvious slopers, work your way to the obvious side-pull crimp on the face using a right undercling and some funk, then keep working your way right, topping out on the mega-fauna fins any way you can. The beta is extra weird and hard to solve, but an excellent problem when done.  Nothing is ""off"" on this problem, though it is just a bit contrived. if you keep heading straight up the flakes, it becomes more difficult to get into the crimp. so while the upper flakes aren't ""off"" they are kind of a dead end if you want to do this problem.",{108084510: 4}
(Super Charismatic) Mega Fauna,111679830,Boulder,111679778,V5,0,1,4.0,6.0,"Area Classic.  Cant miss this beautiful boulder. sit start on bad underclings and feet. throw left hand up to a shallow side-pull, then work through the compression moves with surprisingly specific feet to some jug flakes and a delicate, but easy topout.","{108084510: 4, 108964383: 4, 111737831: 4, 200038676: 4, 112225989: 4, 200677940: 4}"
100 Days,112379489,Boulder,111679778,V4,0,1,3.0,1.0,"beautiful arête that has been laying in wait for an ascent.  Stand start at the obvious chest high break, step on and pick a left foot, work and slap up opposing holds until you gain the sideways jug and just cruise to the finish. basically a 10' v4 followed by 10' of v0-1 laybacking.  Once at the top, traverse right on flat jugs and good feet to the downclimb.",{108084510: 3}
A-Hole,112316474,Boulder,111679778,V3,0,1,2.5,2.0,"start low on a crappy flake, work up and right through a few holds in a small hueco, set and launch for the jug hole out right, work around and straight up through good holds to slopey, slightly dirty but easy topout.","{108084510: 3, 200099747: 2}"
A-Hole direct,112316486,Boulder,111679778,V1,0,1,1.0,1.0,"start on the right side of boulder in some breaky-funky jugs, work through the juggy shelf then straight up to top out.",{108084510: 1}
baby classic,112317875,Boulder,111679778,V1,0,1,2.0,1.0,"Great little problem, just short.  start on the lowest good holds and work up and out the steepest part of the roof to a slopey but low ball topout.",{108084510: 2}
Baller Without Reason,112316390,Boulder,111679778,V4,0,1,2.0,1.0,"fun climb climb with cool moves, but a bit contrived.  start way to the left of SNEKS and low on whatever hands you see fit (I used two underclings for the FA) and terrible feet. make a big move to the closest jug on SNEKS. Move up and right a bit to the highest set of jugs, then make a hard left hand move to a sloping sidepull (just down from the finishing sloper on SNEKS), set feet, make a quick grab for a jug on the right side of the sloper, and top out.",{108084510: 2}
Book of Deceit,112306633,Boulder,111679778,V6,0,1,3.0,1.0,"hard slabby dihedral with then crack. with your left foot on the left side and your right hand on the right side, get a little hop start to get your left hand up into the seam. do some funky stuff up to the drop off jug",{108084510: 3}
Buzzsaw,119324384,Boulder,111679778,V7,15,1,4.0,1.0,Beautiful over hung Saw-blade shaped arete with really interesting holds and body positions. One of the best problems of the grade in the state.,{112225989: 4}
Columnbine,112304036,Boulder,111679778,V4,0,1,3.8,4.0,"Start with hands on either side and make a move to a face hold. then start working up little edges aroud the sides and hug this refrigerator block for 15 feet then make a committing topout on slopers.  Definitely done before me, but I don't have any FA info.","{108084510: 4, 110584840: 4, 200138493: 4, 108964383: 3}"
Crocadilla,111679843,Boulder,111679778,V1,0,1,2.5,2.0,"fun little problem and very cool features. sit start with some protruding features, slap up a few sloper moves using the holds on the left side of the arête, get established a little higher, and tiptoe your way right through the flakes to the topout of mega fauna. perfect little warm up.","{200061347: 3, 108084510: 2}"
Cum Sock,111679864,Boulder,111679778,V5,0,1,1.0,1.0,"interesting problem. some cool moves on a aesthetic arête, but hard to call a classic.      sit start on some very specific feet and hands up to a couple of slopey pockets to the right of the arête. move to the large rail on the left, use the small, terrible pinch on the arête a bit higher, and find a way to get to the jug.",{108084510: 1}
Deal or No Deal,111679925,Boulder,111679778,V4,0,1,2.0,1.0,"problem with a ton of iron pocket features near the start. Start on good holds in a small cave, first couple of moves go through the sea of iron outcroppings. Choose the correct combo and win big! get to the jug, then just one long, sideways deadpoint to the sloping arête stands between you and victory.",{108084510: 2}
Full Frontal,112316437,Boulder,111679778,V3,0,1,2.0,2.0,"Not classic, but a good warm up. start near tree on low jugs, work up and right all the way across the boulder, moving up in the process, top out on the right side of the face (to the left of rail gun). infinite beta possibilities, grade based solely on pump.","{108084510: 2, 112225989: 2}"
Gingerbread,111679935,Boulder,111679778,V4,0,1,3.0,1.0,"Compression bloc. sit start with the right hand hand-jammed in a slot on the left side of the boulder and slap up left, then right, then left, then right, or whatever you want to do. lots of fun.",{108084510: 3}
Instant classic,112323225,Boulder,111679778,V4,0,1,2.5,2.0,"Same start as Super Classic, but work out right to more slopers and small holds to gain the same topout","{112225989: 3, 108084510: 2}"
Ironclad,114308265,Boulder,111679778,V4,20,1,4.0,1.0,Stand start with crimps on right side of arete. Climb arete on iron oxide edges to an airy finish. Move right across jugs to top it. No protection at that point and a big rock may or may not be in your trajectory if you come off at the top.  Don't climb if you're not solid in the grade. There is a tree and a rock pillar to sling up top for anchor. Climb over from adjacent boulder to get on. Jump over to get off.,{108071729: 4}
Knobby Crack,112303780,Boulder,111679778,V1,15,1,3.0,1.0,middle-left side of warm up boulder. starts on obvious holds in a break and follows the little crack up and left to a weird but ok topout.,{108084510: 3}
Lost and Found,112316370,Boulder,111679778,V2,0,1,4.0,9.0,"Awesome! start on the downhill side of the face on a flat jug, work up and left through the perfect sandstone jugs, get a left hand in the last and highest pocket and make a big move to the sloper horn up top. the top out is a bit awkard (go around the right and grab hidden right hand sidepulls)","{108084510: 4, 108964383: 4, 109661504: 4, 200157132: 4, 112225989: 4, 200099747: 4, 200146075: 4, 111760760: 4, 200677940: 4}"
Perspective,118113730,Boulder,111679778,V3,10,1,2.0,1.0,Start on the diagonal rail and work to some good edges out left and high. Finish at the break where the rock gets chossy.,{110244087: 2}
Rail Gun,112316455,Boulder,111679778,V0-,0,1,3.0,2.0,"start squatting with hands on a good rail. work up sloping rails, all pretty good, to a little slopey topout.","{108084510: 3, 112225989: 3}"
Side Scroller,111679982,Boulder,111679778,V3,0,1,2.7,3.0,"rightward traverse that is pretty sustained. Start on a really awesome sloper, move right on  some crimps to a large deadpoint for a pocket. move up and right through some jugs to get established on the face.  Not much is gained by attempting the topout, which is tall and chossy.","{108084510: 3, 110584840: 3, 200138493: 2}"
Super Classic,112303943,Boulder,111679778,V4,0,1,3.6,7.0,start under the roof and work out beautiful sandstone holds and slopers and top out,"{108084510: 4, 111077003: 4, 112225989: 4, 200099747: 4, 200038676: 3, 111737831: 3, 200677940: 3}"
Alabama 2,112316287,Boulder,111679763,V3-4,0,1,2.0,2.0,"start in some sloping slots on the right side of the lazy boulder. make a stabbing first move, then work through a cool sequence of crimps and sidepulls. top out is easy.  the rock looks fragile but is bomber.     WARNING* while getting on top of the boulder is easy, once you topout there is about 30 ft of leaf-dirt-vine slab that I would not recommend. I want to fix a rope in the future, but until then I might recommend dropping off.","{200138493: 2, 108084510: 2}"
Autonomic,112328544,Boulder,111679763,V1-,0,1,4.0,3.0,beautiful highball problem. stand start in the middle and work up whatever you feel like to topout at the highest point.,"{108084510: 4, 107977958: 4, 200188774: 4}"
bottom feeders,112303896,Boulder,111679763,V5,10,1,3.2,5.0,start on a jutting block on the left side of the boulder. do compression moves up slopes and slaps to a few crimps and finish. top out on left side,"{112225989: 4, 200677940: 4, 108084510: 3, 108962560: 3, 111737831: 2}"
Brendan's Problem,112306079,Boulder,111679763,V4,0,1,3.0,1.0,"good holds to the lip, then with the left hand on a good undercling, slap your way up to the highest sloper and top out.",{108084510: 3}
Hard to Gouge,111679959,Boulder,111679763,V4,0,1,3.0,1.0,problem left of Violent Nature. sit start with left hand on a crimp and right hand undercling. work moves up obvious holds until you have to find a way to stab the left hand into the eye shaped pocket. big move out right then ride good holds to the finish.,{108084510: 3}
Hueco Problem,112328571,Boulder,111679763,V4-5,0,1,4.0,2.0,"Hard to grade. start on the left side of the boulder, mover through a fun series of giant huecos as far right as you can and head up to a nails hard sloper top-out.  getting through the huecos is probably v3, but the moves to gain the top, then actually topping out is difficult. the hueco section is easier if you use the lip while transitioning between huecos but is not necessary. also a problem that rides the lip the whole way.","{108084510: 4, 112208335: 4}"
Hurricane Handouts,112303886,Boulder,111679763,V6,15,1,4.0,4.0,"Really obvious problem on the left side of the overhang. not to be missed.start on small, sharp or slopey crimps (choose your poison on the obvious rail), bust a powerful move out left and work through the power sequence into a slopey sequence at the top. fight the pump on the spicey finish.","{108084510: 4, 108964383: 4, 112225989: 4, 200677940: 4}"
must be this tall to climb,112303995,Boulder,111679763,V4-5,0,1,2.0,1.0,"Weird problem. start sitting under the block with ok holds, make either a super powerful move out to the arête and avoid the dab, or if you are tall enough there is a secret toe hook.  then slap up the friction dependent slopers to topout",{108084510: 2}
Newton county stick fight,112303905,Boulder,111679763,V5,0,1,3.7,3.0,"right side of the boulder, to the right of bottom feeders","{112225989: 4, 200677940: 4, 108084510: 3}"
The Quarry,112316300,Boulder,111679763,V4-5,0,1,3.0,1.0,"From fat slopers to two finger pockets, this problem has the works.  start on a good hold in the wide crack and work left through good holds and movement. get established past the overhang and make a big move to a shared hold with Alabama 2, then top out via Alabama 2.",{108084510: 3}
Samurai Sword,112316333,Boulder,111679763,V0,0,1,3.3,4.0,"Best sloper problem of the grade in AR! start on the low divot on the right arête and work your way up the perfect slopers, using the face for feet or your heel on the arête. so fun.","{108084510: 4, 200138493: 3, 110584840: 3, 200099747: 3}"
Violent Nature,111679941,Boulder,111679763,V6,0,1,2.0,1.0,"Beautiful arête, turned dihedral problem. stand start, hands crossed (left on a small crimp rail and right on a sloping feature below). struggle to get established on a high left foot and right foot in a dish, fire up to a decent crimp, and work a few layback moves til you can gain a kneebar in the dihedral. work hands left, unwind from the kneebar, and cruise the easy layback jugs to a slightly spicy top.      last few moves are still cleaning up. they are easy, just be careful.",{108084510: 2}
Black Lightning,111600024,Sport,111600010,5.11c,75,1,2.0,1.0,"The first obvious black streak as you walk into the crag.     Carefully climb up some easy but dangerous terrain to get the first bolt clipped, then pull up the ledge on some questionable pockets.    From here find some holds to get your body mounted onto the face and cruise up the big holds to the top.  Tends to be a bit dirty after rains.",{107878550: 2}
Snakes on a Plane,111600013,Sport,111600010,5.12a,75,1,3.0,1.0,McCrackens classic line.    Techno-endurance climbing that will eat your lunch.   Begin off a large rock stack and pull some precarious moves on a sloping ledge until you get established onto your feet.    From here follow the obvious right leaning crack that runs up the line. Some hand sequencing is useful to negotiate this portion efficiently.     Climb into a recessed portion of rock where you can prepare for the in your face crux.    From here climb up some easier (in comparison) terrain to a fun finish on an arete.    Stout for the grade. Tough to onsight.,{107878550: 3}
Unnamed,114304954,Sport,111600010,5.9,30,1,1.5,2.0,"This route follows thin and fragile holds, with somewhat thoughtful movement up to a bulge just below the anchors.","{200213755: 2, 108886549: 1}"
Unnamed,114305019,Sport,111600010,5.10d,60,1,2.0,1.0,"Move quickly through the cruxy arete start onto positive holds leading to a ledge. Continue on good crimps to the anchors. In its current state, this route is pretty dirty and still shedding holds. ",{108886549: 2}
Army Of One,118300677,Boulder,118300656,V5,15,1,2.0,1.0,Start on low jug rail and move left on edges to a big throw. Jugs to the top.,{108735310: 2}
Battle Stations,118300702,Boulder,118300656,V3-4,20,1,3.0,1.0,Long and juggy. First boulder established at Mill Creek.,{108735310: 3}
Dungeon Family,118308459,Boulder,118300715,V3-4,0,1,1.0,1.0,Start under a roof and grab some jugs to pull over the lip. Dirty and lowball.,{108735310: 1}
Fat In A Famine,118300722,Boulder,118300715,V5-6,0,1,3.0,1.0,Super high quality stone. Crux is likely the last few moves so have some pads and spotters with you if you get nervous with heady top outs.,{108735310: 4}
Longo Bongo,118300735,Boulder,118300715,V3-4,0,1,2.0,1.0,Cool pockets and edges on a slightly overhanging face. Currently pretty dirty up top but worth climbing once brushed,{108735310: 2}
Reign Of Filth,118300739,Boulder,118300715,V4,0,1,3.0,1.0,Cool climbing on the most attractive feature on the boulder. Starts low and right and covers a lot of ground.,{108735310: 3}
Sawed-Off Arete,118308596,Boulder,118300715,V2,0,1,2.0,1.0,High ball. Climb up the inspiring blunt arete to a break around 15 feet. Pull around to the right and top out in a less than ideal notch. This boulder is intimidating and should probably not be taken super lightly...,{108735310: 2}
Backdraft,111960442,Sport,111960376,5.12d,0,1,4.0,1.0,"Climb through the same initial boulder sequence as  ""Smokejumper"" and continue straight up the face instead of trending left.     Pull some ninja like moves establishing onto the slab section and shake before the small roof.    From here pull hard to the big ledge where the redpoint crux awaits. Make it to the rest jug and fire through some steep 5.11 jug terrain to the anchors.",{107878550: 4}
Smokejumper,111960413,Sport,111960376,5.13a,70,1,4.0,1.0,"Pass the initial test of a rugged and rowdy boulder problem to establish yourself into the thick of the fire.    From here ascend through the smoke through a vertical panel of rock with relatively easier terrain.     As the wall begins to steepen again, set up on small crimps to prepare for the glory throw to a jug crafted by rock Jesus himself. Recollect yourself and prepare for one more big throw before running it to the chains.    Best to hold on tight or whip deep into the ashes below",{107878550: 4}
Burn in Hell,113050460,Sport,111004030,5.12a,55,1,3.9,13.0,Best 12a at Rock Creek with cryptic low knee bar crux to some dihedral climbing and upper mini-crux.,"{110199585: 4, 110755607: 4, 107971249: 4, 108613386: 4, 107638654: 4, 112403472: 4, 200138493: 4, 107977958: 4, 108626560: 4, 111541660: 4, 108886549: 4, 107489614: 4, 111597363: 3}"
Burned At the Stake,111007937,Sport,111004030,5.12b,60,1,3.1,10.0,A Bouldery start leads into some more bouldery moves which eventually eases up about halfway through the route.     Cop a rest at the ledge near the top of the climb and pull a 5.10/11 move right beneath the chains.,"{200138493: 4, 107878550: 3, 107977958: 3, 110755607: 3, 108886549: 3, 108735310: 3, 109189789: 3, 108084510: 3, 108626560: 3, 111597363: 3}"
Burnt To Ash,112281790,Sport,111004030,5.13a,60,1,4.0,4.0,starts to the right of Extinguisher links into the same finish. A series of long moves (and or jumps) with good rests in between. Classic Rock Creek compression crux,"{110328313: 4, 107878550: 4, 108089129: 4, 107977958: 4}"
