name,id,type,area_id,grade,height,pitches,score,votes,description,star_ratings
Plumb Bob,105988232,Sport,105988223,5.11a,60,1,3.0,44.0,Striking arete that climbs through a low crux and a number of interesting moves that will eventually spit you out onto the face and into a beautiful splitter fist crack to the anchors.,"{106741846: 4, 107576881: 4, 108055813: 4, 200192295: 4, 111783062: 4, 13965: 4, 107971249: 4, 110148614: 4, 200630167: 4, 105849172: 4, 110512167: 4, 105899017: 4, 108424569: 4, 105792229: 4, 106226365: 3, 110767291: 3, 200155823: 3, 200167480: 3, 109816060: 3, 108744559: 3, 105984741: 3, 108479343: 3, 111553648: 3, 112147878: 3, 106574818: 3, 15142: 3, 106889145: 3, 107870705: 3, 108679988: 3, 106407880: 3, 106084734: 3, 108043082: 3, 106207917: 3, 109101477: 2, 112403472: 2, 109468689: 2, 107993865: 2, 111967377: 2, 109152722: 2, 106018444: 2, 107738415: 2, 106683773: 2, 10244: 2, 200378564: 1}"
Purple Nehi,106207924,Sport,105988223,5.11b/c,65,1,3.5,85.0,Climb on steep orange stone on sustained crimps to anchors. Great movement on beautiful stone. Crux is about midway up the route. Watch for bats in the cracks and underclings down low!!,"{112329508: 4, 112283425: 4, 200192295: 4, 110726946: 4, 112505301: 4, 107360131: 4, 111752519: 4, 109816060: 4, 108813564: 4, 109726766: 4, 108292652: 4, 109881112: 4, 107638654: 4, 111808826: 4, 111135486: 4, 110335247: 4, 200101945: 4, 111859893: 4, 200190185: 4, 200438871: 4, 110148614: 4, 112403472: 4, 109468689: 4, 107955776: 4, 200138493: 4, 200127893: 4, 110584840: 4, 15142: 4, 107041196: 4, 106280199: 4, 106889145: 4, 200829262: 4, 200042813: 4, 106407880: 4, 107451356: 4, 108030106: 4, 106207917: 4, 200911703: 4, 200393716: 4, 200206999: 4, 106056761: 4, 109252158: 4, 109353144: 4, 109877052: 4, 107738415: 4, 111771784: 4, 106018444: 4, 108368607: 4, 106870829: 4, 112202693: 3, 200327167: 3, 10244: 3, 200203321: 3, 106482590: 3, 108604024: 3, 200442345: 3, 107931921: 3, 200155823: 3, 110202689: 3, 111431823: 3, 107845729: 3, 107133024: 3, 108043082: 3, 108390129: 3, 107616372: 3, 106066740: 3, 106257217: 3, 106822061: 3, 107870705: 3, 200205291: 3, 108089129: 3, 106192059: 3, 109101477: 3, 108392797: 3, 111541660: 3, 111967377: 3, 200167480: 3, 112487518: 2, 108236363: 2, 200128215: 2, 109152722: 2, 111891854: 2, 111467330: 2, 108613386: 2, 112003012: 2}"
Recidivist,106961673,Sport,105988223,5.10b,55,1,2.7,45.0,Start on the left side of the arete with difficult moves at the beginning.  Crux is between the first and second bolts.,"{109396884: 4, 111956409: 4, 112169218: 4, 111984637: 4, 108055813: 4, 200192295: 4, 108479343: 3, 200393716: 3, 109881112: 3, 112124233: 3, 109206577: 3, 109127888: 3, 111392445: 3, 111893262: 3, 200428947: 3, 112329508: 3, 200138493: 3, 111321805: 3, 108679988: 3, 108233790: 3, 107564993: 3, 108295113: 3, 106089213: 3, 107041196: 3, 106683773: 3, 106964179: 3, 106949749: 3, 107677137: 3, 108933244: 3, 107697400: 2, 112003012: 2, 200300892: 2, 108043082: 2, 107638654: 2, 109816060: 2, 107137180: 2, 109252158: 2, 108057626: 2, 107993865: 2, 107133024: 2, 110052535: 2, 109305916: 1, 108236363: 1, 109152722: 1, 106908697: 1}"
September Hero,106031318,Sport,105988223,5.10a,60,1,1.5,18.0,"Very easy climbing leads to a ledge. After a couple of 5.10 moves, you find yourself at the anchors. The crux is getting the good holds to clip the anchors.","{200128215: 3, 105787317: 3, 109468689: 2, 200380691: 2, 108679988: 2, 112124233: 2, 109881112: 2, 106192059: 2, 106226365: 2, 15142: 2, 112329508: 1, 112487518: 1, 106257217: 1, 110087433: 1, 106018444: 1, 105802806: 0, 10244: 0, 109152722: 0}"
Space Monkey,110559759,Sport,105988223,5.11c,70,1,2.6,7.0,"Climb a moderate, shallow left facing dihedral to obtain a high first bolt.  Decipher a mostly moderate sequence through the lower two thirds, taking advantage of ample rests.  Near the top pull a couple of hard, thin moves to reach a nice in-cut.  Shake out and then climb a sequence of edges and slopers to reach the chains.    I personally found this route to be soft and unsustained for the grade.  The fixed draw also struck me as unnecessary due to the solid clipping stance.  Perhaps it is useful for shorter climbers?  I prefer Elephant Ear which is the same style and grade.","{200438871: 4, 200192295: 4, 111166628: 3, 108813564: 3, 200101945: 2, 106018444: 1, 106192059: 1}"
Spine Tingler,106115307,Sport,105988223,5.11d,55,1,2.4,20.0,"Climb the arete under the roof and pull over onto lower angled, but still challenging, climbing above.  The last 15 feet are easier, as seen from the ground.  There are a few ways to pull the roof, but both seem equally as difficult.    The only thing that would make this route better is if it were more sustained and longer.","{109069199: 4, 107247400: 3, 107178254: 3, 108254497: 3, 107971249: 3, 107359275: 3, 106207917: 3, 105899017: 3, 107360131: 2, 109101477: 2, 108679988: 2, 109152722: 2, 107137180: 2, 107096937: 2, 106741846: 2, 105916328: 2, 105990631: 2, 106407880: 2, 200615388: 2, 105849172: 1}"
Stinky Boots,116154813,Sport,105988223,5.10d,50,1,2.5,4.0,Reach high from the staring boulder to clip the first bolt and pull over a small roof on to a slab. Work past a difficult slab move. Easier climbing then leads to another challenging move just below the anchors. Take care not to z-clip the second bolt or just stickclip it to avoid the strenuous clip all together.  From Cole Fennel HCR guidebook p.92 #38,"{110959609: 3, 112002095: 3, 107829049: 2, 111709307: 2}"
Supersoul Sureshot,105988238,Sport,105988223,5.12c,55,1,3.8,33.0,Hard route to the left of Plumb-Bob. It seems there is a bail biner on the route nearly everytime i walk by it. super fun crimpy/sidepully crux.,"{107738415: 4, 112173761: 4, 109943407: 4, 109816060: 4, 200130915: 4, 108886549: 4, 12446: 4, 108479343: 4, 108846339: 4, 108089129: 4, 112403472: 4, 112147878: 4, 109518724: 4, 200063199: 4, 108964383: 4, 111127829: 4, 106870964: 4, 107106012: 4, 15142: 4, 105849172: 4, 107870705: 4, 200677940: 4, 108043082: 4, 109467833: 4, 109877052: 4, 108766902: 4, 108602505: 4, 112003012: 3, 105984741: 3, 108999258: 3, 106964179: 3, 106889145: 3, 109152722: 2}"
Tuff Gong,106562474,Sport,105988223,5.10+,40,1,1.7,3.0,"Fun climbing with good rests. Crux move at second bolt, a few ways to do it, you figure it out. Clipping the anchors can also present a challenge, get a solid stance because blowing it could put you on a ledge below.","{105990631: 2, 107129180: 2, 108121274: 1}"
The Vodka Diet,108882859,Trad,105988223,5.12a/b,70,1,2.0,1.0,"A spontaneous distraction.     Start on extended laybacks and techy reach-throughs to a rest(V4). From here step left to a corner and follow it for ten feet to a ledge (10b). From here you have a few options- traverse right into September Hero, Left into the 5.11 sport route nearby, or keep plugging up an exposed face to join the last two bolts on September Hero(fa).    On the first ascent, the first piece was pre-placed to avoid rolling down the hill into the poison ivy. Another option could be a crashpad.",{12446: 2}
[Redacted],106139138,Sport,105986426,5.12a,50,1,3.3,19.0,Start off of a boulder right of Man Junk.  Stick clip your rope high.  Campus or try to find feet and pull from a crimp-rail to a crimp in the short digedral overhead.  Reach past a crimp to a jug and paste your feet.  Climp jugs to the right out the roof to the lip.  Move slightly left at the lip and throw for a sloper then match and move right to the anchors.,"{106133986: 4, 109101477: 4, 112260466: 4, 107677137: 4, 106889145: 4, 107958782: 4, 106207917: 4, 106407880: 4, 105899017: 4, 107255495: 3, 111664966: 3, 112138790: 3, 112283425: 3, 110500610: 3, 111522632: 3, 109152722: 2, 106066740: 2, 110985244: 2, 110689679: 2}"
Anal Sac Expression,106207950,Sport,105986426,5.10d,55,1,2.9,15.0,You can stick clip this one and start from the edge of a huge boulder just under the climb. Climb up and over a roof onto the headwall on sloping holds to the anchors. The easiest route at the cave.,"{200043076: 4, 108046773: 4, 200157132: 3, 112260466: 3, 110726946: 3, 107677137: 3, 107646908: 3, 106889145: 3, 106084734: 3, 105899017: 3, 107930775: 3, 109152722: 2, 111664966: 2, 109101477: 2, 106207917: 2}"
Austrian Ass Attack,105986443,Sport,105986426,5.12a,50,1,3.0,9.0,Starts on a a dihedral with a finger crack and moves up into steep jugs.,"{105899017: 4, 112173761: 4, 112260466: 4, 108540522: 3, 109101477: 3, 110689679: 3, 105984748: 2, 105984741: 2, 110500610: 2}"
Billy's Goat,107028008,Boulder,105986426,V4,5,1,2.0,2.0,Start from a jug on the right side of the arete.  Climb the short prow.,"{108046773: 3, 106135193: 1}"
Dirty Trip,107424396,Sport,105986426,5.12c,25,1,1.0,1.0,Pull the tough bouldery start up to good holds at the obvious roof. Work through a crux sequence on bad holds up and left to the anchor.,{107415886: 1}
Fatboy deluxe Lite,117611321,Boulder,105986426,V7,0,1,3.0,1.0,"Start midway through fatboy deluxe V12, continue towards lip, mantle onto the ledge to finish. ",{200228486: 3}
Flabby Armed Spanking Machine,107424414,Sport,105986426,5.12c,45,1,1.0,1.0,"This link-up is the hardest tick at the Goat Cave. Climb Man Junk for two bolts and then traverse right into ""Short Bus."" Follow it to its fourth bolt and then work right on jugs past an exciting runout to the rail on ""Respect."" Contune right past ""Respect"", clipping two more bolts and lower off the last one.",{107415886: 1}
Greasy Kid's Stuff,107424400,Sport,105986426,5.12a,30,1,2.0,2.0,"Power over the hanging start to a horizontal crack under the first roof. Traverse left a move or two, load up and make a long crux move to the base of the second roof. Reach out to jugs, pull the lip, and climb much easier ground to the top.","{107415886: 2, 110500610: 2}"
Junk Bus,107424411,Sport,105986426,5.12b,0,1,1.0,1.0,"Begin with ""Man Junk"", but at the second bolt traverse straight right and finish on ""Ride the Short Bus""",{107415886: 1}
Man Junk,105986437,Sport,105986426,5.12b,50,1,2.9,8.0,Start on high crimpers and move up into a bouldery start toward the first bolt  where the route traverses left. Move back right past the second bolt into jugs and and hand jambs to the chains,"{106133986: 4, 105899017: 3, 15142: 3, 107137180: 3, 110500610: 3, 109101477: 3, 105984748: 2, 105984741: 2}"
Mexican Sac Pull,107424404,Sport,105986426,5.11b,40,1,2.7,11.0,This Horseshoe Classic features the best rock on the wall. Mount the easy overhang and continue up to the big ledge. Pull over the roof and gun through big holds on the impressive overhanging face.,"{107415886: 3, 109617327: 3, 112260466: 3, 200450497: 3, 108783852: 3, 107677137: 3, 107137180: 3, 106889145: 3, 111664966: 2, 109101477: 2, 200043076: 2}"
PBR,106294153,Sport,105986426,5.11a,50,1,3.2,10.0,"Pull the starting moves with high feet.  This is also the start of Mexican Sac Pull.  Climb to the third bolt, then move right onto jugs on the steep face.  Weave back and forth past the bolts to the anchors.  Fun fun fun.","{106889145: 4, 105899017: 4, 106227557: 4, 110726946: 3, 107646908: 3, 108046773: 3, 107930775: 3, 108233790: 3, 110689679: 3, 109152722: 2}"
Respect My Authority,107424419,Sport,105986426,5.12b,45,1,3.0,3.0,This obvious line is steep and proud. Begin in a dihedral. Pull a series of roofs and make a big move to the awesome rail that spans the length of the cave. Climb the rail to its end and turn the lip using the smallest holds on the route. Blast the easy finish or enjoy the coveted victory whip.     Beware that sometimes pigeons leave behind some unpleasantness on the rail.,"{107415886: 3, 111808826: 3, 109101477: 3}"
Shits and Giggles,106139129,Trad,105986426,5.12c,0,1,1.0,1.0,This is the route at the left edge of the cave without fixed draws.  Start off the large boulder and climb to the roof.  Move right on medium holds to the flat roof and climb straight out the roof on a thin flake to a lip.  Pull the lip to reach anchors,{106133986: 1}
Color Blind,113828372,Boulder,112276226,V3,0,1,1.0,1.0,The left start of Green envy. Begin standing with jugs on the left.,{200103890: 1}
Green Envy,113828364,Boulder,112276226,V5,0,1,1.0,1.0,Start matched on the slopey lip. Immediately bump into a jug rail and finish straight up.,{200103890: 1}
The Green Traverse,113828343,Boulder,112276226,V3,0,1,2.0,1.0,"Start matched on an obvious rail and traverse a few moves left on side pulls, and then head straight up to the base of the roof. Traverse left, or finish direct on big jugs for a fun and slightly heady top out.",{200103890: 2}
Greener Pastures,113828386,Boulder,112276226,V1,0,1,2.0,1.0,Start on the obvious point. Heel hook left a few moves and mantel.,{200103890: 2}
Shitbutt,112276260,Boulder,112276226,V4,10,1,4.0,1.0,Stand on the ledge at the very bottom and press your thumbs up above your head. Work your way out around the corner and up to the opening. The crux is figuring out the beta.,{109678890: 4}
Mucky-Muck,119218944,Boulder,119218901,V7,0,1,3.0,1.0,"Lowball, but not dabby, with a variety of interesting holds and good movement. Upon topping out, you may not have much to say (being high above the mucky-muck).  Start on the left side arete sitting with right hand on a ear crimp and left hand on a block around the arete. Work your way up the roof using a hard drop knee, a small pinch under the roof, heel hooks, and compression with your left hand (hint, pinch the arete and an iron nipple). Victory jugs lead the way to the somewhat tall, easy topout.  Grade is a guess; possibly harder (or easier I suppose).",{200837641: 3}
The Crescent,107285990,Boulder,107285977,V3,0,1,3.4,77.0,"Everyone loves The Crescent!  This is another must-do for climbers who work this grade range.  Start standing, and edge and step carefully to the finish up and right.     If you are 5'8"" or taller, you can find a secret way that makes it feel v1.  Extra points for those that are shorter.","{200693262: 4, 200287293: 4, 112260466: 4, 108392797: 4, 107292120: 4, 112225989: 4, 112152487: 4, 110708951: 4, 107295126: 4, 110970809: 4, 109764550: 4, 109769660: 4, 111061049: 4, 200428947: 4, 200210810: 4, 200677940: 4, 200549336: 4, 109389640: 4, 200252451: 4, 108886549: 4, 106709875: 4, 109678890: 4, 107671200: 4, 200099747: 4, 200617552: 4, 107552170: 4, 111648247: 4, 111278331: 4, 107513127: 4, 107697400: 4, 107646908: 4, 106047496: 4, 105849172: 4, 108998429: 4, 111014490: 4, 106507389: 4, 109948589: 4, 200157132: 3, 108324869: 3, 200164474: 3, 109152347: 3, 108233790: 3, 106719610: 3, 106329264: 3, 106962174: 3, 200288455: 3, 200630357: 3, 111925488: 3, 111771784: 3, 110382206: 3, 200655277: 3, 108084510: 3, 108092606: 3, 200248498: 3, 108308016: 3, 111465002: 3, 108380929: 3, 108248734: 3, 111610527: 3, 111743986: 3, 111880959: 3, 107360131: 3, 107247400: 3, 111737831: 3, 200185844: 3, 106265516: 3, 107172119: 3, 200319795: 3, 112851025: 3, 109066384: 3, 200125139: 3, 111703228: 2, 108933244: 2, 200411906: 2, 108257055: 2, 200038676: 2, 200202741: 2}"
Quagmire,114167030,Boulder,107285977,V3,0,1,3.0,2.0,"really fun long reaches on perfect crimps, start matched on the lowest edge","{109678890: 4, 107292120: 2}"
Ruthless Arete,120047413,Boulder,107285977,V9,25,1,4.0,1.0,"Possibly the most rewarding boulder I've climbed. Intimidating, difficult, long, and a whole lot of fun. If you like highballs, this is a must. The climb begins on the right side of the arete. Start seated on the far right side of a positive rail. Traverse into the tricky lower crux that is managing some slopers and sticking the arete. Once you finagle your body around the arete, you'll find yourself compressing through some crimps out left and that comfortable, tacky corner. There will be a rest jug about 20 feet up, and one last long lock off blocking the deep sigh of relief that awaits you on the chill topout. ",{200677940: 4}
Safety Cookies,112446492,Boulder,107285977,V4,0,1,3.2,5.0,sit starts on arete just right of Warbonnet move up arete and left onto steep face.,"{200677940: 4, 107292120: 3, 108392797: 3, 112152487: 3, 110970809: 3}"
Unearthed,112354983,Boulder,107285977,V4,0,1,2.0,1.0,"Start on an obvious set of holds, just right of the tree. Work right into a compression sequence, before climbing up in the dihedral for a semi-highball finish.",{108089129: 2}
Warbonnet,107285980,Boulder,107285977,V5,0,1,3.7,90.0,"The best v5 at HCR.  Start sitting, and climb up and slightly right through the overhanging wall.  The hardest moves are before you get to the blunt lip, but the most technical moves are turning the lip and topping out.","{200920316: 4, 109152347: 4, 111061049: 4, 200174291: 4, 200063634: 4, 200380691: 4, 200205291: 4, 200248498: 4, 200216014: 4, 111720345: 4, 111787808: 4, 200089760: 4, 106265516: 4, 108084510: 4, 107246511: 4, 112152487: 4, 110382206: 4, 200428947: 4, 200228218: 4, 200693262: 4, 111703228: 4, 111925488: 4, 112053262: 4, 200549336: 4, 107671200: 4, 109389640: 4, 200282982: 4, 200252451: 4, 109678890: 4, 106821828: 4, 200157132: 4, 200612631: 4, 107971249: 4, 200071074: 4, 108998429: 4, 112851513: 4, 112225989: 4, 106507389: 4, 108265303: 4, 110970809: 4, 109948589: 4, 109467833: 4, 107646908: 4, 108753700: 4, 107292120: 4, 108324869: 4, 108026097: 4, 107009265: 4, 107478705: 4, 106962174: 4, 106047496: 4, 107106012: 4, 12084: 4, 106719610: 4, 107247400: 4, 107677137: 4, 107360131: 4, 109769660: 4, 108248734: 4, 105849172: 4, 109601235: 4, 108067314: 4, 111743986: 4, 112032138: 4, 106822061: 3, 112519290: 3, 110708951: 3, 111597363: 3, 111522632: 3, 200411906: 3, 200677940: 3, 111737831: 3, 109392078: 3, 200288455: 3, 110985244: 3, 107368778: 3, 200038676: 3, 200289693: 3, 200435406: 3, 200287293: 3, 111465002: 3, 108257055: 3, 107430113: 3, 200081616: 3, 109152722: 3, 108043082: 3, 108762832: 3, 109967745: 3, 108380929: 3, 200125139: 2}"
Gateway Arete,112559688,Boulder,112559626,V0,10,1,2.0,3.0,"Sit start on arete of left boulder. compress your way up on good feet and a sharp arete. Top out - well, at the top. Many options for down climb.","{112032138: 3, 112431465: 2, 112225989: 1}"
Phoenix Rising,112559657,Boulder,112559626,V3,11,1,3.0,3.0,"Start on a thin, wide crimp in the middle on the right boulder. Work your way left and transition across the gap to the left boulder. Inside face of left boulder is on, and everything but the inside face on the right boulder is on. Top out on the left boulder, and avoid putting weight on the loose rocks.","{112431465: 3, 112032138: 3, 112225989: 3}"
Thunder and Lightning,112559731,Boulder,112559626,V4,10,1,2.7,3.0,"Same starting crimp as Falcon Rising, but left boulder is off and top-out is at the peak of the right boulder. Work left to the edge of the right boulder, then use the slopey rail at the top to go right towards the top out.","{112431465: 3, 112032138: 3, 112225989: 2}"
Charlie Luu Who,119654846,Boulder,107048801,V0-,0,1,1.0,1.0,"Start sitting on ""Pulpit's"" arete. ",{200655277: 1}
The Chillum,119654286,Boulder,107048801,V0,0,1,2.0,1.0,"Good warm up. Sit start the arete to the right of Glass Bowl, topping out at the end of Glass Bowl.",{200655277: 2}
Glass Bowl,107048805,Boulder,107048801,V10,12,1,4.0,9.0,"Perhaps the best line in Horseshoe Canyon Ranch, Glass Bowl starts sitting and climbs through perfect sandstone edges to a dynamic move to a perfectly sculpted crimp hold.  Follow through more edges, a mono, a sloper and either a dyno to the jug or a hard to hold swing.  Be careful on that mono!","{106170129: 4, 106249336: 4, 106047496: 4, 109467833: 4, 110791013: 4, 200355650: 4, 112225989: 4, 106821828: 4, 110263656: 4}"
Grand Dragon,112847774,Boulder,107048801,V7,0,1,4.0,6.0,"Climb the obvious crimp rail, commit to the lip, and top out. 5 stars, hands down. One of the proudest out there. ","{108252983: 4, 106822061: 4, 112225989: 4, 200287293: 4, 110263656: 4, 200677940: 4}"
Pulpit,120015666,Boulder,107048801,V3,0,1,4.0,1.0,"Start on the left side of the wall on the arete. Traverse on good crimps and top out once the corridor opens up on the right side. There are jugs for the top out, but be careful not to yank on any of the loose rocks up there. Great movement! This thing needs more attention. ",{200188774: 4}
A long road home,114167002,Boulder,106342163,V7,0,1,2.0,2.0,"Kind of fun albeit contrived traverse, Start seated on the far right side of the boulder and traverse left into dig dug and go up on that climb, the high horizontal jug rail is off, stay low through here for the 7 (v5 called the shortcut if you choose to use it), problem may feel soft in the grade, you can choose to continue traversing into dig dug left(top out at the far left of boulder) to make it a bit more difficult","{107292120: 2, 108324869: 2}"
Bottoms Up,106342166,Boulder,106342163,V2,20,1,2.5,57.0,Sit start. Climb the pockets to some slopers over the roof.,"{108108138: 4, 200342704: 4, 109678890: 4, 200190185: 3, 107677137: 3, 107309020: 3, 112924258: 3, 108257055: 3, 200008001: 3, 108933244: 3, 200427185: 3, 108297011: 3, 200093542: 3, 200099747: 3, 112152487: 3, 112157404: 3, 111995484: 3, 107292120: 3, 109222534: 3, 200103049: 3, 105980259: 3, 106153855: 3, 106020029: 3, 111703228: 3, 106047496: 3, 200415327: 3, 106819379: 3, 106838822: 3, 107697400: 3, 111925488: 3, 108308016: 3, 106709875: 2, 107137180: 2, 111771784: 2, 110970809: 2, 200761224: 2, 200411906: 2, 200081616: 2, 106265516: 2, 107385412: 2, 108233790: 2, 107172119: 2, 110755607: 2, 107576881: 2, 110382206: 2, 111743986: 2, 111791264: 2, 110052535: 2, 106226365: 2, 107983034: 2, 107030137: 1, 109152722: 1, 108769438: 1, 110591893: 1, 108248734: 1, 109948589: 1, 107870705: 1}"
Dig Dug,106356523,Boulder,106342163,V4,20,1,3.5,152.0,"Great problem starting down under the overhang right in the middle of the loaf boulder. sds under roof, climb out to sloper finish. Sometimes wet underneath.","{106507389: 4, 107106012: 4, 106521057: 4, 106226365: 4, 105911983: 4, 105849172: 4, 108026097: 4, 108437387: 4, 107309020: 4, 107292120: 4, 108092606: 4, 108238556: 4, 108998429: 4, 111465002: 4, 111014490: 4, 111648247: 4, 108933244: 4, 110970809: 4, 111743986: 4, 107552170: 4, 111791264: 4, 109764550: 4, 111880959: 4, 112152487: 4, 112232604: 4, 110052535: 4, 110708951: 4, 111610527: 4, 112125089: 4, 111684116: 4, 112851513: 4, 112157404: 4, 107347962: 4, 108363126: 4, 110382206: 4, 107360131: 4, 200038676: 4, 107527280: 4, 110642827: 4, 111995484: 4, 106265516: 4, 108964383: 4, 112225989: 4, 108392797: 4, 200081616: 4, 200111640: 4, 200109564: 4, 200216014: 4, 111720345: 4, 111703228: 4, 200382312: 4, 109967745: 4, 200380691: 4, 200415327: 4, 200174291: 4, 200428947: 4, 200424822: 4, 200192295: 4, 200228218: 4, 200160531: 4, 106482590: 4, 107971249: 4, 200612631: 4, 109152347: 4, 200640713: 4, 200384568: 4, 200630357: 4, 106821828: 4, 109678890: 4, 200184844: 4, 200613151: 4, 107671200: 4, 200653259: 4, 200813319: 4, 111597363: 4, 200681024: 4, 112053262: 4, 200761224: 4, 111925488: 4, 200177394: 4, 200411906: 4, 110985244: 4, 111760760: 4, 200677940: 4, 200949059: 4, 106552116: 4, 200920316: 4, 106719610: 3, 107870705: 3, 10244: 3, 105952525: 3, 106153855: 3, 106047496: 3, 107009265: 3, 108233790: 3, 108324869: 3, 107903022: 3, 108043082: 3, 108308016: 3, 108766902: 3, 109222534: 3, 107767899: 3, 108753700: 3, 107385412: 3, 108257055: 3, 109423069: 3, 107172119: 3, 111125618: 3, 109948589: 3, 108067314: 3, 106822061: 3, 111522632: 3, 110591893: 3, 108380929: 3, 107247400: 3, 109392078: 3, 112851025: 3, 108248734: 3, 200125139: 3, 108084510: 3, 200205291: 3, 112147878: 3, 200427185: 3, 200435406: 3, 111061049: 3, 200453927: 3, 200455504: 3, 200146327: 3, 112337532: 3, 105969464: 3, 108886549: 3, 107430113: 3, 200157132: 3, 200651427: 3, 200306716: 3, 200288455: 3, 200252451: 3, 106709875: 3, 200435318: 3, 111771784: 3, 200761279: 3, 200694527: 3, 200248498: 3, 200529738: 3, 200549336: 3, 200693262: 3, 12084: 2, 109152722: 2, 109877052: 2, 108236363: 2, 111541660: 2, 200191884: 2}"
Dig Dug Left,107285944,Boulder,106342163,V4,0,1,2.7,15.0,"Start as per Dig Dug, but head left before you climb over the lip at the end of the roof.     Finish on what is often a dirty topout.   It is not clear to me whether this is usually done with the big slopey jug on. Not using any of the holds on the face felt like v4, too.  Mildly tougher than Dig Dug proper.","{106530923: 4, 105849172: 4, 200109564: 4, 200081616: 3, 111995484: 3, 112232604: 3, 108043082: 3, 106047496: 3, 111925488: 3, 111465002: 2, 108769438: 2, 112152487: 2, 108964383: 2, 200125139: 2, 109152722: 1}"
Fraziac,107285952,Boulder,106342163,V6,0,1,2.7,16.0,"A good v6, with fun moves. It requires consistent body tension for the first several moves before you are established on the face. Great rock, dynamic moves, and certainly worth doing.Crack to the right is considered off for hands and feet, but many argue you can still use it for feet.  The amount one uses the crack (hands, feet,, either, none) affects the grade significantly.","{111597363: 3, 108324869: 3, 112225989: 3, 112147878: 3, 106265516: 3, 112157404: 3, 112232604: 3, 107292120: 3, 112152487: 3, 106047496: 3, 105849172: 3, 108084510: 2, 200038676: 2, 110382206: 2, 108762832: 2, 107870705: 2}"
Hyde,119650428,Boulder,106342163,V0,0,1,1.5,2.0,Climb the slab face up and to the left. Keep the descent rope of the loaf boulder on your left.,"{111703228: 2, 200655277: 1}"
Jekyll,119650470,Boulder,106342163,V-easy,0,1,1.5,2.0,Just left of the arete climb positive and incut holds up the wall. A little mossy. ,"{111703228: 2, 200655277: 1}"
