name,id,type,area_id,grade,height,pitches,score,votes,description,star_ratings
Poison Ivy,105901659,Trad,105901652,5.7+,55,1,3.5,159.0,Climb the ever steepening dihedral crack as it slims from hands/fists to thin hands and fingers.  Classic route on excellent rock.,"{107655814: 4, 105899017: 4, 105886867: 4, 107677137: 4, 106870964: 4, 105990839: 4, 107654077: 4, 107379400: 4, 107874353: 4, 10244: 4, 107646908: 4, 107930775: 4, 106407880: 4, 106482437: 4, 106935843: 4, 106941307: 4, 106744745: 4, 106683773: 4, 106342231: 4, 107041196: 4, 108782221: 4, 108674161: 4, 109325110: 4, 108462136: 4, 108108138: 4, 107146196: 4, 107965009: 4, 111063808: 4, 109485497: 4, 108110589: 4, 111709307: 4, 106751248: 4, 108368607: 4, 107818904: 4, 111321805: 4, 109764550: 4, 111166628: 4, 109206577: 4, 111930649: 4, 107309020: 4, 111166221: 4, 107958782: 4, 112329508: 4, 108392797: 4, 108437909: 4, 111972029: 4, 111737831: 4, 107040811: 4, 200038676: 4, 113509603: 4, 7002067: 4, 106107186: 4, 200138493: 4, 107955776: 4, 200231434: 4, 111622582: 4, 109337948: 4, 200192295: 4, 108886549: 4, 200080399: 4, 200369561: 4, 200066042: 4, 110335247: 4, 200394490: 4, 110038164: 4, 200380691: 4, 107504984: 4, 107977958: 4, 108272772: 4, 200160251: 4, 111888128: 4, 107971249: 4, 200103049: 4, 110584840: 4, 200180573: 4, 113226758: 4, 111231935: 4, 200363210: 4, 200157132: 4, 200288455: 4, 108400997: 4, 200819916: 4, 107638654: 4, 200031545: 4, 108373400: 4, 112304915: 4, 106110467: 3, 107000675: 3, 11344: 3, 107559987: 3, 106032575: 3, 106047557: 3, 106098546: 3, 106122497: 3, 105834083: 3, 107755397: 3, 106172718: 3, 106573189: 3, 107992865: 3, 106252975: 3, 109152722: 3, 107482343: 3, 107870705: 3, 108236363: 3, 109127888: 3, 110213399: 3, 108679988: 3, 109423069: 3, 109561867: 3, 107843504: 3, 109871099: 3, 110008150: 3, 108800901: 3, 108933244: 3, 111014490: 3, 107552170: 3, 111351242: 3, 109726766: 3, 110896657: 3, 110202689: 3, 111610527: 3, 107130713: 3, 110875347: 3, 111752519: 3, 111522632: 3, 107767899: 3, 109765597: 3, 112501870: 3, 107993865: 3, 108154591: 3, 200099747: 3, 112207022: 3, 111696135: 3, 107931921: 3, 200032097: 3, 200220853: 3, 111349407: 3, 200248595: 3, 108084510: 3, 111541660: 3, 108604024: 3, 200443595: 3, 112202693: 3, 109015155: 3, 200647559: 3, 200795369: 3, 112003012: 3, 200300892: 3, 200911703: 3, 200735054: 3, 200981520: 3, 200393716: 3, 107721465: 2, 108243651: 2, 108541430: 2, 111467330: 2, 111687838: 2, 200041845: 2, 111722665: 0}"
Throne Chimney,114219307,Trad,105901652,5.6,50,1,2.5,2.0,"Stem and chimney up, taking care no to go too deep into the chimney. Crux comes toward the beginning before the chimney is narrow enough to sit and scooch your way to the top.","{200180573: 3, 108933244: 2}"
White Lightning,110330635,Sport,105901652,5.10b,45,1,2.7,31.0,To the left of Dry County (11d) is this old head point slab climb which will require a bit more traffic to really clean it off.  Excellent but tricky movement off of the ledge with another crux below the last bolt before the anchors.,"{107504984: 4, 112365139: 4, 107955776: 3, 108933244: 3, 200192295: 3, 108613386: 3, 107971249: 3, 109015155: 3, 11344: 3, 108400997: 3, 200911703: 3, 107677137: 3, 200981520: 3, 110755607: 3, 111709307: 3, 111165216: 3, 109871099: 3, 109206577: 3, 112501870: 3, 108084510: 2, 108886549: 2, 200819916: 2, 200202741: 2, 109127888: 2, 107559987: 2, 112348976: 2, 111014490: 2, 107977958: 2, 108964383: 2, 106751248: 2, 108236363: 2}"
[Redacted],113792838,Sport,105906270,5.11a,55,1,2.2,5.0,"Traverse right from bottom ledge, commit through techs sequence and fire up moderate terrain.","{108679988: 3, 200192295: 3, 107638654: 2, 108373400: 2, 106751248: 1}"
Albino Rhino,105906276,Trad,105906270,5.7+,55,1,2.9,111.0,Climb the dihedral handcrack over a few small bulge-like sections.  This is one of the most popular lead routes at Sam's.,"{107000675: 4, 105899017: 4, 107559987: 4, 106407880: 4, 106079052: 4, 106342231: 4, 111063808: 4, 111722665: 4, 108800901: 4, 111321805: 4, 107309020: 4, 111166221: 4, 107040811: 4, 200041845: 4, 200032097: 4, 200231434: 4, 200103049: 4, 200380691: 4, 110584840: 4, 200180573: 4, 108400997: 4, 110534738: 4, 107886361: 4, 200031545: 4, 200393716: 4, 106870964: 3, 106964179: 3, 107379400: 3, 107874353: 3, 107721465: 3, 105799594: 3, 11344: 3, 107646908: 3, 107930775: 3, 105792229: 3, 106117548: 3, 106671491: 3, 106573189: 3, 106935843: 3, 106744745: 3, 10244: 3, 106683773: 3, 108108138: 3, 107041196: 3, 107755397: 3, 109423069: 3, 108149551: 3, 109871099: 3, 111165216: 3, 110008150: 3, 111709307: 3, 111014490: 3, 107552170: 3, 111351242: 3, 109726766: 3, 109764550: 3, 110202689: 3, 109206577: 3, 109796585: 3, 108886549: 3, 109127888: 3, 108368607: 3, 200138493: 3, 108919190: 3, 200220853: 3, 111349407: 3, 200049904: 3, 200369561: 3, 200322404: 3, 112202693: 3, 112304915: 3, 200099747: 3, 200157132: 3, 200288455: 3, 200647559: 3, 200300892: 3, 107638654: 3, 200928014: 3, 200981520: 3, 200911703: 3, 107677137: 2, 107766313: 2, 106047557: 2, 106122497: 2, 106559186: 2, 106482437: 2, 108782221: 2, 109152722: 2, 109485497: 2, 110213399: 2, 108679988: 2, 110755607: 2, 111593204: 2, 108933244: 2, 110896657: 2, 108236363: 2, 111610527: 2, 106751248: 2, 107958782: 2, 107767899: 2, 200038676: 2, 106107186: 2, 112207022: 2, 107931921: 2, 107955776: 2, 200160251: 2, 111888128: 2, 111231935: 2, 105949578: 1, 106110467: 1, 107843504: 1}"
Chicken House,108420432,Trad,105906270,5.8+,55,1,2.2,6.0,Start up the flake on the left side of the black streak to the ledge. Then follow the obvious holds between the dark and light rock to the anchors shared with 'Past the Jugs' to the right.,"{106751248: 3, 108679988: 3, 108108138: 2, 109871099: 2, 200911703: 2, 111709307: 1}"
Eminence Front,112334830,Trad,105906270,5.10d,60,1,3.0,4.0,Pumpy start and more moderate finish.  Follow the left crack up to the roof for better hands and pro.,"{108894899: 3, 109726766: 3, 108679988: 3, 200212138: 3}"
Facing Up,106259569,Trad,105906270,5.6,50,1,2.7,3.0,Good chimney with some holds in it.,"{108437909: 3, 200068658: 3, 105899017: 2}"
Hitchhiker,113792825,Sport,105906270,5.11b,55,1,2.2,5.0,Follow up easy flake system to short face to small roof with block. Crank through crux and climb crimps to anchors.,"{108626560: 3, 108679988: 2, 106751248: 2, 107638654: 2, 108933244: 2}"
Mandolin Gypsy,106048927,Trad,105906270,5.10,70,1,3.6,7.0,"An imposing face that is much easier than would first appear. The crux is found in the first two bolts, pulling through to the arete. A balancey technical series of moves leads to a good rest and a cam slot.  Above here, what looks to be a blank face reveals large in-cut holds and plenty of protection opportunities.","{12446: 4, 111165216: 4, 106751248: 4, 107638654: 4, 107677137: 3, 108679988: 3, 108613386: 3}"
Overpowered by Funk,119808904,Sport,105906270,5.11c,60,1,2.0,1.0,Pre-clip the second bolt if possible. Make a funky mantle onto a undercut sloping ledge. A low crux leads to a large pocket left of the first bolt. A second crux with small feet and nub crimps lead to a ledge. Cruise jug face sequences to the top. Used to be a mixed route.,{109855183: 2}
Past the Jugs,108420397,Trad,105906270,5.10d,55,1,3.4,16.0,Dark face up to a ledge. Then a small thin flake just left of the dihedral. The crux is a technical sequence between the flake and dihedral.,"{108108138: 4, 200911703: 4, 200192295: 4, 108679988: 4, 109423069: 4, 200288426: 4, 109726766: 4, 107955776: 4, 107638654: 3, 107767899: 3, 106751248: 3, 107130713: 3, 109026628: 3, 107559987: 3, 111972029: 3, 110512167: 2}"
Quantum Leap,106079821,Sport,105906270,5.12a,40,1,2.8,21.0,"If you are lucky enough to own the original Sams Throne guidebook, maybe you have seen or top-roped the line ""Quantum Leap"".  I never did, because I thought it looked contrived and more effort than it was worth to set up the TR.     In the fall of 07, under the encouragement of others, I lead this route and redirected the line to add more climbing, and bolted anchors for those still wanting to TR this dynamic and wild ride. It is the ""Love Slave"" of Sams- very similar to the route of that name at HCR, down river- maybe a little more sustained.","{107965009: 4, 109423069: 4, 108964383: 3, 107040811: 3, 111972029: 3, 200620622: 3, 111431823: 3, 108292652: 3, 106870964: 3, 108679988: 3, 107482343: 3, 108084510: 3, 107677137: 3, 108486993: 3, 12446: 3, 107971249: 3, 107360131: 2, 107931921: 2, 111522632: 2, 107977958: 2, 109871099: 1}"
Rocket Pocket,113792813,Trad,105906270,5.9+,60,1,3.3,15.0,"Start left of crack on crimps, lunge to pocket. Place pro in horizontals...slight run to start route. Crux the crimp start and second crux is at lone bolt. Very fun face route with positve crimps and edges.","{111014490: 4, 107955776: 4, 200191884: 4, 109871099: 4, 108886549: 4, 107638654: 4, 108084510: 4, 111888128: 4, 108373400: 3, 110534738: 3, 108679988: 3, 106751248: 3, 112485774: 2, 200220853: 2, 200981520: 2}"
Sweet Charlie,112532456,Trad,105906270,5.9,60,1,1.7,3.0,Off the ground crux to easier climbing.,"{110534738: 3, 107360131: 1, 106751248: 1}"
Young Buzz,112532418,Trad,105906270,5.9,60,1,1.3,3.0,Thin seam with the crux off the ground to easy climbing.,"{200192295: 2, 107360131: 1, 106751248: 1}"
Zion Ray,106079811,Sport,105906270,5.13a,40,1,2.0,2.0,"A vicious boulder problem crux leads to fun, reachy and pumpy finish. The rock is solid and a bright, beautiful orange.","{12446: 4, 106838822: 0}"
November Daze,106065021,Trad,105905102,5.12a,50,1,3.0,2.0,"Close your eyes.     Sniff the air.     Imagine you are at Sams Throne, Arkansas. It's mid November and you know what you smell. The pungent waft of pine needles mixed with moist soil and lichen crusted rock. The sun and wind collide to create a warm breeze that makes old men nostalgic and young men flex their muscles. It's Autumn in the Boston Mountains, and you are shouldering your pack, filled with shiny toys crafted with the intent of empowering your adventures.     If you have a shred of honesty in your bones, you know this is the best thing you have ever experienced, and tomorrow will be even better. Leaves crunch under your feet like bubble wrap, and float through the air at the encouragement of the ever present breezes. A gust sends them shooting skyward and the sky fills with the colors of decaying perfection.    Your grin and far off stare declare your November Daze.    I emerge from my daze and start heading upwards from the cave on the east side of the Throne Proper. My belayer in a daze himself, nodding and grinning to some inner nymph orchestrated music; the dogs prostrate, playing dead in a heap of twigs and maple leaves.    Campus moves initiate the adventure, escaping terra firma with feet dangling like a child from monkey bars. Not far from the truth. ""What the heck do I rate that?"" I ask Jesse. 5.7 or 5.11? It's creepy, but fun. Do-able, but fairly frightening. Jesse later breaks off the starting holds while following. Good thing I didn't or I would have rolled into the forest head over heels.    After getting established on the face, pro can be had and a breath of composure. The next moves are fun, and moderate, leading up towards the steep face above. Gear is specific and not many options present themselves. Take your time and find it, because every placement counts. Don't worry, it's bomber.    A few moves to the right avoids the absolute blankness, then back left into the line again,  finding a hidden horizontal slot for a 1/2 inch cam. From this rail, a long moves leads to a pocket and a lone bolt. Clip this and encounter the crux moves above, then top out in a November Daze, surrounded by a swirling hillside of oranges, reds and yellows, with blue tipped hills fading in the background, beckoning you to come and find what they have to offer.    Clip the anchors, look out across the valley...    Sniff the air.","{12446: 3, 111972029: 3}"
Spring Break,111001971,Sport,105905102,5.8-,40,1,2.2,14.0,"Climb on nice jugs. Easy, short sport route.","{111063808: 4, 107504984: 3, 109337948: 3, 200192295: 3, 200041845: 2, 106378291: 2, 106751248: 2, 111166221: 2, 108933244: 2, 111709307: 2, 110008150: 2, 109684456: 2, 108679988: 1, 200099747: 1}"
"Stairway to Heaven (aka - Sonya, Tonya.  What's the Difference?)",105905105,Trad,105905102,5.7,50,1,2.1,28.0,"Climb the thin crack and face up slightly slabby, good rock.","{107379400: 3, 105899017: 3, 108108138: 3, 106964179: 3, 106122497: 3, 106683773: 3, 111709307: 2, 111166221: 2, 200038676: 2, 106107186: 2, 107000675: 2, 200231434: 2, 200220853: 2, 107041196: 2, 200066042: 2, 108933244: 2, 107755397: 2, 11344: 2, 106870964: 2, 107559987: 2, 112202693: 2, 107874353: 2, 108782221: 2, 110213399: 2, 109684456: 2, 106047557: 1, 106751248: 1, 108679988: 1}"
[Redacted],105906511,Trad,105906330,5.5,45,1,2.3,47.0,Climb the face on the right side of the dihedral using the numerous chickenheads.  Decent rock.,"{200300892: 4, 200231434: 4, 111166221: 4, 107040811: 4, 112530455: 3, 200032097: 3, 111349407: 3, 200109969: 3, 106107186: 3, 200041845: 3, 108679988: 3, 108108138: 3, 112202693: 3, 107041196: 3, 106964179: 3, 112003012: 3, 108933244: 3, 106342231: 3, 200180573: 3, 200647559: 2, 111888128: 2, 200160251: 2, 108084510: 2, 200080399: 2, 200911703: 2, 108154591: 2, 109152722: 2, 108674161: 2, 106683773: 2, 109325110: 2, 110008150: 2, 107379400: 2, 111014490: 2, 111321805: 2, 111930649: 2, 112326099: 2, 106378291: 2, 107677137: 2, 200103049: 2, 108782221: 2, 107874353: 1, 106482437: 1, 105899017: 1, 106751248: 1, 111709307: 1, 200149795: 1, 200038676: 1}"
Boston Rag,105906498,Trad,105906330,5.7,60,1,2.9,97.0,Climb the handcrack that narrows to a fingercrack up the slightly slabby wall.  Finish on chickenheads.  Good rock.,"{200380691: 4, 111593204: 4, 106107186: 4, 200394490: 4, 108108138: 4, 108368607: 4, 200231434: 4, 200192295: 4, 200369561: 4, 106482437: 4, 107955776: 4, 105899017: 4, 200031545: 4, 200911703: 4, 111166221: 4, 107181150: 4, 107309020: 4, 11344: 4, 110202689: 4, 200099747: 3, 107958782: 3, 200109969: 3, 111727692: 3, 108154591: 3, 112530455: 3, 107040811: 3, 111737831: 3, 108449569: 3, 108919190: 3, 109849711: 3, 107041196: 3, 107504984: 3, 200288455: 3, 111231935: 3, 111888128: 3, 200160251: 3, 112202693: 3, 110335247: 3, 200080399: 3, 109871099: 3, 200300892: 3, 108886549: 3, 200032097: 3, 111349407: 3, 111622582: 3, 200981520: 3, 108392797: 3, 107677137: 3, 109127888: 3, 110523107: 3, 107755397: 3, 107482343: 3, 109325110: 3, 108674161: 3, 108782221: 3, 106744745: 3, 200103049: 3, 107874353: 3, 107000675: 3, 107379400: 3, 106122497: 3, 106964179: 3, 107654077: 3, 107559987: 3, 107146196: 3, 108679988: 3, 109548191: 3, 111014490: 3, 109764550: 3, 107552170: 3, 109206577: 3, 108541430: 3, 111930649: 3, 109423069: 3, 109561867: 3, 109485497: 3, 200038676: 2, 108933244: 2, 200157132: 2, 200647559: 2, 106870964: 2, 106047557: 2, 110755607: 2, 105986767: 2, 106751248: 2, 108084510: 2, 108236363: 2, 107993865: 2, 109026628: 2, 112329508: 2, 112207022: 2, 111709307: 2, 106941307: 2, 106172718: 2, 110896657: 1, 109152722: 1, 200239144: 1}"
Chimney Up and Down,111084866,Trad,105906330,5.6,40,1,2.5,8.0,Good practice chimney with easy stemming the whole way up.,"{108800901: 3, 111709307: 3, 200041845: 3, 108919190: 3, 200032097: 3, 108084510: 3, 106751248: 1, 200362284: 1}"
Diagonal Crack,105906507,Trad,105906330,5.7,40,1,2.8,81.0,"Climb the arete on the left side of the walkup.  Head up and left in the diagonal crack, which starts 15 feet up.  Follow it on good rock to the top.","{200231434: 4, 112348976: 4, 200192295: 4, 108368607: 4, 111722665: 4, 112530455: 4, 105899017: 4, 109765597: 3, 108919190: 3, 107955776: 3, 200041845: 3, 111166221: 3, 107041196: 3, 108154591: 3, 111752519: 3, 111972029: 3, 111737831: 3, 200911703: 3, 111622582: 3, 200031545: 3, 200735054: 3, 200185065: 3, 110534738: 3, 110755607: 3, 200160251: 3, 112202693: 3, 200380691: 3, 200239144: 3, 110335247: 3, 200032097: 3, 200080399: 3, 108886549: 3, 109206577: 3, 107559987: 3, 107755397: 3, 108462136: 3, 107482343: 3, 107379400: 3, 108782221: 3, 108108138: 3, 106342231: 3, 200647559: 3, 106117548: 3, 107721465: 3, 107874353: 3, 107677137: 3, 107654077: 3, 108679988: 3, 111593204: 3, 107552170: 3, 109423069: 3, 110896657: 3, 106751248: 3, 109764550: 3, 108236363: 3, 107561580: 3, 111165216: 3, 111100213: 2, 106482437: 2, 108392797: 2, 200751388: 2, 108084510: 2, 107977958: 2, 107000675: 2, 106172718: 2, 109871099: 2, 106683773: 2, 106107186: 2, 107958782: 2, 200038676: 2, 108933244: 2, 111349407: 2, 111709307: 2, 109026628: 2, 109127888: 2, 112315873: 2, 108449569: 2, 108604024: 2, 109849711: 2, 200057621: 2, 112329508: 1}"
Fat Crack,105906503,Trad,105906330,5.6,45,1,2.2,29.0,Climb the wide crack 45 feet on good rock to the top.,"{105899017: 3, 200041845: 3, 107955776: 3, 108800901: 3, 108541430: 3, 109561867: 3, 107482343: 3, 200032097: 3, 110534738: 3, 112530455: 3, 200288455: 3, 106671491: 3, 108933244: 2, 200103049: 2, 106107186: 2, 109849711: 2, 110202689: 2, 200038676: 2, 111737831: 2, 106047557: 2, 107874353: 2, 107041196: 2, 107818904: 2, 110896657: 2, 107993865: 2, 107755397: 1, 106751248: 1, 106482437: 1, 107379400: 1, 107677137: 1}"
Hold my Beer I got this,116603355,Trad,105906330,5.8-,30,1,2.5,4.0,Protection is small but solid. With fun edges and pinches,"{107965142: 3, 200401653: 3, 112329508: 2, 200911703: 2}"
Lazy Arch,108895610,Trad,105906330,5.7,50,1,2.5,6.0,Climb a crack with face holds up to a ledge at about 20 ft. Plug in a #2bd in the weird hole/pocket. Move left and cruise up the face roughly 10 ft. left of the outside corner. There is one spot between the ledge and the top that accepts gear. Don't miss it. Move left to anchors which is 2 bolts with only 1 hanger. The nut is on the other bolt so you can use a wire. Walk right to another set of anchors to rappel. Nice little route with a heady finish.,"{107993865: 3, 106751248: 3, 112304915: 3, 107755397: 2, 107041196: 2, 108679988: 2}"
Local Honey,106048889,Trad,105906330,5.9,65,1,2.5,10.0,"Start on a fallen ledge below a brown bolt. Pull the crux, then head up a nice clean face to the upper headwall. A couple fun, reachy moves lead to another bolt.  Pull through the blocky ledges above to an anchor.","{111166221: 4, 12446: 3, 108368607: 3, 108933244: 3, 109325110: 3, 108679988: 2, 107755397: 2, 109152722: 2, 107041196: 2, 106751248: 1}"
Mouse Trap,112324088,Trad,105906330,5.10b,0,1,3.0,1.0,"Although rarely done, this route climbs quite well. Follow a thin crack up to a juggy horizontal, place awkward pro, then commit to the crux sequence up the thin seam. Follow larger holds with great horizontals up the pumpy headwall.",{107041196: 3}
New York Minute,111441026,Trad,105906330,5.8,50,1,2.8,21.0,Low crux protected by one bolt leads to a great jug lined arête.,"{200231434: 4, 111166221: 4, 108084510: 3, 111014490: 3, 108933244: 3, 200192295: 3, 107181150: 3, 111622582: 3, 112207022: 3, 106107186: 3, 108368607: 3, 106751248: 3, 109206577: 3, 108679988: 3, 107958782: 3, 111349407: 2, 107041196: 2, 107755397: 2, 112003012: 2, 109015155: 2, 200911703: 1}"
Step Up,111421090,Trad,105906330,5.7,50,1,2.4,10.0,Climb up to the lone bolt then slightly left to the arête.  Follow the jugs to the top.,"{111166221: 4, 200288455: 3, 200032097: 3, 109015155: 2, 108679988: 2, 108084510: 2, 106751248: 2, 107041196: 2, 107755397: 2, 200300892: 2}"
Tandem Slide aka Last Waltz,110866437,Trad,105906330,5.9+,40,1,3.1,28.0,"Left most route on White Trash Wall. Starts right of the arête, up the crack system on good holds, and pull onto the steep bulge.","{112530455: 4, 200080399: 4, 107993865: 4, 107955776: 4, 200032097: 4, 110335247: 4, 110755607: 4, 200239144: 3, 200288455: 3, 11344: 3, 107977958: 3, 108373400: 3, 108368607: 3, 112315873: 3, 108679988: 3, 110008150: 3, 107561580: 3, 106751248: 3, 109423069: 3, 107041196: 3, 108613386: 3, 111737831: 3, 107504984: 3, 200819916: 2, 113509603: 2, 200038676: 2, 108886549: 2, 109152722: 2}"
Total Trash,113792789,Trad,105906330,5.12a,40,1,2.7,3.0,Boulder crux start to good positve hold 15' up. Continue on good hold and beer left towards Tandem Slide anchors.,"{108679988: 3, 11344: 3, 111972029: 2}"
White Trash,106654461,Trad,105906330,5.9+,40,1,3.0,40.0,"Start in the wide corner and work left at the low horizontal. Quickly move through the fun, technical face on small, sloping ledges, making for one or two somewhat strenous gear placements. Recoup on the large ledge before tackling the finishing roof where the extended anchor chains can be clipped before committing to the finishing moves.","{108373400: 4, 111722665: 4, 200032097: 4, 107040811: 4, 108108138: 4, 112557187: 4, 112003012: 3, 108368607: 3, 200911703: 3, 200080399: 3, 113509603: 3, 111622582: 3, 109849711: 3, 111888128: 3, 108613386: 3, 108084510: 3, 107977958: 3, 107504984: 3, 108400997: 3, 11344: 3, 105909326: 3, 108392797: 3, 107930775: 3, 106172718: 3, 106573189: 3, 107482343: 3, 107146196: 3, 108679988: 3, 109423069: 3, 111014490: 3, 110008150: 3, 106751248: 3, 107561580: 3, 105986767: 2, 106941307: 2, 106744745: 2, 106107186: 2, 107870705: 2, 109152722: 2, 108886549: 1}"
White Trash Direct,114502950,Trad,105906330,5.12b,40,1,2.0,1.0,Climb the cryptic and bouldery crux on sharp crimps and pockets to the large horizontal crack 15' up where white trash traverses in from the right. Finish with the relatively easy 5.9+ crux of white trash.,{111972029: 2}
You Crack Me Up,117033048,Trad,105906330,5.8+,40,1,2.2,5.0,Low unprotected crux to a thin crack. Crack to small ledge then right share anchor with Diagonal Crack.,"{11344: 3, 111349407: 2, 107755397: 2, 107977958: 2, 200911703: 2}"
Arachnophobia,106179004,Trad,105903609,5.8,80,1,2.3,7.0,"Climb the slab, angling a little right, to access the crack. Pull up into the crack, over a bulge, and to the top on more vertical rock. Good rock. Had a little lichen and many spiderwebs when I did it. ","{107559987: 3, 111351242: 3, 108084510: 3, 105899017: 2, 106553484: 2, 108449569: 2, 108236363: 1}"
Burning Bridges,112324055,Trad,105903609,5.10a,0,1,2.0,2.0,"This overhanging dihedral has plenty of feet, openings, and positive crimps to keep the climbing interesting and engaging while still a moderate 10a. Climb the wide crack through a large horizontal break. crimp up to the large opening that accepts a #5, then climb above your gear from opening to opening. When the dihedral returns to vertical, mantle onto a small ledge, and finish the climb on blocky lie-backs to the anchors out right.","{107041196: 2, 108373400: 2}"
Chockstone Press,106179017,Trad,105903609,5.10c,80,1,3.0,1.0,"Climb the thin crack up to the dihedral on pretty good rock. Pull through the dihedral, then head up and right to gain the dihedral crack that widens into the roof. At the roof chimney, squeeze behind the first chockstone. It may wiggle a little. End on the clifftop above. Good rock, overall, but catch it when it's dry. ",{105899017: 3}
The Couch Potato,105903612,Trad,105903609,5.9-,95,1,2.9,14.0,"Climb 20 feet up a dirty slab, starting left of the groove.  Angle right and gain the diagonal crack.  Follow it up and righ until it ends after about 30 feet.  Then, continue up on face climbing, pulling a spicy top out on decent rock.  The rock in between the slab and the top out is excellent.","{105899017: 4, 109871099: 4, 107559987: 3, 108933244: 3, 110202689: 3, 107041196: 3, 108236363: 3, 107755397: 3, 108368607: 3, 108373400: 3, 110755607: 2, 108392797: 2, 107638654: 2, 109152722: 2}"
Diet Pepsi,105903618,Trad,105903609,5.9+,70,1,3.7,30.0,"Climb the slightly steeper than vertical handcrack 15 feet to the ledge.  From here, climb the offwidth dihedral as it widens slightly as you get higher.  Pull around the right side of the triangular roof, continuing in the crack past a small tree.  Go around the left side of the tree, if you aren't too sketched, to reduce rope drag.  5 more feet of face climbing gets you to the anchors.  Awesome rock, awesome climb!","{105899017: 4, 111687838: 4, 108236363: 4, 109127888: 4, 107992865: 4, 108541430: 4, 111690225: 4, 112083997: 4, 200138493: 4, 200445651: 4, 200288455: 4, 107638654: 4, 112329508: 4, 109206577: 4, 107755397: 4, 106115924: 4, 107041196: 4, 108368607: 4, 107559987: 4, 108437909: 4, 109871099: 4, 111709307: 4, 200981520: 4, 111722665: 3, 109152722: 3, 108895420: 3, 106751248: 3, 108604024: 3, 110584840: 3, 107955776: 1}"
Exit Wound,105998558,Trad,105903609,5.12,75,1,1.0,1.0,"A fine delicacy. I felt like I was climbing up the underside of a large, delicate mushroom on the vertical section.  Once you reach the monster roof and look out though, this mushroom turns into a snarling flesh consuming man-eater. Gnarly sequences lead through the flaring  exit into a bombay squeeze chimney. Think ""one-move-wonder-boulder-problem-chimney-thrash"".",{12446: 1}
Flesh and Bone,105903625,Trad,105903609,5.9,70,1,3.0,1.0,"The best start is the fistcrack on the right.  Climb up it, being careful of brittle rock.  Make your way up and left to the roof crack.  Jam your way over the roof and continue to the top in the crack.  Good rock at the roof and above.",{105899017: 3}
Love Boat,112315761,Trad,105903609,5.9,55,1,2.0,2.0,"Climb through initial overhang, cruise to top on right side of arête.","{108679988: 2, 111165061: 2}"
Ophidiphobia,106259576,Trad,105903609,5.11a,65,1,3.3,4.0,"Climb the starting hand/fistcrack of Diet Pepsi.  At the ledge, traverse right to the angling rail which leads under the roof.  Climb the handcrack in the roof back to the left, pulling over on jams and holds to a welcome ledge.  Climb the face with tricky gear and a few tricky moves to the bolts on Diet Pepsi.","{106785610: 4, 105899017: 3, 107041196: 3, 108895420: 3}"
