name,id,type,area_id,grade,height,pitches,score,votes,description,star_ratings
Petrified,108106343,Sport,119258598,5.12a,40,1,2.1,73.0,"Get situated on the high starting holds, a small cluster of pockets, and power through the short overhanging crux. Most people will want to stickclip the first bolt. A few more moves of lesser difficulty get you over a bulge and out of the pumpy terrain. Fun and interesting jug pulling will take you to the top.","{200439892: 4, 200192295: 4, 112152487: 3, 108773303: 3, 110930905: 3, 112505301: 3, 108865746: 3, 109623432: 3, 106997170: 3, 110335247: 3, 107677137: 3, 107292120: 3, 200130915: 3, 111584423: 3, 200330729: 3, 200511427: 3, 107977958: 2, 112501870: 2, 200157132: 2, 106810689: 2, 200677940: 2, 111972029: 2, 200175486: 2, 111931619: 2, 107931921: 2, 111732907: 2, 108084554: 2, 106860947: 2, 112207022: 2, 200615388: 2, 200101945: 2, 200062165: 2, 106552116: 2, 111602059: 2, 108043082: 2, 111664966: 2, 111503950: 2, 111761358: 2, 109877052: 2, 107106012: 2, 107814780: 2, 110391698: 2, 15142: 2, 108998429: 2, 108363077: 2, 107172119: 2, 108257055: 2, 108084510: 2, 108046773: 2, 200124910: 2, 111061049: 2, 107767899: 2, 111808826: 2, 111803688: 2, 107870705: 2, 108679988: 2, 108886549: 2, 112283425: 2, 110500610: 2, 107971249: 2, 200146075: 1, 109152722: 1, 108089129: 1, 200191884: 1, 108604024: 1, 112147878: 1, 108964383: 1, 107638654: 1, 111522632: 1, 112403472: 1, 200635868: 1, 106870964: 1, 200160531: 1}"
Piratas Putas,107822754,Sport,119258598,5.7,40,1,1.6,39.0,"Start on right angled ramp. Route goes to the right, shares anchors with Narwal. Needs a little cleaning from more traffic.","{107993865: 3, 7081357: 3, 200494455: 3, 200103049: 3, 111737831: 2, 111013333: 2, 107434457: 2, 112202693: 2, 112025009: 2, 200255574: 2, 107767899: 2, 112924258: 2, 111806823: 2, 107420433: 2, 108592931: 2, 200676932: 2, 111321805: 2, 108046773: 2, 108027100: 2, 111709307: 2, 110345681: 2, 108108138: 2, 200412484: 1, 107638654: 1, 108679988: 1, 108437387: 1, 108324869: 1, 107096937: 1, 107137180: 1, 110321764: 1, 107250655: 1, 111349407: 1, 108933244: 1, 110052535: 1, 111825718: 1, 200099747: 1, 109711410: 1, 112209682: 1, 108604024: 0}"
Playing Hooky,108765215,Sport,119258598,5.8+,50,1,2.3,35.0,Starts on rightside of low roof. Starts on low angle rock and it transitions to jug haul.,"{111825718: 3, 112152487: 3, 108604024: 3, 106809240: 3, 112501870: 3, 200412484: 3, 110148614: 3, 111703228: 3, 110185328: 3, 110345681: 3, 108592931: 3, 111891854: 2, 111771784: 2, 108392797: 2, 111806823: 2, 107234204: 2, 200099747: 2, 107638654: 2, 108236507: 2, 108121274: 2, 107137180: 2, 108046773: 2, 109711410: 2, 108324869: 2, 107843504: 2, 200918183: 2, 111967377: 2, 111321805: 2, 108933244: 2, 111349407: 2, 111737831: 2, 111166221: 2, 108679988: 2, 109101477: 1, 110591893: 1}"
Poetry in Goshen,109419470,Trad,119258598,5.6,50,1,1.3,7.0,"It's the overhanging offwidth that fors the Crimp Scampi wall. However, instead of climbing the offwidth ( this route, Poetry in Goshen Original is a 5.9), climb the face holds that form the dihedral.","{108046773: 2, 112025009: 2, 108679988: 1, 107137180: 1, 111776506: 1, 107677137: 1, 108604024: 1}"
The Poison Ivy Route,109635743,Trad,119258598,5.7,40,1,1.9,14.0,Obvious crack just to the right of Mossy Revelations which is the left angled dihedral.,"{200683545: 3, 111653221: 3, 113306774: 3, 108108138: 2, 108046773: 2, 200125170: 2, 107638654: 2, 200099747: 2, 111720779: 2, 109871099: 1, 107041196: 1, 111166221: 1, 200157132: 1, 107137180: 1}"
Private Property,105977938,Sport,119258598,5.10a,55,1,3.0,220.0,Start on a large flake and climb past a short crack and an overhang.  Finish on large holds to the anchor.,"{107247400: 4, 107347962: 4, 10244: 4, 107090397: 4, 106047557: 4, 106064138: 4, 106122497: 4, 106889145: 4, 106407880: 4, 106342231: 4, 106658006: 4, 106746350: 4, 106412654: 4, 107903022: 4, 108592931: 4, 107573329: 4, 107562472: 4, 108708700: 4, 109404815: 4, 111029678: 4, 110227557: 4, 112169218: 4, 200158477: 4, 111166221: 4, 108363126: 4, 111252595: 4, 109816060: 4, 110148614: 4, 111664966: 4, 200274130: 4, 200317019: 4, 112025009: 4, 200419558: 4, 200255574: 4, 110755607: 4, 200441928: 4, 109468689: 4, 111704941: 4, 200180573: 4, 107977958: 4, 111703228: 4, 200418463: 4, 111810534: 4, 110985244: 4, 200374821: 4, 200061347: 4, 200418465: 4, 107451356: 3, 106494476: 3, 107655814: 3, 106257217: 3, 105899017: 3, 107146196: 3, 107594314: 3, 106224066: 3, 106084734: 3, 106344911: 3, 106018444: 3, 106279343: 3, 12690: 3, 106192059: 3, 106397425: 3, 106842382: 3, 105914540: 3, 107004362: 3, 106744745: 3, 106574818: 3, 107269146: 3, 107130713: 3, 107362202: 3, 106860947: 3, 108017825: 3, 107697400: 3, 108046773: 3, 107178254: 3, 107816900: 3, 108110953: 3, 108125580: 3, 108233790: 3, 107498273: 3, 107564993: 3, 107096937: 3, 108324869: 3, 108679988: 3, 108782221: 3, 108077542: 3, 108084510: 3, 106089213: 3, 107870705: 3, 109500125: 3, 108108138: 3, 108121274: 3, 109840473: 3, 108933244: 3, 109711410: 3, 110052535: 3, 110296709: 3, 109881112: 3, 109871099: 3, 108390129: 3, 108363077: 3, 110883429: 3, 110391698: 3, 108755979: 3, 107755397: 3, 106552116: 3, 110087433: 3, 109252158: 3, 107749195: 3, 111720345: 3, 108368607: 3, 111597819: 3, 108841484: 3, 111478097: 3, 106751248: 3, 112142545: 3, 108331507: 3, 111163750: 3, 111827684: 3, 106195833: 3, 106172063: 3, 109206577: 3, 112501870: 3, 111321805: 3, 107971249: 3, 111711778: 3, 112202693: 3, 200096552: 3, 107920500: 3, 108886549: 3, 200138493: 3, 200157132: 3, 200138749: 3, 108092606: 3, 108392797: 3, 110726946: 3, 200102386: 3, 200141592: 3, 108744559: 3, 200130915: 3, 200146376: 3, 200200725: 3, 106588732: 3, 112233990: 3, 108254304: 3, 110767291: 3, 200205291: 3, 109849711: 3, 108604024: 3, 107691094: 3, 112329508: 3, 110038164: 3, 200413562: 3, 200374946: 3, 111737831: 3, 111050645: 3, 111895157: 3, 113306774: 3, 200168034: 3, 107147231: 3, 200463576: 3, 108236507: 3, 200127868: 3, 107638654: 3, 200099747: 3, 112505301: 3, 200578660: 3, 200274148: 3, 200378564: 3, 108043082: 3, 112207022: 3, 200252451: 3, 200683545: 3, 200103049: 3, 200162303: 3, 109353144: 3, 200633266: 3, 200751388: 3, 200476847: 3, 200407341: 3, 200444478: 3, 107041196: 3, 200031545: 3, 200918183: 3, 111891854: 3, 200911703: 3, 200327167: 3, 200615388: 3, 12084: 2, 106870829: 2, 106441391: 2, 106683773: 2, 108037799: 2, 108027100: 2, 108030106: 2, 107767899: 2, 109152722: 2, 107137180: 2, 107377680: 2, 108236363: 2, 107677137: 2, 110202689: 2, 108571769: 2, 111308878: 2, 108110589: 2, 200093072: 2, 200101945: 2, 109101477: 2, 112338487: 2, 200292934: 2, 112387423: 2, 111806823: 2, 109692317: 2, 112304915: 2, 200393716: 2, 106964179: 1, 108257055: 1, 110534294: 1, 108314447: 0, 109052547: 0}"
Pulp Fiction,108859361,Sport,119258598,5.8+,40,1,2.0,28.0,"(From new guidebook) Climb on small holds up low-angled rock to jug haul.  Finish on anchor of The Bulb.  (However, I recall it having it's own anchor when I climbed it last weekend.)","{111013333: 3, 111809681: 3, 108108138: 3, 108390129: 3, 106889145: 2, 200099747: 2, 107434457: 2, 111321805: 2, 111895157: 2, 108236507: 2, 112387423: 2, 107638654: 2, 111806823: 2, 111737831: 2, 111349407: 2, 108978469: 2, 107130713: 2, 107137180: 2, 108679988: 2, 112209682: 2, 109022366: 2, 108046773: 2, 110784307: 2, 110003938: 2, 108392797: 1, 107377680: 1, 106299993: 1, 108604024: 1}"
Roman Says,109567130,Sport,119258598,5.9,45,1,2.4,17.0,A nice line up the orange streak that starts with a small roof.,"{110959609: 3, 107041196: 3, 112387423: 3, 200099747: 3, 112152487: 3, 108108138: 3, 111737831: 2, 110985244: 2, 108604024: 2, 108046773: 2, 107638654: 2, 108679988: 2, 200071074: 2, 108236507: 2, 108392797: 2, 111827684: 2, 107137180: 2}"
Roman's Empire,109567301,Sport,119258598,5.10a,25,1,2.5,15.0,"Starting in a shallow dihedral, move through some delicate moves before gaining jugs to the top of the wall.","{200255738: 3, 200099747: 3, 111653221: 3, 200523166: 3, 109468689: 3, 113306774: 3, 200248540: 3, 108046773: 3, 108886549: 2, 107638654: 2, 108121274: 2, 110985244: 2, 111810534: 2, 107137180: 2, 109871099: 1}"
The Romaniac,109567319,Sport,119258598,5.10c,30,1,1.9,9.0,Start up to gain a ledge and continue to the top.,"{113306774: 3, 109468689: 3, 108046773: 2, 108679988: 2, 107638654: 2, 111653221: 2, 107137180: 1, 108886549: 1, 108121274: 1}"
Scrambled Eggs,108210943,Sport,119258598,5.8-,60,1,1.8,38.0,Fun route on easy climbing.,"{110052535: 3, 200965535: 3, 200208328: 3, 200494455: 3, 200578660: 3, 109881112: 2, 111809681: 2, 108483316: 2, 108314447: 2, 107434457: 2, 200101945: 2, 200140624: 2, 112025009: 2, 107638654: 2, 108057626: 2, 110003938: 2, 200709499: 2, 108679988: 2, 108708700: 2, 108046773: 2, 109871099: 2, 110058968: 2, 107843504: 2, 110202689: 2, 106536997: 2, 107229353: 1, 107041196: 1, 107096937: 1, 107573329: 1, 107600470: 1, 108236507: 1, 108604024: 1, 112070348: 1, 200099747: 1, 109052547: 1, 111166221: 1, 107729190: 1, 111891854: 1}"
Seaana Says,108764826,Sport,119258598,5.11c,30,1,2.6,39.0,"Overhanging start on small roof. Crux is down low, very bouldery. Jug haul after crux. You can either dyno at crux or do it static style. Permadraws all the way up, anchors at the top as of May 2018.","{112315873: 4, 108998429: 4, 111901865: 4, 108057626: 4, 108679988: 3, 111732907: 3, 112152487: 3, 112233521: 3, 111931619: 3, 108865746: 3, 107977958: 3, 106121156: 3, 200227692: 3, 109881112: 3, 111737831: 3, 107563159: 3, 108257055: 3, 108046773: 3, 107646908: 3, 111431823: 3, 110689679: 2, 111597363: 2, 109152722: 2, 200384568: 2, 200062165: 2, 108084510: 2, 107870705: 2, 106860947: 2, 110985244: 2, 200228218: 2, 110500610: 2, 112283425: 2, 109548191: 2, 112138790: 2, 108886549: 2, 108604024: 2, 108766902: 2, 111522632: 1, 107931921: 1}"
Season of the Storm,106269043,Sport,119258598,5.10a,65,1,3.0,233.0,Starts on big Horseshoe Jugs and then works up to the crux on the slab and then pull through to the top on jugs.,"{106819379: 4, 107697400: 4, 108046773: 4, 108755979: 4, 108362364: 4, 108108138: 4, 110502068: 4, 109871099: 4, 110690111: 4, 111402787: 4, 110194355: 4, 111168972: 4, 110534294: 4, 111598632: 4, 111478097: 4, 110502374: 4, 111166221: 4, 111891854: 4, 111984723: 4, 109052547: 4, 200158477: 4, 200163569: 4, 108248734: 4, 112260466: 4, 109816060: 4, 107971249: 4, 112070348: 4, 200340525: 4, 200099747: 4, 200292934: 4, 112025009: 4, 108998429: 4, 200192295: 4, 112202693: 4, 200180573: 4, 200200801: 4, 106248405: 4, 109353144: 4, 200633266: 4, 200185065: 4, 200887865: 4, 200374821: 4, 200965535: 4, 200593991: 4, 200555953: 4, 109305902: 4, 200709499: 4, 107451356: 3, 107677137: 3, 107090397: 3, 107788681: 3, 107009265: 3, 107974281: 3, 106242770: 3, 106407880: 3, 106397425: 3, 106739328: 3, 106683773: 3, 106860947: 3, 107269146: 3, 107347224: 3, 107576881: 3, 107178254: 3, 107816900: 3, 106903709: 3, 107096937: 3, 108057626: 3, 107607908: 3, 107814780: 3, 108324869: 3, 107406726: 3, 108437387: 3, 108679988: 3, 108055813: 3, 107573329: 3, 107147231: 3, 106889145: 3, 108368607: 3, 110052535: 3, 110185328: 3, 109881112: 3, 110202689: 3, 108292652: 3, 107600470: 3, 108363077: 3, 111155869: 3, 108207341: 3, 108939652: 3, 108736782: 3, 111606819: 3, 109396884: 3, 108933244: 3, 111597819: 3, 108571769: 3, 110890500: 3, 108773303: 3, 107041196: 3, 107390101: 3, 112124233: 3, 108110589: 3, 107800096: 3, 110003938: 3, 111610527: 3, 109423069: 3, 112275337: 3, 111703228: 3, 111315718: 3, 108392797: 3, 107292120: 3, 111752519: 3, 111031033: 3, 111522632: 3, 109127888: 3, 106195833: 3, 111893262: 3, 111972029: 3, 106172063: 3, 111929098: 3, 111321805: 3, 200061691: 3, 110437123: 3, 200096552: 3, 200093072: 3, 112555409: 3, 108314447: 3, 200127893: 3, 108886549: 3, 108373400: 3, 111127829: 3, 111709307: 3, 108579612: 3, 111825718: 3, 200157132: 3, 112173761: 3, 107691094: 3, 107246511: 3, 110726946: 3, 200104922: 3, 200146376: 3, 107891240: 3, 106810689: 3, 110584840: 3, 106192059: 3, 111931619: 3, 108254304: 3, 200387479: 3, 108479343: 3, 200101945: 3, 108604024: 3, 108846339: 3, 110038164: 3, 108236507: 3, 111666934: 3, 112493702: 3, 107638654: 3, 200062165: 3, 200463986: 3, 108813564: 3, 200508797: 3, 108043082: 3, 200646718: 3, 112207022: 3, 107504984: 3, 200378564: 3, 200252451: 3, 200416559: 3, 200615388: 3, 200795369: 3, 108613386: 3, 200875453: 3, 200202741: 3, 200911703: 3, 200653387: 3, 200676932: 3, 200084871: 3, 200061347: 3, 200401659: 3, 200418465: 3, 106649993: 3, 107130713: 3, 200213547: 3, 106870964: 2, 107930775: 2, 107594314: 2, 106842382: 2, 107247400: 2, 107347962: 2, 108008921: 2, 108121274: 2, 107767899: 2, 108030106: 2, 107870705: 2, 108308016: 2, 106089213: 2, 110213399: 2, 107172119: 2, 108139034: 2, 107843504: 2, 110883429: 2, 110784307: 2, 107755397: 2, 110930905: 2, 111956409: 2, 112003012: 2, 107598786: 2, 111967377: 2, 108236363: 2, 111984637: 2, 110328969: 2, 107931921: 2, 200124910: 2, 112220235: 2, 108541430: 2, 112001780: 2, 200205291: 2, 106220386: 2, 112501870: 2, 112329508: 2, 111690225: 2, 110512167: 2, 109101477: 2, 200484417: 2, 200751388: 2, 108940304: 2, 111771784: 2, 200444478: 2, 200393716: 2, 110985244: 2, 200327167: 2, 200277858: 2, 109152722: 1, 200407341: 1}"
Serfs and Lords,109665158,Sport,119258598,5.10b,60,1,1.8,10.0,Tricky crux around the third bolt. Route located right next to More Better.,"{200653387: 3, 108046773: 3, 110512167: 3, 108886549: 2, 200157132: 2, 108933244: 1, 107638654: 1, 108236507: 1, 200292934: 1, 108057626: 1}"
Shidded on Em aka Kneeling Before Power Extension,119750935,Sport,119258598,5.13d,70,1,4.0,1.0,"Add an extra number grade or two if you drink Steel Reserve before sending as it has ""high gravity"" and that increases the difficulty of the climb.  This is a linkup of Kneeling Before Power V10 and Zeke's Didge Dance.  You might be asking yourself, why does this exist?  And to that I would respond, why does anything exist? Nothing matters in life, but I'd argue if anything in the universe matters, it is this route.  So if you're lost in the sauce, searching for meaning in life, down on your luck, or just looking to have some fun?  Give this route a shot and I guarantee you'll find what you are looking for.  But for real, this climb is super cool.  Not many places offer the rare opportunity to climb a double digit boulder into a sport route.  So if you're bouldering V10, you can probably send 10b, which means that even if you have no stamina and no endurance you can still probably do this climb and tick a ""hArD sPoRt RoUtE"" for your troubles.  Climb Kneeling with a harness and draws if you're a real boy like Pinocchio.  Speaking of, if you're looking for a part of your body to grow as a result of a climb this is the route for you.  If you send Kneeling and don't do this extension, you're missing out. To those people, and very specifically my friend who didn't do the linkup:  too bad you'll never be rad.",{200216014: 4}
Short Stack,111109621,Trad,119258598,5.8,45,1,1.5,4.0,"Basically a face climb in between two sport lines, this starts in a short crack and moves up jugs to the top.","{107041196: 2, 111013333: 2, 107137180: 1, 111825718: 1}"
Side Show,111274822,Trad,119258598,5.9+,60,1,1.0,2.0,"Same start as Dancing Outlaw and same 9+ crux, but instead of following the permadraws and the face of the route, stay to the right of the arête. Continue all the way up on the right, shares same anchors as DO.","{108679988: 1, 107041196: 1}"
Sin Nombre,110244473,Sport,119258598,5.9-,55,1,2.1,27.0,Start right of the dihedral crack. Begin with a low crux then move into jugs to the top.,"{109711410: 3, 106588732: 3, 106237951: 3, 107677137: 3, 109052547: 3, 108314447: 3, 200160251: 2, 108236507: 2, 107638654: 2, 111888128: 2, 112337532: 2, 200067404: 2, 200099747: 2, 106809240: 2, 112501870: 2, 107843504: 2, 108679988: 2, 110959609: 2, 110896562: 2, 110003938: 2, 108933244: 2, 107434457: 2, 107691094: 2, 107767899: 1, 200037506: 1, 111891854: 1, 110591893: 1}"
Sin Nombre Moore,111110284,Sport,119258598,5.8+,40,1,1.1,8.0,Short slab to large holds.,"{200180573: 2, 107137180: 1, 111737831: 1, 111825718: 1, 200099747: 1, 108236507: 1, 107638654: 1, 108604024: 1}"
Slide Show,111109495,Trad,119258598,5.7,0,1,1.4,7.0,Clip 3 bolts on Summer Rain and head left into easy terrain to a short crack. Clip the last bolt of Summer Rain and finish on the left variation anchor.,"{111810534: 3, 110003938: 2, 107137180: 1, 111349407: 1, 111166221: 1, 111347304: 1, 108236507: 1}"
Smooth Criminal,108764890,Sport,119258598,5.9,40,1,2.4,37.0,Crux is around the 2nd bolt...pretty straighforward climb.,"{200317019: 3, 111720345: 3, 108999258: 3, 112124233: 3, 200135185: 3, 108483316: 3, 111694003: 3, 112202693: 3, 110959609: 3, 109396884: 3, 107843504: 3, 110052535: 3, 107573329: 3, 200475386: 3, 108108138: 3, 107482343: 3, 200523166: 3, 108708700: 3, 200751388: 2, 108236507: 2, 107041196: 2, 107638654: 2, 111806823: 2, 108679988: 2, 108392797: 2, 107755397: 2, 107870705: 2, 107137180: 2, 108046773: 2, 108613386: 2, 112142545: 2, 112152487: 2, 111893262: 2, 200101945: 2, 109711410: 1, 108604024: 1, 106751248: 1}"
Some Moore Better,109567156,Sport,119258598,5.9-,40,1,1.5,6.0,Start at a tree and go up a brown streak to the top.,"{107137180: 2, 108046773: 2, 111737831: 2, 200099747: 1, 108236507: 1, 108604024: 1}"
Something for CiCi,108369864,Sport,119258598,5.10a,35,1,1.9,29.0,Same start as Horny Goatweed but go straight up into a left facing dihedral.,"{112403472: 3, 200411906: 3, 113306774: 3, 109396884: 3, 111166221: 3, 111321805: 2, 108886549: 2, 200124910: 2, 106588732: 2, 107041196: 2, 108604024: 2, 200505946: 2, 107755397: 2, 107137180: 2, 110726946: 2, 108046773: 2, 111155869: 2, 108999258: 2, 107767899: 2, 200157132: 2, 111703228: 2, 110985244: 1, 108324869: 1, 110896562: 1, 108459213: 1, 111061049: 1, 108679988: 1, 200292934: 1, 112495707: 0}"
Something for E-Kat,109567148,Sport,119258598,5.9,40,1,1.6,8.0,Start just left of a tree and follow black streaks to the top.,"{108046773: 2, 111737831: 2, 108392797: 2, 107638654: 2, 200180573: 2, 107137180: 1, 108236507: 1, 108604024: 1}"
Something for Jewell,109567172,Sport,119258598,5.8,40,1,1.8,8.0,Edges at the start give way to large jugs to the top.,"{107137180: 2, 108046773: 2, 110345681: 2, 108121274: 2, 200124910: 2, 108236507: 2, 111166221: 1, 108604024: 1}"
Something for Roman,109567120,Sport,119258598,5.10c,45,1,1.2,13.0,Start up the left side of a small roof and then follow the right side of the arete on jugs to the top.,"{108679988: 2, 111737831: 2, 107137180: 1, 107041196: 1, 107638654: 1, 108121274: 1, 110591893: 1, 108604024: 1, 108886549: 1, 108363077: 1, 108108138: 1, 108046773: 1, 200099747: 1}"
Sonny Jim,105970892,Sport,119258598,5.11a,70,1,3.2,223.0,"Climb the easy slab and make the move into the roof holds, then enjoy the jugfest on the headwall.  Good fun.","{107451356: 4, 106964179: 4, 107677137: 4, 107090397: 4, 105984741: 4, 105802806: 4, 106329264: 4, 106242770: 4, 106344911: 4, 106407880: 4, 12690: 4, 106066740: 4, 107347224: 4, 105849172: 4, 108017825: 4, 107697400: 4, 108055813: 4, 108110589: 4, 108092606: 4, 108292652: 4, 107147231: 4, 109127888: 4, 110645520: 4, 109353144: 4, 107246511: 4, 111278331: 4, 111029678: 4, 109396884: 4, 109252158: 4, 110003938: 4, 107837713: 4, 111597819: 4, 109769706: 4, 112254961: 4, 111703228: 4, 112339753: 4, 111392445: 4, 110726946: 4, 111984637: 4, 112283425: 4, 111166221: 4, 200158477: 4, 111127829: 4, 200101945: 4, 200167480: 4, 111929098: 4, 112260466: 4, 200174046: 4, 109769109: 4, 200185557: 4, 109816060: 4, 200236488: 4, 200138749: 4, 107971249: 4, 200127868: 4, 200223923: 4, 200292934: 4, 200380691: 4, 200438871: 4, 200270045: 4, 112493702: 4, 113226758: 4, 200246959: 4, 200623585: 4, 112025009: 4, 107504984: 4, 200669407: 4, 200252451: 4, 106482590: 4, 200393716: 4, 200327167: 4, 200819659: 4, 107137180: 3, 15142: 3, 105899017: 3, 106870964: 3, 105792229: 3, 106093554: 3, 107146196: 3, 105846730: 3, 106207917: 3, 107930775: 3, 107940453: 3, 105926739: 3, 106161329: 3, 106450047: 3, 106280199: 3, 107074129: 3, 106683773: 3, 106962174: 3, 106047496: 3, 107428096: 3, 107478705: 3, 106860947: 3, 108046773: 3, 108057626: 3, 107222279: 3, 107814780: 3, 107616372: 3, 108479343: 3, 108308016: 3, 106889145: 3, 106089213: 3, 109026628: 3, 108998429: 3, 107646908: 3, 108679988: 3, 108368607: 3, 110052535: 3, 108626560: 3, 108236363: 3, 110202689: 3, 107172119: 3, 108362364: 3, 109871099: 3, 109881112: 3, 110391698: 3, 108939652: 3, 107755397: 3, 111503950: 3, 108933244: 3, 110534294: 3, 111737831: 3, 111732907: 3, 108773303: 3, 110930905: 3, 111956409: 3, 109764550: 3, 109726766: 3, 107472859: 3, 111610527: 3, 107598786: 3, 106195833: 3, 111972029: 3, 106172063: 3, 109206577: 3, 110500610: 3, 200038676: 3, 112157404: 3, 112308117: 3, 111931619: 3, 200127893: 3, 111825718: 3, 108248734: 3, 112173761: 3, 108392797: 3, 200124910: 3, 200138493: 3, 112142545: 3, 200062169: 3, 111664966: 3, 112001780: 3, 109101477: 3, 112403472: 3, 106810689: 3, 108886549: 3, 200099747: 3, 200093542: 3, 111859893: 3, 112501870: 3, 112329508: 3, 110755607: 3, 113168176: 3, 111888128: 3, 108236507: 3, 200150657: 3, 110914708: 3, 200192295: 3, 112041194: 3, 200062165: 3, 200377500: 3, 106121156: 3, 109585594: 3, 108043082: 3, 200349240: 3, 200511427: 3, 112324689: 3, 200484417: 3, 112202693: 3, 111771784: 3, 200615388: 3, 200795369: 3, 200477602: 3, 108613386: 3, 200875453: 3, 200202741: 3, 200157132: 3, 200461638: 3, 107521255: 3, 200061347: 3, 200277858: 3, 105990665: 2, 105972853: 2, 105952525: 2, 11156: 2, 106574818: 2, 107347962: 2, 107096937: 2, 108030106: 2, 107870705: 2, 107573329: 2, 109152722: 2, 107559987: 2, 111155869: 2, 107133024: 2, 111522632: 2, 111321805: 2, 113509603: 2, 200177318: 2, 108084510: 2, 107931921: 2, 112220235: 2, 106192059: 2, 106220386: 2, 108604024: 2, 109692317: 2, 200173416: 2, 200444478: 2, 200096300: 2, 107247400: 1, 109069728: 1, 111943514: 1}"
Sonrisa Loco,107826069,Sport,119258598,5.10c,25,1,2.3,23.0,"Short sport route on backside of Kindergarten boulder.  Soft for grade, but fun route.    Located to the right of ""Ojos Locos""","{200236500: 4, 200236503: 4, 200101945: 3, 200093542: 3, 110052535: 3, 108046773: 3, 107908888: 3, 109468689: 3, 110959609: 3, 111859893: 2, 111653221: 2, 200099747: 2, 107304677: 2, 108886549: 2, 110896562: 2, 107090397: 2, 107767899: 2, 108679988: 2, 107096937: 1, 107137180: 1, 108257055: 1, 108084510: 1, 107041196: 1}"
Sons of the Soil,105965172,Sport,119258598,5.10a,40,1,2.3,61.0,"The slightly overhanging crux comes in the first fifteen feet, then follow jugs to the top.","{200037506: 4, 111166221: 4, 108108138: 4, 109468689: 3, 108324869: 3, 108450327: 3, 109046882: 3, 107816900: 3, 107130713: 3, 108390129: 3, 200063250: 3, 110959609: 3, 107362202: 3, 107347962: 3, 107090397: 3, 106889145: 3, 200683336: 3, 106279343: 3, 108297011: 3, 108046773: 3, 111013333: 3, 105914540: 3, 112142545: 2, 110003938: 2, 108236507: 2, 200099747: 2, 200029984: 2, 107041196: 2, 111737831: 2, 108604024: 2, 108886549: 2, 107767899: 2, 111891854: 2, 108392797: 2, 110148614: 2, 109816060: 2, 109871099: 2, 108295113: 2, 108679988: 2, 107771530: 2, 10244: 2, 107247400: 2, 106964179: 2, 106842382: 2, 106084734: 2, 106018444: 2, 108055813: 2, 106746350: 2, 107137180: 2, 108057626: 2, 110202689: 2, 108257055: 2, 110199585: 2, 109711410: 2, 106407880: 1, 110052535: 1, 109152722: 1, 108121274: 1, 110591893: 1, 108092606: 1, 200418465: 1}"
Sour Girl,106049194,Sport,119258598,5.10b,35,1,3.0,124.0,"Climb pockets at the start, then traverse right to a roof finish. Cleaning the route can be a challenge unless someones seconds the route on toprope.","{107090397: 4, 106889145: 4, 107930775: 4, 107335382: 4, 107992865: 4, 108978469: 4, 108253481: 4, 108933244: 4, 108999258: 4, 111478097: 4, 109764550: 4, 111166221: 4, 111315718: 4, 109561464: 4, 200035162: 4, 112315873: 4, 109816060: 4, 110148614: 4, 200183248: 4, 200146376: 4, 200380691: 4, 108998429: 4, 200378564: 4, 106248405: 4, 200101945: 4, 200349240: 4, 200439892: 4, 200160251: 4, 200468906: 4, 107451356: 3, 107677137: 3, 107347962: 3, 10244: 3, 106257217: 3, 107510374: 3, 106207917: 3, 107974281: 3, 106407880: 3, 12690: 3, 107074129: 3, 106744745: 3, 107226109: 3, 107347224: 3, 107697400: 3, 108046773: 3, 106242342: 3, 107816900: 3, 106536997: 3, 108057626: 3, 108324869: 3, 107983034: 3, 108679988: 3, 107229353: 3, 107406726: 3, 108414444: 3, 110202689: 3, 106018444: 3, 108236363: 3, 110213399: 3, 108766902: 3, 109881112: 3, 110391698: 3, 111165216: 3, 111351242: 3, 111720716: 3, 110587581: 3, 107041196: 3, 112142545: 3, 110423556: 3, 110970809: 3, 112152002: 3, 108331507: 3, 110726946: 3, 111972029: 3, 108783852: 3, 112157404: 3, 200093072: 3, 109769706: 3, 107246511: 3, 108248734: 3, 110642827: 3, 111732907: 3, 200138493: 3, 106908697: 3, 108744559: 3, 200200725: 3, 108886549: 3, 200143960: 3, 200188656: 3, 108254304: 3, 200135185: 3, 109468689: 3, 111704941: 3, 105916328: 3, 200160531: 3, 108043082: 3, 107521255: 3, 200500333: 3, 200615388: 3, 110959609: 3, 200761279: 3, 108759959: 3, 107671200: 3, 200444478: 3, 200061347: 3, 106964179: 2, 106860947: 2, 107870705: 2, 107767899: 2, 109871099: 2, 108139034: 2, 109877052: 2, 110003938: 2, 109423069: 2, 111522632: 2, 108121274: 2, 107955776: 2, 108541430: 2, 109101477: 2, 108604024: 2, 110591893: 2, 112202693: 2, 111771784: 2, 107247400: 1, 200292934: 1}"
