name,id,type,area_id,grade,height,pitches,score,votes,description,star_ratings
Cruizer,116199754,Trad,119449453,5.8,300,2,2.0,1.0,"An interesting climb that is sketchy in several spots.  This climb is just before the main wall, down and climbers left of the Walker Buttress. There is a right facing flake (Cruizer alt.) and a left facing flake that are easy to locate. The alternative start looks like it stays wet for a while.  You can start in the flake or on the face. We chose the face. Go straight up the face past some good gear and clip the only bolt on P1. Continue moving up until you see the large thin flake to the left. Above this flake is a large horizontal break and your first gear above the bolt. Look out right for a short slanting crack that goes at 11 o'clock. Pull the slanting crack and aim up and left still for another break in the rock. This is the last gear before the anchor. Pull above the break and reach the large ledge with the two bolt anchor.  P2 moves straight up the anchor to a bolt. Above the bolt you can get a 0.3 camalot or similar in an eyebrow. Make a long run to the next bolt at a smooth slab. Make some fun friction moves up and trend slightly right near a small juniper. Move straight above the juniper on the steep face and big holds. When you get to the top, you will see two large pine trees. The second pine tree has a sling that was good as of Dec. 2018. A bolted anchor will likely be added due to park rules in the near future. Descend straight down the route the way you came up.",{106449553: 2}
Four and Many More,115969219,Sport,119449453,5.7,95,1,3.0,4.0,"This is one of the first lines to be dry at the entire cliff. Great well-protected climbing on superb rock, fun for the whole family.  Make a couple of slabby moves to get started, may be harder for shorties. Move up to the steepish bulge with two bolts. Climb past some hard moves and enjoy the victory lap to the top. A few spaced bolts on the route, but large ledges and hand holds make it manageable. The climb finishes at a two-bolt anchor in a bowl.","{106449553: 3, 200129124: 3, 111770859: 3, 200091869: 3}"
Priapus' Infamous Bludgeoning,116071422,Sport,119449453,5.8,90,1,2.5,2.0,More fun climbing on impeccable rock.  Start on the ramp that leads down the hill to the Walker Buttress. An easy traverse leads up and left to the first bolt. Pull into several scoops and get the next bolt. Cool dimples and slab lead to the top. You can break right or left depending on which anchor you want to use.,"{111770859: 3, 106449553: 2}"
Stepping Stone,116181552,Trad,119449453,5.8,90,1,2.5,2.0,"Another route similar to it's neighbors. Start up to the first bolt, make some hard moves to access the ledge above. Clip another bolt and circle left to find the easiest terrain. Continue up past four more bolts of enjoyable slab climbing to reach the two-bolt anchor.","{111770859: 3, 106449553: 2}"
Think Twice,115969253,Trad,119449453,5.9-,95,1,3.0,2.0,"Another fun slabby addition to the area. This one has a little added spice to the top.  Begin at a rock pedestal on the ground, belay here. Move up to a big horizontal below the first bolt. Get some gear here before making the step up to clip the first bolt. A couple of hard moves lead you past the first bolt. A few more tricky sections lead you to the 5th bolt. Some gear can be placed up and left of this bolt. A little run leads you to the 6th bolt. Continue up and left to the anchors.","{106449553: 3, 106904776: 3}"
Blessing In De-skies,108515873,Trad,119449461,5.11,95,1,3.0,1.0,"An amazingly delicate slab with nice stances at the bolts.    Just left of the water streak/groove is a protrusion of cool crimps, edges, and smears. Do some moderate moves to get to the high first bolt. Start into the sustained technical upper section. At each bolt you are rewarded with a great stance. When the climbing gets steep, make a tricky crux move to gain the more positive face above. Head to the same bolted anchor on Dry Line. Easily top roped, but for full value, lead it!",{106449553: 3}
Bosched Job,114031346,Trad,119449461,5.9+,190,1,3.3,4.0,Excellent route that is a good mix of water groove and face climbing.    Start off a detached flake at a series of excellent quartz knobs. Make a short and easy run to the first bolt. Step way right at the first bolt and continue up the large featured knobs. Continue up the face getting an occasional finger-sized piece until you reach the overlap bulge. Plug some gear here and sling it long to prevent drag. Move slightly right to more featured feet and pull the bulge. Clip a bolt as the wall begins to steepen. Stem the cruxy face using excellent feet in the groove. Make a run to the anchors where the climbing gets easier as you get closer to the anchors.,"{200160322: 4, 106449553: 3, 200129124: 3, 109172021: 3}"
Dry Line,108515768,Trad,119449461,5.9,90,1,2.5,2.0,A fun technical line with good protection for TR standards. This line is dry when most aren't as the name indicates.    Start up the slab with big features. You have to make a moderate move to reach that first bolt. Continue moving up the bolted line with a distinct crux at the second bolt. After a few bolts you end up on a slab apron. You should notice a bolt just to the left of an often wet water groove. Make another couple of moves to get to the anchors just right of a big moss pad.,"{106449553: 3, 106904776: 2}"
Mustache,111373829,Trad,119449461,5.11-,90,1,2.0,1.0,This shorter climb has a little bit of everything. Most of the difficulty is at the beginning and eases the closer you get to the anchors. It is well-protected for TRSP standards.    Look for two bolts close together near the ground. Start off to the right and traverse in on big crystal knobs. Clip the first bolt and make the difficult and technical moves to get to a solid stance at the second bolt. Then enjoy some cool face climbing with gear. Get above your gear and make some exciting moves at the water groove until you reach the bulge. Plug some more pro here and pull into the fun final water groove to the anchors. There is another piece of gear midway between the anchors.,{106449553: 2}
Pioneer's Route,113846060,Trad,119449461,5.7,250,2,2.0,1.0,NOT FOR 5.7 leaders.  Almost the farthest right you can go on water groove wall.  Don't fall cause you could go down several hundred feet.  Starts in a nice clean looking corner with a couple options for pro then run it out on 5.3 terrain following the trail of trash that has blown off the top.  Nice option for top access if you have hiked up and most of the grooves are wet/other poor conditions.,{109058226: 2}
Premero,113845492,Trad,119449461,5.9+,180,1,3.0,1.0,"A fun sustained moderate water groove that is well-protected for almost any cliff.    Climb a short traverse left across the ledge. I used a #2 camalot and purple tri-cam to set up a belay. Bring your partner over to the belay for less drag and rope out in case of a fall at the first few bolts.    Start up the steep shallow groove on cool crystals and knobs. Follow this up past several bolts. The groove will become a little deeper for stemming. It helps if the route is completely dry since many smears happen in the groove. Continue following the groove and bolts. A few small cams can be placed between a couple of the last bolts. Near the end, traverse slightly left to the anchors.",{106449553: 3}
Tom and Jerry,114031397,Trad,119449461,5.11-,180,1,4.0,1.0,"Excellent knobs and water grooving, well-protected. This route is not listed on the current topo in the kiosk.    The route starts right where the approach trail meets the Watergroove Wall. Look for two bolts down low. Make a slabby step up onto the apron to get to the first bolt. Excellent quartz knobs take you to another stance and the second bolt. Make some hard moves in the thin wide groove to gain a better stance above. Plug in a shallow but good #1 C4 and continue up the groove. Several small to finger sized pieces in a row lead to another bolt between the two grooves. Slap your way up the two grooves to the bulge overlap. Get some gear here and start into the narrow water groove. Continue up the water groove passing four more bolts and plenty of fun moderate climbing. After the 4th bolt, start to move up and right to the anchor shared with Two for One.",{106449553: 4}
Two For One,108515839,Trad,119449461,5.9,180,1,2.5,6.0,This is one of the most fun and well-protected moderates on the wall.    The crux is getting off the ground and the next few moves. Make some tenuous moves on cool crystals to gain the easier slab above. Wander up easier terrain to the first bolt. Continue up a few more bolts to reach a large slab ledge. Head up and right on the face between two watergrooves aiming for more bolts. There are many ways to finish up the last bit of climbing to the anchors.,"{106449553: 3, 105907433: 3, 106904776: 3, 112038160: 3, 200129124: 3, 200434365: 0}"
