name,id,type,area_id,grade,height,pitches,score,votes,description,star_ratings
Chossy Chin-Up,119797859,Boulder,119797552,V2+,8,1,1.0,1.0,Move up and to the left across crimps and slopers to match at the top of the wall. Rocks coming out beneath the wall are off and make this more of a V1.,{200853037: 1}
Heel Heaven,119797892,Boulder,119797552,V1-2,6,1,2.5,2.0,Start with a high heel and then work hands to match on top of the wall. Short route but pretty fun.,"{200969333: 3, 200853037: 2}"
Over Orangahang,119797827,Boulder,119797552,V3-,6,1,2.0,1.0,A few tough crimps to match hands on top of the wall.,{200853037: 2}
Painful Pull-Up,119797842,Boulder,119797552,V3-,6,1,2.0,1.0,"Similar to Over Orangahang, tough crimps and then match on top of the wall.",{200853037: 2}
Three Throws,119797885,Boulder,119797552,V3-,6,1,2.0,1.0,Three semi-dynamic moves to match at the top. The crux is finding feet.,{200853037: 2}
Tough Traverse,119797652,Boulder,119797552,V4-5,15,1,3.0,1.0,15' overhanging boulder to the first easy top out. The crux is in the middle and managing the pump. Throw some fun heels and crimps to finish this one out.,{200853037: 3}
Electric Avenue,118005235,Sport,116191154,5.9+,60,1,2.8,8.0,"This all bolted line has consistently interesting slab/face climbing. I recommend stick clipping the first bolt. Thanks to Eddy Grant for the song that inspired the route name. It's my first FA since being injured by a lightning strike in CO this summer, so the name seemed appropriate :)","{106198934: 3, 200209902: 3, 106562865: 3, 106904776: 3, 200229728: 3, 200171016: 3, 105904878: 2, 200325629: 2}"
Toilet Bowl,116242763,Sport,116191154,5.10,50,1,2.0,3.0,"This is a fun line that is worth doing if you're at the Arch Wall area and enjoy slab.  Climb the bouldery start to a good stance. Note: There is a low bolt that keeps you from tumbling down the gully should you blow the start, but clip it short and have a tight belay here. Continue up the slab to a bowl/stance up and slightly right. From here there are two ways to climb the face above: 1) Harder way is left of bolt line on thin edges 2) Right of bolt line on  well-spaced bigger holds (probably needs cleaning). Lower from anchors at ` 50'.","{106056907: 2, 105904878: 2, 111770859: 2}"
Tradasaurus Wrecks,118721006,Trad,116191154,5.10-,85,1,0.0,1.0,"More fun than being eaten by a T-Rex.  Does it eat gear?  Not really.  Stand at the bottom and wonder if you're about to free solo this slab.  Start as per Tree Willy, but move right after the second bolt.  Alternatively, scurry in from the right side uphill.  Stay right on the buttress and you'll find unexpected slots, if you pay close attention.  Slither your way under the tree.  A #1, slings, and a clawful of small gear in sketchy placements will get you there.  After the 5.10 start, it's all mental crux.",{200325629: 0}
Tree Willy,118652126,Sport,116191154,5.10-,85,1,2.5,2.0,"Start at the short finger crack splitting the buttress.  Follow the bolt line up the middle of the rock through fun face features, getting more slabby as you go. The crux is the first 20 feet or so and might make you think.","{200171016: 3, 200325629: 2}"
Triple F,116227234,Sport,116191154,5.10,60,1,3.0,5.0,The crux is getting off the ground. Clip the bolt before committing into the first moves so you don't take a ride down the hill. Position your belayer down the hill and out of the way. Start paddling up the very thin slab. More thin climbing and well-spaced bolts lead you to the shared anchor.,"{106449553: 3, 105904878: 3, 106056907: 3, 111770859: 3, 111151975: 3}"
The Underdog,118100516,Trad,116191154,5.9,50,1,2.8,8.0,"Anyone that frequents Big Rock has likely walked right past this crack a million times and either ignored it or wondered what must be under its jungle of vines and briars. It took two days of excavating and gardening to clean, but here it is... a stellar new addition to Big Rock’s collection of classics.   The crux gets on you fast and sustains for two or three moves. Getting into the crack is the business. Once there, find a few hand jams and work on your crack technique to get to easier ground. Gear is a bit tricky down low (depending on your stance, you may have a blind placement or two), but good. Singles of .3 through 2 sow it up. Rap/lower or choose the safe and easy walk-off.   Bring your nut tool and help us continue to clean it out. With additional cleaning and a season of rain, this crack should only get better (and perhaps, a bit easier). Enjoy!","{200162986: 4, 200830011: 4, 108088813: 3, 200325629: 3, 106904776: 2, 200209902: 2, 105904878: 2, 200741505: 2}"
Archetype,116242855,Sport,116242825,5.11a,65,1,3.0,1.0,"A thin start gains a seam and the first bolt. From here underclimb the big thin flake up and right past another bolt and some knob climbing to gain the diagonal ""crack"". Optional gear here. Clip a bolt above on the face and move left along the foot ledge to the large groove. Follow the groove past bolts (might need to sling long) to a ledge below the easy slab. Climb this slab past one last bolt to the anchor in the boulder up and right of the tree.",{106056907: 3}
Bow and Narrow,116527463,Trad,116242825,5.8,45,1,2.0,4.0,"Slab up into crack. Jam and lay back crack up to where it turns to super thin flake. Be smart with protection here.  Mantle horizontal, clip bolt, slab to two bolt anchor.","{106562865: 4, 105979386: 2, 106056907: 1, 105904878: 1}"
unnamed,116383794,Sport,116242825,5.10-,30,1,2.0,1.0,This is a short but fun line that climbs the dark-streaked wall on the climbers' right side. Start up and right but move left at horizontal and below the bolt. Climb the thin face past the 2 (or 3?) bolts to the anchor below the bushes.,{106056907: 2}
Nausea,118877117,Boulder,118877092,V2,0,1,2.5,2.0,"From the guidebook: ""Stand start on the beautiful seam/crack, climb the crack, using the slab, to the obvious slanted edge on the aréte...roll over onto the slab and finish up the Gag Slab.  The first problem that started real development in this boulderfield!""","{109683196: 3, 200325629: 2}"
Nobody's Cooler Than Wes Cooler,118251624,Boulder,118251601,V3+,12,1,3.0,1.0,"Stand start with left foot on small ledge under the slopey arete, compress up the slopey arete to the right, with bad slabby feet, to the slopey top out.   Wes Cooler is the land manager for Big Rock and has been instrumental in Big Rock becoming the awesome climbing, bouldering and hiking destination it is today...thanks Wes for being so great! ",{106772499: 3}
Trick Knee,118251641,Boulder,118251601,V2-3,12,1,2.0,1.0,Stand start with right foot on low crimp and follow slabby arete to the top. ,{106772499: 2}
Batter on My Apron,119489390,Sport,117046888,5.3,55,1,1.0,1.0,"An easy route for the novice leader.  Climb the black streak above the far right side of the arch to a set of anchors.  You can start from the arch with Microcosm, or on the right side adjacent to Pick Pocketeer.  The left start is more secure but slightly harder, the direct (right) start is easier, but more run out.  If desired, you can clip the anchors and traverse left to the top of Microcosm to extend the route.  Generally stays wet after a rain.",{200325629: 1}
Microcosm,117523454,Trad,117046888,5.5,70,1,2.0,4.0,"A small introduction to Carolina climbing.  Follow the obvious left-arching feature with good gear and great feet.  At the end of the arch, climb up into the obvious water groove, and follow it past two bolts to the anchor at the top adjacent to the boulders.  Best to walk off when cleaning.","{200325629: 2, 106095990: 2, 106562865: 2, 200741505: 2}"
Piece of Cake,117046934,Trad,117046888,5.6,45,1,1.8,4.0,"A short, but enjoyable route. Some interesting moves with a fun undercling mantle move mid way up. Start at the base of the rock bands stacked like a cake. Move up using horizontal jams, friction, and one side pull. Some moves can be reachy for shorter climbers. After the undercling the real climbing is over. Trend left to keep some interest. Rap from a tree, or walk off left down the obvious trail towards Arch Wall.","{200325629: 2, 200662338: 2, 200741505: 2, 106562865: 1}"
Get Bent,118879582,Trad,118879442,5.11-,40,1,2.0,1.0,A fun boulder problem located in a left arching crack with a telltale bush in the middle. Establish yourself in the crack (without using the pine tree) with a sort of layback. Make a couple moves to place some small cams using the feet to your left. Finger jam your way up to the hero thin hand jam. Plug some pro and navigate the bush on some thin feet being careful not to dump a bunch of debris onto your belayer. Take advantage of the easing slab to place gear into a small eyebrow. Finish up by slabbing your way up between two cracks to the conveniently located pine tree anchor.  More traffic will help keep this climb clean. Thanks to Matt S. and Emily J. for helping to develop this climb. ,{200162986: 2}
Lackluster,118880299,Trad,118879442,5.6,40,1,1.0,1.0,"A route that was less than desired. Slab your wall up on some knobs just under the dirt filled crack. Sling one of the small trees until you can get up a little higher to place a hand sized cam.  Variation 1: sling the cam long and carefully traverse out left on positive feet with no hands to a manky horizontal (15 ft). Then follow easy terrain to the top.  Variation 2: sling the cam and move up the dirt filled crack, thrashing through the bush, cussing, and wishing you chose the other variation until you top out.",{200162986: 1}
Unnamed 5.10,118879465,Trad,118879442,5.10,40,1,2.0,1.0,Route believed to have been established by Jeep Gaskin during the prime Big Rock development period. Slab your way up the face past a couple bolts then “squirm” your way through a chimney.,{200162986: 2}
Meth Face aka Shadow Boxing,116227552,Trad,116191230,5.12c,60,1,4.0,1.0,"A sustained crimp fest up a near vertical wall on gorgeous crystals and edges. Starts with a V4/5 move and then stays on you until you reach the large horizontal break.  You can either start by jumping from a small boulder to the first jug rail or use the tree to stem you way up. A big piece can be placed at the first horizontal, or skip it and make the easy moves to the first bolt. Make a hard V4/5 deadpoint move at the first bolt. Stick the decently sized crimp and clip the second bolt. Continue traversing left to some larger rails and clip the third bolt. Make another hard move up using the crystal ball. Some thin and techy moves out right lead to the next bolt at a crimp rail. Make another tough deadpoint on bad feet to get into the horizontal break. From here the route takes gear to the top. Place a couple of thin pieces in the crack in the groove. Place one last piece of gear in the crack. Pull the bulge to anchors.  Can easily be TR'ed from the anchors at the top. Use the ring-less hangers to get to the lower set of anchors.",{106449553: 4}
Rock Ninja,116227482,Trad,116191230,5.12,40,1,3.0,1.0,A Big Rock test-piece! Can be top-roped.  Start on a boulder leaning against the wall. Might be advisable to stick clip. Get onto the face and start making the thin moves riding the slashes. Intense finger moves and small foot placements make up the meat of the route. A hard transition move gets you to the vertical crack and a couple of gear placements.,{106449553: 3}
Ant In My Pants,116524214,Sport,116191148,5.10,75,1,2.6,13.0,"Climb up past three bolts and then stand up and clip the 4th bolt at the roof. Sit here for awhile trying to figure out how in the heck you are suppose to make this ridiculous mantle move over the roof. If you eventually give up then yard on the bolt or do the mantle in style. Either way slab up past 5 more bolts over some gritty rock to an anchor  This route is no harder than 5.8 A0 if you aid through the roof, so hop on it","{200171016: 4, 200325629: 3, 111212017: 3, 200747875: 3, 200021599: 3, 200115839: 3, 105823960: 3, 111770859: 3, 200241195: 2, 106904776: 2, 200160322: 2, 106562865: 2, 200162986: 1}"
Flowering Hominid (aka Lily),116524235,Sport,116191148,5.4,75,1,1.9,18.0,Climb straight up past a very generous number of bolts up some featured slab to a 2 bolt anchor. Shares anchors with Nose Over Your Toes  Good first sport lead for anyone,"{105823960: 4, 200623435: 4, 111212017: 2, 200387204: 2, 200663936: 2, 200747875: 2, 105930639: 2, 200065675: 2, 106095990: 2, 111770859: 2, 200525732: 2, 200160322: 2, 200171016: 1, 200622815: 1, 106904776: 1, 107768941: 1, 200115839: 1, 106562865: 1}"
Girdle Traverse,116771783,Trad,116191148,5.5,100,1,2.3,3.0,"Start as for Nose Over Your Toes, mantling up to a bolt. Reach the long, rising overhang and traverse left under it, placing gear under it when possible and clipping a couple of bolts just above it. (Use long slings, or you will hate the rope drag.) Step left to the bolted anchor of Dr. Strangelove (just above an obvious flake); belay and rappel from here, or climb straight up a runout, easy slab to the pine tree above.","{200741505: 3, 106095990: 2, 200160322: 2}"
How Do You Want Your Eggs,116507382,Sport,116191148,5.6,100,1,2.6,16.0,Pad up to the 1st bolt. Make a kind of a high step move through a couple of moves that turn out to be easier than they look like. Clip the second bolt and then onto slightly easier ground to bolt 3. Make a bit of a run on easy ground angling up and left to the corner/roof.   Clip bolt 4 and then step up right through the corner. There is a loose flake here that is the obvious hand hold so try not to pull on it. After you stand up on the roof you can clip another bolt. Run it out on easy ground through one more bolt to the bolted anchor  Rope ends just reach the ground so tie knots in the ends of the rope.,"{106562865: 3, 111212017: 3, 200387204: 3, 200171016: 3, 200747875: 3, 111770859: 3, 200115839: 3, 200241195: 3, 106077771: 3, 106095990: 3, 200209902: 3, 200525732: 2, 105930639: 2, 200160322: 2, 106904776: 2, 200453531: 1}"
Monkeys on Main,118005185,Trad,116191148,5.10a/b,90,1,2.5,11.0,"Good footholds lead to the first bolt, then it gets thinner. You climb basically straight up toward bolt 2.  After bolt 2, follow the obvious quartz dike up and left into a water streak. Continue up the water streak past another bolt to the overlap. You can get trad gear (optional) under the overlap where it's obvious. The last bolt is over the lip, protecting a cool step up move. We used the belay anchors on How Do You Want Your Eggs,","{106198934: 3, 200209902: 3, 200637019: 3, 111212017: 3, 200171016: 3, 200830011: 3, 106077771: 3, 111770859: 2, 106904776: 2, 106562865: 2, 200325629: 1}"
Nose Over Your Toes (aka Lucy),116524224,Sport,116191148,5.6,75,1,2.4,16.0,Dive through the trees a little to find the start of the route. Climb up past one bolt and take the easy way through the roof by stepping up on the rock to the right. Slab up past a bunch more bolts to the anchor. Shares anchors with Beginner Route,"{105823960: 4, 111212017: 3, 200387204: 3, 200171016: 3, 200162986: 3, 111770859: 2, 200209902: 2, 106095990: 2, 107768941: 2, 200747875: 2, 105930639: 2, 200065675: 2, 200160322: 2, 200115839: 2, 200525732: 2, 106562865: 2}"
Aretection,116216049,Trad,116191166,5.10d,40,1,2.6,5.0,Climb a lieback seam past some gear to the first bolt.  Make big long moves up the arete past bolts to a tree anchor.,"{106449553: 3, 105904878: 3, 200089239: 3, 106056907: 2, 105833953: 2}"
Black Bug (aka The Dihedral),116227188,Trad,116191166,5.10c,30,1,3.9,14.0,An amazing finger crack in a dihedral that you will wish was longer!  Look for this iconic arching left facing dihedral at the Inversion Wall. The climbing is hard as soon as you start and doesn't really let up. Tech your way up the corner placing small gear to a set of anchors. There is a fixed piece in the middle that is presumably from the FA party. The upper finger crack stays wet for a couple of days after a rain.,"{106449553: 4, 200382594: 4, 200089239: 4, 200414553: 4, 109077806: 4, 105823960: 4, 106036773: 4, 112244217: 4, 105833953: 4, 200162986: 4, 106056907: 4, 200325629: 4, 107422129: 3, 13833: 3}"
The Unhedral (aka Ladybug),118720920,Trad,116191166,5.11,45,1,2.0,1.0,"Twenty-five feet of jumbled moderate climbing to a ledge is followed by twenty feet of thrutching in a stellar bulbous finger to hands to wide crack.  After sorting out the overhanging section (height dependent), an awkward hand, a key ring lock, and thoughtful feet will move you through the crux to an amazing hand jam that unlocks the rest of the route.  Finish at the ledge.  If desired, add a little spice by slinging the anchor long and trending left to another short finger crack that ends atop the boulder.  Tackle The Unhedral.  First cleaned up, TR'd by Tyler and Tom.",{200325629: 2}
Chloroquine Cure,118831576,Sport,118831522,5.10d,50,1,2.5,2.0,"Tons of fun!  An unusual route for Big Rock, and maybe the only lie-back water groove you'll ever do.  Start left or just below the groove, either way on interesting holds and underclings to a possible low knee bar.  Establish yourself in the groove.  This might be the crux.  Use the excellent arete and devise a way upwards, clipping bolts along the way until you reach a phenomenal basin feature that feels like an oasis.  Cross the pine tree ledge, take a breath, and finish on what might be the best 10 feet of sport climbing at Big Rock.  Note: a single hand-sized cam or hex might be useful to protect a big fall from the ledge if the headwall bolt seems too far away.","{200325629: 3, 106562865: 2}"
Corona Crack,118831540,Trad,118831522,5.10a,50,1,2.0,2.0,"Find this finger crack system tucked in the corner on the left side of Isolation.  Use the two tufa-like holds to establish yourself in the short arching finger crack.  Pull onto the pine tree ledge and finish as per Chloroquine Cure.  It is possible to go all gear finish, but a fall could deck you on the ledge.  Gets its grade from the finishing moves.  The crack stays mellow at about 5.8.","{200325629: 2, 106562865: 2}"
The COVID Co-op,118864833,Trad,118831522,5.10b/c,60,1,1.0,2.0,"For the old school adventure climber within you.  Start as per either sequence of Covidian Crisis, but move up the dihedral to the right and over bulges before the pine tree ledge.  Trend right and attack the awesome vertical, flaring crack on the headwall.  Jam and jug to a pre-crux stance.  Protect high and decide to go up (awkward slab move) or left (heady balance hand-tiptoe moves with increasingly positive features).  If you close your eyes, the route almost feels alpine... almost.  Create an anchor at the top.  Possible to rap off Chloroquine Cure or to walk off.  You can also skip the high crux and rap off of Covidian Crisis halfway up; if you use the left starting sequence and end there, it's 5.moderate.  ","{200325629: 2, 106562865: 0}"
Covidian Crisis,118831656,Sport,118831522,5.11b,30,1,1.5,2.0,"A short but challenging slab route.  Starts right of Chloroquine Cure on steeper rock.  A couple of start sequences are possible, left being easier for those of a shorter persuasion.  Once standing on the small ledge, the sustained crux section will unfold itself.  Move upwards finding the balance-driven compression move.  Some dancing may be required.  Find a way onto the small foot holds and use micro slopers to get you to the dual side pull jugs and up onto the main ledge.  Bonus points for finding the mono fingertip pocket as part of the mantle. Finishes at anchors on the ledge.  Reminiscent of Chica Bonita Wall in the RRG.","{106562865: 2, 200325629: 1}"
The Flake,116227365,Trad,116191184,5.11,25,1,2.8,8.0,"A great way to finish yourself off at the end of the day. Classic butt-kicking.  Layback your way up pumpy flake. Continue laybacking to the top, or make a transition move into jamming about midway. Both are tough and pumpy.","{106449553: 3, 13833: 3, 105833953: 3, 200160322: 3, 106904776: 3, 200162986: 3, 108088813: 2, 200440173: 2}"
So Low,116569781,Trad,116191184,5.7,50,1,1.0,4.0,"This is more like two boulder problems stacked on top of each other. Cool starting V0 boulder moves, then a giant ledge, then a friction move and easier climbing. Ledges are your pro if you are going So Low. Leads to Traffic Jam anchors.","{106904776: 1, 200160322: 1, 106095990: 1, 200691707: 1}"
Stellar Slab,116215994,Sport,116191184,5.11a,60,1,2.8,14.0,The trail goes right by this thin slab line with the sport climb Traffic Jam just located up hill to the right.  Climb off a boulder past thin slabbing moves.  Continue up past another thin bulging section to the anchors at the top.  ,"{200058035: 4, 200160322: 4, 200241195: 3, 200387204: 3, 107422129: 3, 200440173: 3, 106904776: 3, 200162986: 3, 111770859: 3, 105833953: 2, 108088813: 2, 106449553: 2, 106056907: 2, 105904878: 2}"
Traffic Jam,116216008,Sport,116191184,5.6,60,1,2.2,16.0,Traffic Jam climbs the right side of the Lower Shaman Wall.  A few fun slab moves broken by some stances and easier terrain.,"{200387204: 3, 200713597: 3, 200713909: 3, 200160322: 3, 200691707: 3, 200129124: 2, 105930639: 2, 200065675: 2, 105904878: 2, 111770859: 2, 106095990: 2, 200434751: 2, 106904776: 2, 200162986: 2, 200166580: 1, 200171016: 1}"
5.9 Offwidth,116508584,Trad,116191130,5.9,50,1,2.2,10.0,"Scramble up the dirty gully in the center of the main wall.  If you're a hard man, pull out your #4 and #5 (or even #6) and climb the offwidth in good style (5.9)  If you'd rather not lose skin and clothing to the offwidth, clip the two bolts on the face to the left and stem your way up instead (5.7). Technically this isn't ""the climb"".  Either way this is a better way to gain the ledge and the climbs above rather than climbing the slab to the right.","{200747875: 3, 105833953: 3, 200434751: 3, 200671776: 2, 200542200: 2, 200241195: 2, 200129124: 2, 105904878: 2, 106562865: 2, 200065675: 1}"
Big Rock Candy Arete,116227060,Trad,116191130,5.11b/c,80,1,3.6,11.0,"This is one of the most classic lines at Big Rock. It has high quality rock, unique granite features, and great movement. Not to be missed if you are climbing at the grade.  Gain access to the bolts on the Main Wall alcove by either climbing the 5.9 OW to the left, or BR Candy Direct to the right. Look for a set of three bolts next to an overhanging flake rail. Ride these hero sized jugs to the third bolt and the stopper crux. Move left around the arete on the face that has amazing knobs. Tech your way past two bolts to gain the ramp. Move up the ramp and step back right when easy. Easy run to the anchors.  This pitch is easily top accessible. You can also rap twice to the ground with a 60m or once with a 70m. You can also link the 5.9 OW into this climb for a ~115' pitch.","{106449553: 4, 107422129: 4, 106904776: 4, 105833953: 4, 200162986: 4, 106056907: 4, 105904878: 4, 106036773: 4, 108088813: 3, 200241195: 3, 107768941: 2}"
Big Rock Candy Direct,116227099,Trad,116191130,5.10c/d,40,1,3.0,12.0,"A fun face route not to be missed. More in line with the grade for P2 than the 5.9 OW. The route unfolds as you move vertically.  Start on some thin friable edges. This section will clean up more over time. Get into the groove and reach right to clip the first bolt. Pull the funky thin flake to gain a horizontal. Move right to get a cam or two. Pull the tricky moves straight up below the second bolt. Move up on thin feet using the arete for a sidepull to the last bolt. Surmount the face and clip the bolt on the slab with a 24"" runner and head left to the anchor.","{200259924: 4, 106449553: 3, 105833953: 3, 200241195: 3, 111770859: 3, 105904878: 3, 108088813: 3, 112104441: 3, 106056907: 3, 200129124: 3, 109077806: 3, 107768941: 2}"
Booger Picken,116524143,Sport,116191130,5.10c,75,1,2.4,5.0,Pretty decent holds and a right angled ramp lead to the first high bolt. But the business starts here. Crimp up on very small edges and dimples in a bouldery sequence to the 2nd bolt. It eases off shortly after the 2nd bolt and then gets considerably easier after bolt 3 where you run it out to the anchors. Shares anchors with Slim Pickens  You can access these anchors for TR by climbing How Do You Want Your Eggs on the Hominid Wall and then rapping/lowering over.,"{106562865: 3, 200241195: 3, 106904776: 2, 106056907: 2, 200209902: 2}"
Dr. Strangelove,116244010,Sport,116191130,5.11+,80,1,3.0,2.0,"This is a hard but well-protected slab with impossibly blank looking moves down low and an interesting dike and knobs up higher. The start is easily aided for those wishing to keep the grade in the low 11 range.  Start at the top of the gully (have your belayer down the gully), on the far left end of the small ledge, and traverse hard left past the initial crux to better holds (a little magic helps here). Continue up the bolt line, following the dike (some hidden holds on the right also) to a sloping ledge. From here, easier but runout slab (if you made it this far the runout will be tame) leads the anchor above a short flake.","{106056907: 3, 106904776: 3}"
