name,id,type,area_id,grade,height,pitches,score,votes,description,star_ratings
Flakey,116507370,Trad,116191130,5.8,80,1,2.8,19.0,Climb the obvious arching flake past two bolts then up onto the easier face past two more bolts to the anchor. Really a fun route for the grade.  This can be climbed as a pure Sport route but the bolts are oddly placed so it feels better with some trad gear if you're new at the grade. You can place a #3 in the crack between bolts 1 & 2. It's pretty easy climbing past bolt 3. There's a weird slab move you have to do before you can clip bolt 4. Look for a #2 placement on the left to feel better about it or if the feet are wet. Make the slab move crux after clipping bolt 4 and run it to the anchor  There is an anchor on top of the next smaller ledge at the start that you can anchor your belayer too if desired. Also be careful when on the ledge to not kick anything off as it will fall down on anyone climbing S-Crack,"{200160322: 4, 106562865: 3, 200345841: 3, 200387204: 3, 200747875: 3, 200713909: 3, 106415391: 3, 200411862: 3, 200065675: 3, 200325629: 3, 200171016: 3, 111770859: 3, 200073791: 3, 200162986: 3, 105833953: 2, 200129124: 2, 105904878: 2, 200741505: 2, 109077806: 2}"
Heat Wave,116669777,Trad,116191130,5.10b/c,110,1,3.0,2.0,"Cool variety with a flaky crack, knobs, crystal slab, and an occasional jug. Begin on flake 10 feet left of S Crack with gear to a big jug near a rhododendron.   under first bolt move left foot shelf, clip bolt, find crystals on slab, then fire up for a white splotch jug .  Mantle to large ledge that is the start of route Flakey.  From the anchor at start of Flakey, move left up ramp on gear, then past sequential moves on face with 3 bolts.","{106904776: 3, 106415391: 3}"
Optical Delusion,116216451,Trad,116191130,5.10+,90,1,2.4,5.0,"Make some sideways moves on the horizontal crack to get up to the first bolt.  Thin, hard moves lead to the second.  Continuing working to get to the third bolt, then the ledge.  Easier climbing up past another bolt and anchors at the top.","{106449553: 3, 105833953: 3, 105904878: 2, 106056907: 2, 112508787: 2}"
Picken & Grinnin',116216469,Trad,116191130,5.11,60,1,3.1,9.0,Climb the initial delicate moves up and left on a steep ramp to the crack.  Work left and up to another bolt.  Enjoy the great edges to the anchors at the top.,"{106449553: 4, 105904878: 3, 106056907: 3, 108088813: 3, 112104441: 3, 105833953: 3, 200129124: 3, 200209902: 3, 200162986: 3}"
Picken' on the Fat Kid,116227124,Trad,116191130,5.9+,90,1,2.7,3.0,One of the few true chimneys in the region. Quite entertaining to watch!  Start about 15-20' inside the chimney at some good rails. Follow good features until the chimney starts to squeeze down. Place a larger cam here and begin to move right. Continue moving right past another large piece. The chimney begins to squeeze down really tight and the struggle begins. Exit the squeeze onto a flat ledge. Follow the right facing corner feature to another anchor. Lower off down and to the right.,"{106449553: 3, 106904776: 3, 106056907: 2}"
Ramp Arete,116385056,Trad,116191130,5.7,75,1,2.9,15.0,"Step off the block/ledge at the top of the 5.9 off width, clip a bolt.  Then make a balancy move of two to the second bolt.  At a stance you can choose flakes to the left or a crack on the right of the arete.  They both are fun options.  Continue past bolts, maybe a piece of gear or two to the top.  At the top there are two bolts to belay or TR from.  To the climbers right are a set of rap rings.  One rap will get you back to the ground.","{108019832: 4, 200387204: 4, 106036773: 4, 200741505: 3, 112244217: 3, 108088813: 3, 200747875: 3, 200129124: 3, 200065675: 3, 111770859: 3, 106904776: 3, 200954788: 2, 105833953: 2, 200166580: 2, 105904878: 2}"
S Crack,116223777,Trad,116191130,5.10,80,1,3.0,21.0,"The appropriately named S crack is located up hill on the left side of the main wall.  Follow the S crack plugging some gear, jamming, smearing and contemplating whether or not to grab the root ball...your choice!  Continue up to a pillar.  Enjoy some great face climbing and slabbing past 3 bolts to the anchors.","{200259924: 4, 200171877: 4, 106415391: 4, 200241195: 4, 105904878: 3, 200440173: 3, 200209902: 3, 108370856: 3, 200089239: 3, 106904776: 3, 200741505: 3, 106449553: 3, 106056907: 3, 112104441: 3, 108088813: 3, 200162986: 3, 200129124: 3, 107768941: 2, 109077806: 2, 105823960: 2, 105833953: 2}"
Seams Impossible,116232238,Trad,116191130,5.12a,85,1,2.7,3.0,"Climb the impossibly blank looking slab for a few moves (cold temps and a good imagination help) to gain a series of thin seams which lead left. Follow these, traversing left a bit when they peter out, to a small overlap and a stance above. At the stance, clip a bolt way right, then hand traverse the rail up and right to easier climbing and the shared anchor for Picken' and Grinnin'.","{106449553: 3, 105823960: 3, 106056907: 2}"
Slim Pickens,116216418,Sport,116191130,5.10+,75,1,2.4,7.0,"Good holds lead to the first high bolt but quickly give way to harder, thinner climbing past the next couple.  Continue up easy ground to anchors.","{111770859: 3, 108088813: 3, 200241195: 3, 105904878: 2, 106449553: 2, 106056907: 2, 106904776: 2}"
Thar Be Dragons (Slab Ramp),116363865,Sport,116191130,5.7,40,1,1.9,10.0,"This is the ramp sharing the start with Wondercrack continuing left where WC moves right. Gain the first ledge via the cave, clip the first bolt, and pull the single move that allows you to gain the second ledge - clipping the second bolt on the right as you ascend. Follow the third bolt along the ledge using good feet that allow you to gain the anchor below BRCA. From these anchors, rap/lower from the rings or continue up for a second pitch on any number of fun routes on either side of giant chimney (including BRCA). A great route for beginners or those seeking moderate to easy terrain. ","{200162986: 3, 200747875: 3, 108088813: 2, 200954788: 2, 200129124: 2, 200525732: 2, 200387204: 2, 106904776: 1, 111770859: 1, 200171016: 1}"
Thin Skin,116227270,Sport,116191130,5.12,90,1,3.0,2.0,An incredible thin temperature dependent route.  The first two bolts may seem impossible if it is not in the 30's or lower. Thin explosive moves get you up to the third bolt. A hard transition right gains the low angle ledge and the first good rest. Move up the crack then back left onto the face past two more bolts and one last tough sequence. Finish on S-crack's anchors.,"{106449553: 3, 106056907: 3}"
Unknown Slab,116227601,Trad,116191130,5.10,75,1,2.4,9.0,Slab your way up the face between the two corners - Big Rock Candy Arete on the left and Ramp Arete on your right - past bolts and some gear placements.  Can seep after rain.,"{200499117: 3, 200525732: 3, 200387204: 3, 200788741: 3, 112244217: 3, 105904878: 2, 108088813: 2, 200954788: 2, 106449553: 1}"
Vultures,116216434,Sport,116191130,5.10+,40,1,2.0,8.0,Smear and crimp you way past a bolts to a seam feature.  Continue up past another cruxy move to the top.,"{111770859: 3, 105904878: 2, 106449553: 2, 111746326: 2, 108088813: 2, 105833953: 2, 106036773: 2, 106056907: 1}"
Wondercrack,116216406,Trad,116191130,5.9+,100,2,3.0,13.0,Climb a ramp feature past a couple of bolt.  Continue up and right on a diagonal hand crack to a set of anchors.  The second pitch continues up the slab past bolts and gear to another set of anchors.  With careful rope management this route can be climbed in one nice long pitch.   ,"{200741505: 4, 112244217: 3, 200385488: 3, 106904776: 3, 200241195: 3, 200129124: 3, 105833953: 3, 108088813: 3, 112104441: 3, 106056907: 3, 106449553: 3, 105904878: 3, 107768941: 2}"
Barometer,118350550,Trad,117375337,5.8-,45,1,3.0,1.0,"Unique topography.  A more vertical section with positive finger ledges gives way to a well-protected fun slab traverse above a tree.  After the crux move, follow the moderate run out slab, protectable with 1 or maybe 2 finger-sized cams in unexpected locations, or sling the more solid tree on your way to the anchors.",{200325629: 3}
Hygrometer,117375423,Sport,117375337,5.10a,40,1,2.0,1.0,"A fun route with an interesting mix of climbing in a short pitch.  Start on the left-leaning crack/arete feature.  Do not pull on the obvious loose blocks to the left of this feature!  Move up this crack, clip the first bolt, then cross over at the small left-facing corner with good hands.  Pull the small roof and then make your way up the less than vertical face using small side pulls and crimps to the anchors shared with Thermometer.",{200325629: 2}
Thermometer,117375363,Sport,117375337,5.11c,35,1,3.0,1.0,"A tough onsight.  Use good balance or a long reach to get onto the route, moving through a delicate boulder sequence using thin edges, smears, and one good finger jug to the first bolt below the overlap.  Transition to good slab smearing technique through the small roof feature, then find the quartz inclusions to pull yourself to easier ground and the anchors.",{200325629: 3}
Bloods and Crimps,119132811,Sport,116191226,5.11d,30,1,2.0,1.0,"30 feet of full-value non-slab.  Consistent powerful crimps and hard footwork on a slightly overhanging to vertical face.  Holds often aren't quite as positive or big as you'd like.  Starts on top of the ledge on the right end of Paco's Slab wall.  Thug your way up the giant horizontal using a heel hook and a tight crimp, then follow the blunt arête feature up and slightly left.  Don't get tricked by the tempting holds to the right.  Good body position, strong toes, and sequence are important.  Consider using a stick clip, or anchoring the belayer... or both.",{200325629: 2}
Don’t Flake Out on Me,118852904,Trad,116191226,5.8,40,1,2.0,1.0,"Follow the shallow left to right seam up into the roof while placing a nut or large cam down low to protect against a ground fall. Once under the roof move out left, no more than 10 ft, to a good stance under a dihedral. Place a piece or two and pull the roof using a couple hidden key holds. Be careful not to place gear in the detached flake under the roof. ",{200162986: 2}
The Leaner,116233614,Trad,116191226,5.11a,25,1,2.7,3.0,"Big Rock doesn't have many cracks, but it makes up for it with a couple of short beatdowns.  The route starts off thin fingers and rises up and left to wide. The crux is down low.","{106056907: 3, 200162986: 3, 106449553: 2}"
Paco's Slab,116233546,Trad,116191226,5.10a,35,1,2.5,6.0,A fun enough route to go find on a busy day at BR or if you've knocked out most of the others in this grade. Getting to it may be the crux.  Start on some poor quality rock. Tough edging leads to the first low bolt. Two more bolts on technical edging leads to a good horizontal break and a #1 camalot placement. A few more moves gets you to the anchors.,"{106562865: 4, 111770859: 3, 106449553: 2, 200129124: 2, 106056907: 2, 105904878: 2}"
Slab and Punishment,119132892,Trad,116191226,5.10b,55,1,2.0,2.0,"Fun slab on good rock with lots of lateral movement. Start on the small finger ledge, use tiny inclusions to a stance and the first bolt below the jug pocket. Decide if the move to the jug is a slab dyno or not.  Protect, if you brought gear.  Follow the obvious line left to an undercling, up, then right to the sloper garden.  Find your stance in the bowl and the last bolt before the more vertical head wall.  Slab up and place your second piece.  Identify the bolt, and it will lead you to the chains.  Possible to climb as sport only, but a BD 0.75 and BD 1 will have you feeling happy.  Also an easy TR setup.  If you enjoyed Paco's Slab, you'll enjoy this one.","{200325629: 2, 106562865: 2}"
Unnamed,116237375,Sport,116191226,5.10-,40,1,2.2,6.0,"Climb the obvious bolted line down and right of Pacos Slab. Start on steep crimps, which leads to a slab crux and a funky bulge. Continue up moderate face to the tree.","{111770859: 3, 106562865: 3, 106056907: 2, 200209902: 2, 105904878: 2, 200162986: 1}"
Rowan's Leap,116227213,Trad,116191243,5.12a,40,1,3.0,2.0,A boulderer's paradise! A good entry level 5.12.  Begin on a small pedestal with a thin right facing flake. Follow the flake up placing an option finger sized piece or two to get to the first bolt. Clip the first bolt and figure out the explosive sequence to get to the next eyebrow. Clip another bolt and do another explosive move. Clip the tough third bolt and make a couple moves up and right. A tricky slab move gets you to the fourth bolt. More fun slab leads to the anchors at the lip.  Can easily be TR'ed by walking around the formation to the left and gaining the top.,"{106449553: 3, 200089239: 3}"
What a Piece of Crack,116547545,Trad,116547533,5.11a,50,1,1.5,2.0,"You would think a crack would take good pro or have good holds... not so much on either with this one. Pull a friction crux past bolts, then scopped holds on steeper but easier terrain. ","{106904776: 2, 106449553: 1}"
The Cavity,118033163,Trad,118033134,5.9+,40,1,1.0,2.0,"Several good holds and redeeming qualities despite friable rock. This one is not a slab!  Stick clip bolt 1 or use Pro in cracks to protect opening moves. Move up to cool hueco, then a slopey move to gain bolt 2.  Move left on jugrail with a #1 cam as pro.   Mantel ledge using great face holds, then tip toe left to anchors.   ","{106904776: 1, 106562865: 1}"
ReRoute,118108788,Trad,118033134,5.10a,35,1,1.0,2.0,Crux is right off the ground.  Pull sequential moves on small flakes.  Don’t bother with gear until the #1 cam 15’ up in the solid horizontal. Big holds but often crumbly Rock leads to anchors.  Be careful of friable rock if leading. Easy to TR.  ,"{106904776: 1, 106562865: 1}"
Razor,119242585,Boulder,119242477,V2+,6,1,3.0,1.0,Start on the bottom crimp rail two handed and find small feet below. Climb up and over lip and top out.,{200713909: 3}
Briar Patch,116868202,Trad,116191198,5.3,50,1,1.2,5.0,"Start in a 20 foot, fist-sized crack.  There is a hangerless bolt on the slab above the terminus of the crack which can be slung with a nut.  Transition to slab left, or move right around a mountain laurel onto the slab.  There are several opportunities to place cams on the way to the cold shuts in the headwall.  The climbing is very easy, and so might be an option for getting used to placing gear.  The crack could be 5.3, the slab is very easy.  Easier than any route on Hominid, but with the chance to place gear.  It leads to a beautiful part of the rock, with good views.  It might also be possible to continue left along the headwall, and top out near the Grass Fed anchor, but I haven't done this.  The name comes from the guidebook.","{106095990: 2, 111770859: 1, 200525732: 1, 200741505: 1, 105904878: 1}"
Daddy Day Care,116227141,Trad,116191198,5.8,35,1,2.3,14.0,Start up in the gully to the left at a horizontal feature. Make the tough starting moves onto this feature. Continue traversing right placing gear until the crack turns upwards. Get some good gear here and make a couple of tough moves up the crack. Follow this over an overlap to the bolted anchor.,"{200374475: 3, 200741505: 3, 112244217: 3, 200160322: 3, 106449553: 2, 112395218: 2, 105930639: 2, 200400828: 2, 106904776: 2, 111770859: 2, 200209902: 2, 200129124: 2, 105904878: 2, 200325629: 2}"
Free Ranged,116227971,Sport,116191198,5.11a,45,1,3.2,6.0,"Now it is a fun and safe sport route.  Start on top of the big boulder left of the bolt line. Traverse right to the first bolt at a stance. Make slopey moves up under the bulge to get to the next bolt. Climb under an arching feature and make a difficult stand up move. Clip another through cool eyebrows. Move up towards some suspect rock, most of the bad rock has been cleared away, but still be cautious as more can come down. Clip another bolt and move through this section to the anchors.","{200581510: 4, 106449553: 3, 200160322: 3, 106056907: 3, 106904776: 3, 200325629: 3}"
Grass Fed,116227992,Trad,116191198,5.8+,60,1,2.1,15.0,"A odd but popular route. Worth the venture to Upper Shaman.  Climb the funky flakes at the start past two bolts. Above the second bolt you can get a #3 camalot. Move to the right side of the headwall at a really good hold on the arete to clip the bolt. Clip the bolt and make the reachy move left to get into the eyebrows. One more bolt gets you over this bulge. Easy slab leads to a final bulge. Gear can be had below the bulge, then a bolt in the bulge to anchors.  An alternative finish can be done after the second bolt. Move up and left out of the flake that arches left. Finish the same.  The anchors were extended by the CCC to make pulling the rope easier.","{112244217: 3, 200209902: 3, 200687748: 3, 106449553: 2, 200171016: 2, 200764768: 2, 200162986: 2, 105930639: 2, 200129124: 2, 200073791: 2, 111770859: 2, 105904878: 2, 200741505: 2, 200434751: 1, 106562865: 1}"
Similax Crack,116228032,Trad,116191198,5.10c,50,1,3.2,6.0,A wide crack connoisseurs delight. Don't forget to tape up your ankles and hands! This crack was dug out in 2016 by a group of motivated folks. The upper section could use a little more digging to prevent regrowth.  The crack starts in the fist size and goes all the way to #6 at the crux. Arm bars and heel toes are the trick to making it up this beast. Throw in a little body English with some humping and hopefully you will make it to the anchors in one piece. The anchors are slightly up and right on the headwall from where this crack finishes.  You can TR this route by rapping right from Grass Fed to the reddish shuts in the headwall.,"{200551735: 4, 200325629: 4, 106449553: 3, 105833953: 3, 200089239: 3, 106056907: 2}"
Boundary Line,118307003,Trad,116191123,5.6,95,1,2.0,7.0,"Sweet and clean line with a quartz groove, face climbing, and a mini roof step.  Most will use just bolts for lead pro.   ","{200089239: 3, 200747875: 2, 200741505: 2, 111770859: 2, 106904776: 2, 200325629: 2, 105904878: 1}"
Cooler Slab,118306156,Trad,116191123,5.8,95,1,1.8,6.0,"Named for Naturaland Trust’s land manager Wes Cooler, who is the coolest! The route is pretty cool too with a face climbing crux, then a roof crux.  Run outs are on easy terrain (and slightly heady getting to first piece).   Start on left side of pine ledge on a slab by face to a brow 25’ up with first pro.   Head up face past two bolts protecting cruxes.  Continue to the obvious cleft in roof for final crux.","{106904776: 2, 200747875: 2, 200089239: 2, 111770859: 2, 200325629: 2, 105904878: 1}"
First Date,116219109,Trad,116191123,5.10a,110,1,2.3,3.0,"Climb the left arching crack, past on old bolt, to a water groove.  Follow the deep water groove past bolts and the crux to a belay spot on the left.  ","{106904776: 3, 105904878: 2, 106449553: 2}"
Genesis Wave,116223845,Trad,116191123,5.8,60,1,2.0,2.0,Hardest moves might be right off the ground but you'll have to keep on climbing to reach that first high bolt.  Luckily the climbing isn't too bad.  Continue up a water groove past bolts and gear to the anchors.,"{105904878: 2, 106449553: 2}"
I'm Wet,116227172,Sport,116191123,5.9,180,2,2.5,4.0,"Fun face and wide groove climbing. The route often stays wet for a while when the water tables are high, thus the name. Follow bolts up the wide black groove. Step up onto an overlap and follow the white wide groove to a bolted anchor. Lower here or continue up the easy jaunt to the top. Another couple bolts leads to the top anchors.","{200546386: 4, 106449553: 2, 105904878: 2, 106077771: 2}"
Mental Misstep,116216481,Sport,116191123,5.10b,100,1,3.6,9.0,Undercling your way off the ground and up to the first bolt.  Continue up the water groove past several more bolts.  Finish to the right on an older set of bolts or continue up the face to anchors at the top.  This upper section can seep.,"{200115839: 4, 200657923: 4, 106904776: 4, 200453531: 4, 106077771: 4, 105904878: 3, 106449553: 3, 105833953: 3, 200229728: 3}"
The Mountain Goat,119489645,Trad,116191123,5.7,185,1,3.0,1.0,"Get on it after a dry spell (at least 2 days).  Follows the obvious discontinuous crack system at the left end of the pine ledge. Slab up about 25' to a micro cam placement at the base of a crack, or continue up 10 more feet to finger-sized options.  Protect here and make the runout to where the crack begins again.  Reasonable placements from here on out.  Move directly up to the large left-angling flake, and follow it all the way up as it channels you through a tree gap, a step up, and run out low angle slab to the top of X-Wall.  Named in memoriam for the first ascensionist's father who was an avid outdoorsman and mountaineer.Tree webbing belay; walk off or rap.  Possible to rap off with one 60 meter, using two rappels and the anchors on Scout's Slab Paws.  Knot your ends!  A 60 just makes it to the intermediate chains.",{200325629: 3}
Panoply of Possibility,119489595,Sport,116191123,5.10,85,1,3.0,3.0,"Who knew this little gem was hiding at the end of X-Wall?  A bit of a choose your own adventure.  Three start options, two middle options, and three finish options.  The direct start  (5.10+) is on a white streak just left of Sport Route #1.  Tricky and committing starting moves lead up to easier and more textured ground.  Traversing in from the crack on the left (bring a hand-sized cam), or from the right on Sport Route are both easier.  Move directly up to the top of the pillar feature.  Climbing to the right of the pillar in the wide water groove is tougher, and will increase the lead fear factor.  Make harder, but really fun moves to the jug below the roof.  Decide on one of three finishes:1. Traverse right to end on Sport Route #12. Plug an optional hand-sized piece out left from an awkward, but secure stance, find the hidden jug, and work out the traverse to the flared crack (hard if wet)3. Lower from the bolt under the roof and swing slightly left onto the divots below the flared crack (fun, easy, and will bypass wet streaks after a rain)An extendable sling is recommended for all finishes. If going left, move up through an ocean of possibility and lichen to the anchors and chains.","{200325629: 3, 106077771: 3, 200171016: 3}"
pH Balanced,116219119,Trad,116191123,5.10a,180,1,2.3,3.0,"Climb the long white slab past bolts and gear to an anchor at 180 feet.  Good, long, fun pitch.","{106449553: 3, 105904878: 2, 111770859: 2}"
Pick Pocketeer,119489483,Trad,116191123,5.9,90,2,2.0,1.0,Scoops and buckets!  A fun route divided into two short pitches to separate the climbing styles.  Most will likely only do the first half (50') and lower from the intermediate anchors.  A funky low mantle crux and a highish first bolt will keep you on your toes.  A 0.5 cam or confidence is recommended.  The optional second pitch is 5.easy beginner trad that takes any gear and drops you off at the top of X Wall.  Can easily be led in one pitch.,{200325629: 2}
Puff Daddy's,116219137,Trad,116191123,5.8+,90,1,2.5,13.0,This route climbs a cool water groove past some bolts to a bit of gear up high.  Trend left to anchors on Sport Route #1.  ,"{105904878: 3, 105833953: 3, 106904776: 3, 200546386: 3, 200453531: 3, 200326349: 3, 108103821: 3, 105930639: 2, 200741505: 2, 106449553: 2, 111770859: 2, 200129124: 2, 106077771: 2}"
Scout's Slab Paws,119991485,Trad,116191123,5.8-,100,1,2.0,1.0,Starts on the low angle slab before the tree ledge and below the right-facing overlap.  Commit to slab moves before gear is had in the overlap. Continue right and up into the open book corner.  Avoid placing gear in the flexing blob-like feature that looks like Snuffleupagus. Contemplate the crux sequence from a good stance below the bolt.  Head up past one more bolt to chains.  Mostly 5.5ish climbing with a couple of cruxes.,{200325629: 2}
Sport Route #1,116219075,Sport,116191123,5.8,70,1,2.6,17.0,A couple of thin moves off the ground lead up to the first bolt and a fun bit of easy climbing.  A couple of final steep moves lead up to the anchors.,"{200171016: 4, 106077771: 4, 200453531: 3, 200065675: 3, 200441227: 3, 200115839: 3, 200608508: 3, 200137008: 3, 200546386: 3, 106449553: 2, 105930639: 2, 200741505: 2, 200129124: 2, 105833953: 2, 111770859: 2, 108103821: 2, 105904878: 2}"
Hotness,111962536,Boulder,119286466,V2-,10,1,2.7,3.0,SDS on the far right arete. Launch through jugs to an easy finish at the tallest point on the boulder.,"{200684258: 3, 200382705: 3, 108402770: 2}"
Lovely,111838735,Boulder,119286466,V2+,12,1,3.5,2.0,"Far left of the ""Beauty Boulder"" SDS left crimp and right 2 finger pocket. Crimp up through the face and mantle up. Don't use the tree to top out.","{200684258: 4, 108402770: 3}"
Toro Y Tu Amante (Beautiful Traverse),118078559,Boulder,119286466,V3-4,8,1,3.0,2.0,Start on Hotness and do the starting move then move through the crimp traverse left. Make the long reach around the corner to the crimp rail below the bigger hold on Lovely. Bump your right hand down to the fin feature. Bump left hand to the big hold of Lovely and top out on Lovely.  Super fun problem because of the variety of features to experiment with. I found the fin to be the most accessible for making the left hand crux bump.,"{200380724: 3, 200684258: 3}"
Cerebral,111962392,Boulder,119286455,V1-,8,1,3.0,1.0,SDS stemming under the center of roof. Move out right and up on remarkably  incut folds and holds to the top.,{108402770: 3}
Full Frontal Lobes,111962425,Boulder,119286455,V2-,8,1,3.0,1.0,SDS same as Cerebral stemming in the crack corner. Move straight up through the arête in the deepest part of the roof. Pull through solid holds to semi-mantle out.,{108402770: 3}
Can't Sit Here,111838074,Boulder,119286444,V3,8,1,3.0,1.0,SDS right of the corner feature with right hand crimping in the far right crack. Stand up sidepulling the arete. Slopers and undercling get you to the lip. High step and reachy left jug top you out.,{108402770: 3}
