name,id,type,area_id,grade,height,pitches,score,votes,description,star_ratings
Clubhouse Riprap,111838134,Boulder,119286421,V0,8,1,2.0,2.0,Stand almost in the creek and ride the sculpted arête.,"{200731162: 3, 108402770: 1}"
Clubhouse Rubble,111838161,Boulder,119286427,V1-,7,1,2.0,2.0,SDS lowest jug as reasonable. Up and right to the high point. Lots of variations and features.,"{200726148: 3, 108402770: 1}"
Crisps or Chips,111837979,Boulder,119286410,V2,8,1,2.0,1.0,SDS Full frog leg position on the right hand arete with ridiculously low but good crimps. Pull up and reach small crimps out left. Find the left edge and high crimps to roll over the top. Hopefully the crimps are done breaking.,{108402770: 2}
Gumball,111837603,Boulder,119286399,V2+,7,1,0.5,2.0,SDS Crimp just below gum tree sapling. Tree off! Hit the incut edges and reposition to mantle up.,"{108402770: 1, 109097212: 0}"
Gumdrop,118732777,Boulder,119286399,V3,5,1,4.0,1.0,This route is the replacement for the route “Gumball”. “Gumball” used incut edges on a flake of rock that has since fallen from the boulder. SDS Good jug to start & mantle jug,{200155198: 4}
Island In The Sun,118941244,Boulder,119286435,V1,0,1,3.0,1.0,"Start on the left side of the boulder where you will find a small juggy ""bump"". Start with hands on the juggy bump (left on side right on top), right foot on the small shelf directly below the bump, and left leg flagged out. This won't be a sit start as you are right over a stream. Move right along the outcropping until you've reached the end and then move up following the small crack to top out.",{200726148: 3}
Jubblies,111838591,Boulder,119286460,V1,7,1,2.0,1.0,SDS groping through jugz and boobz before mantling into a power stance of completion. Surprisingly satisfying to be so short. YaKnow what I'm sayin'...?,{108402770: 2}
Capital Funishment,111837953,Boulder,119286375,V1,8,1,2.0,3.0,SDS Good jugs to start lead to a half mantle to find high sloping crimps and final mantle.,"{200731162: 3, 200726148: 2, 108402770: 1}"
Chopping Block,111837324,Boulder,119286375,V3,8,1,2.0,3.0,Same SDS as Executioner. Go straight up and mantle on the slopes on the far right bulge.,"{108402770: 2, 200731162: 2, 200736351: 2}"
Executioner,111837072,Boulder,119286375,V4+,10,1,3.0,4.0,SDS left pinch sidepull. Right good crimp. Hit the sloper to the right and make your way left on small sloping crimps before bumping high left for the crimp jug and sloper mantle.,"{200731162: 4, 108402770: 3, 200726148: 3, 108307718: 2}"
Off with His Head traverse,111837156,Boulder,119286375,V3,8,1,2.0,3.0,No text - use the 'Improve This Page' link to add something useful!,"{108402770: 2, 200731162: 2, 200726148: 2}"
Offwidth Is Dead,111836997,Boulder,119286375,V0,8,1,2.0,2.0,"SDS to establish yourself in the obvious offwidth/squeeze. Chickenwing, stem, and mantle past the chockstone and deer bone.","{200731162: 3, 108402770: 1}"
Seamster,111837389,Boulder,119286384,V3+,7,1,1.0,1.0,SDS hands on crimps in the seam. Pull up and left to more sloping crimps. Wrestle out the mantle.,{108402770: 1}
Cervical Contusion,111838424,Boulder,119286450,V4,12,1,3.0,1.0,Start on jugs on far left. Same as Thoracic Shart. Traverse via finger locks in the horizontal crack under roof. Pull around right roof lip. Lock off finger lock and power up to the jugs.,{108402770: 3}
Thoracic Shart,111838390,Boulder,119286450,V4+,12,1,3.0,1.0,Start on jugs on the left face. Traverse around and under to the horn undercling. Power swing/slap (or use intermediary crimps) to gain the right hand arête. Work up the arête with opposition until the huge jugs leading to the top.,{108402770: 3}
Dirty Dan's Great Misadventure,112245118,Boulder,112245095,V3,15,1,2.0,2.0,"Two hand start on left lower lip, up a 60° overhang, then take it up to the left once through overhang, up the right side slab, and finish in horizontal crack on upper right side.","{112103682: 2, 112359489: 2}"
Workaholic,112370964,Boulder,112245095,V3+,15,1,0.0,,"Start on right side of Savannah River Mini Quarry in graffiti cave. Campus start on low roof, then work your way left and up the arete.",
Cat and Mouse,119975108,Trad,119909957,5.11-,95,1,3.0,1.0,"Look for two camouflaged bolts in a row down low. Cool layback move gets you to a thin horizontal seam. Plug a few tiny cams here or don't. Move up to the next stance and the first bolt. Tricky slab moves to the second bolt and the crux. Make moves just right of the second bolt to a horizontal and #1 placement. Keep moving up to the big break and get larger piece here. Move right, then up past some more finger to medium sized gear. Easy runout in the middle gets you to the last bolt. Paddle your way to the ledge and the anchor to the left shared with EVOlution. ",{106449553: 3}
EVOlution,119975057,Trad,119909957,5.10d,95,1,3.5,2.0,"Classic face climbing on clean rock. Has a tendency to seep, but often dries out later in the day or if it hasn't rained in a few days. There is a bit of gear trickery to make this safe. Tape a black tricam all the way down the sling so it will be stiff leaving a small opening so a carabiner can be clipped, EVO tricams make this easier, thus the route name. If you are shorter than 5'9"", you may have to clip a small stick to the tricam to gain a few inches of reach.Start below two overlaps. Move up the ramp to the thin face and traverse up and right to the first overlap. Get a good stance and finger sized piece here. Pull the overlap to another recessed stance. Use your taped evo to reach the next gear placement under the overlap. Push the tricam up into the hold an pull down and viola, bomber tricam placement. Make thin moves to get to the first bolt and pull the funky bulge, fun! Follow the ski track up and right, then back left to the huge horizontal that takes gear. Keep moving right on the horizontal until you can get to the next crack that goes up and left. Move out of the cracks and back onto the face past two more bolts. Two small finger sized pieces protect the last steep moves before the anchors. Move right on the ledge to the anchor shared with Cat and Mouse.","{106449553: 4, 106904776: 3}"
Live & Direct,120017263,Trad,119909957,5.10b,100,1,2.0,2.0,Negotiate some thin slab moves to reach the first bolt.  Climb pass the second bolt and pull over the overlap.  A couple more thin moves lead to the third bolt.  Continue up the face past a second horizontal crack with gear (sling it) and one more bolt.  A bit of thinking will get you to the anchors at the top of the wall.  ,"{105904878: 2, 105930639: 2}"
Itty Bitty Crystal Committee,119974829,Trad,119906420,5.11a/b,200,2,4.0,1.0,"If you liked the big knobs on Knobtopia, this is a harder version with smaller knobs.P1: Start the same as Knobtopia. Continue past three bolts to the bulge. Get the 0.5 after the first bolt. You can belay here with a few more medium sized pieces or continue up to link into one mega-pitch.P2: After the 0.5, instead of moving right to the Knobtopia anchors, continue straight up through a series of bolts. If linking, be sure to sling the lower gear longer. Climb up through some tiny crystals. Good stances at each bolt let you shake out for a minute. Finish on the same anchors as Pumpkin' Chunkin' and Palmetto Plumb.",{106449553: 4}
Knobtopia,119974722,Trad,119906420,5.10c/d,300,3,4.0,1.0,"Phenomenal knob and face climbing. Definitely worth the hike.P1: Start the same as Pumpkin' Chunkin' at the dead pine tree and a series of knobs. Sling the dead tree or stick clip the first bolt. Climb the tree or the harder face to the chunky knobs. Clip the first bolt then trend up and right on easy but runout climbing to a flake with a bolt at the top of it. Pull on top of the flake and continue up to the headwall. You can get a finger sized piece at the headwall, but sling it long. Move right to a bolt before pulling onto the bulge. Pull the bulge and get another medium sized piece. Keep moving right and up into the diorite groove that takes a couple more finger sized pieces to an anchor in the bowl.P2: Move up and left to the line of bolts. Follow amazing knobs past three bolts. Get two small to medium sized pieces of gear in eyebrows above the third bolt. Climb past two more bolts. Keep an eye out for the solution hole that will take a #2 camalot. Trend up and left to the anchors.P3: Move up and right off the anchor heading for a wide groove and a single bolt. You can get a piece of gear below the bolt.Rappel the route three times with a single 60m rope.",{106449553: 4}
Palmetto Plumb,120041251,Trad,119906420,5.11a,240,2,4.0,2.0,"P1 5.11a 140 ft and P2 5.10d 100 ft.  Start under left side of tree island 40 feet up at a small roof in swirled black rock to slab to knobs. Once even with the tree island 40’ up, follow the 5’ in cut flake then up a white face. Bring TCUs. Shares belay with Pumpkin Chunkin. Pitch two moves left to ledge to prominent watergroove with 3 bolts to anchor and is 10d. The crux is bolt protected but gear is still needed on this pitch as well. There is an alternate P2 that is straight up from P1 anchors but only 5.7 and merges right to a different set of anchors. ","{111903483: 4, 106904776: 4}"
Pumpkin Pie,120041220,Trad,119906420,5.9,300,3,3.0,2.0,"P1 (5.9 50 ft): Same  start as Pumpkin Chunkin, tricky. Go up knobs and 3 bolts to a ledge, move left at the ledge to belay on a two bolt anchor. P2 (5.9, 100 ft): Traverse 30 ft left on ledge to finger sized cam placement, then go up knobs past a line of bolts to anchor. Bolts exactly when you need them.P3 (5.9-, 150 ft): move up white crystals past two bolts to a long easy run out, trending far left past the rap anchor and continue up the deep black groove to top anchors. Slight runout in the groove but on easier 5.7 climbing.","{111903483: 3, 106904776: 3}"
Pumpkin' Chunkin',119974901,Trad,119906420,5.11b,130,2,4.0,2.0,"Named after a pumpkin launching competition.P1: Start the same as Knobtopia. Move left after the first bolt past two more bolts to a ledge with some moss pads. Finish below the anchor.P2: Move straight up off the belay. Clip the first bolt short. Move onto the headwall and clip the next bolt. Dance back and forth to figure out the tricky sustained sequence past bolt 2. Grab a sweet orange jug and keep moving up the delicate face past several more bolts. There is a runout on easy terrain to reach the last bolt. After the last bolt, continue moving up on easy terrain while keeping an eye out for the anchors out right on a big ledge.Rappel the route twice with a 60m rope.","{106449553: 4, 106904776: 4}"
Drain The Swamp,119891682,Trad,119891655,5.5,50,1,2.0,1.0,Climb the right trending serpentine crack thing to bolted anchors. ,{105930639: 2}
Fake News,119892953,Sport,119891655,5.9,100,2,3.0,1.0,1. Mantle up on right end of small ledge that is also start to Trumpster Fire.  Traverse to left end of ledge.  Climb up past several bolts to an anchor in a bowl.  Crux is getting to and past second bolt.  2. Pitch two goes straight up past several bolts to an anchor.  Optional gear on pitch two if you want it.,{105930639: 3}
Hair Fuhrer,119893071,Sport,119891655,5.4,40,1,1.0,1.0,This is a connector between the bowl anchor of Fake News/ Trumpster Fire and the anchor of Drain The Swamp.  Climb up and left (mostly left) past three bolts to anchor.  There is a difficult project beneath this anchor that has not been lead climbed.,{105930639: 1}
Trumpster Fire,119892990,Sport,119891655,5.7,75,1,2.5,2.0,Mantle up on ledge at head level.  At fourth bolt hang a hard left past three bolts to a bowl with anchor shared with Fake News.,"{105930639: 3, 105904878: 2}"
Trumpster Fire Direct,119893020,Sport,119891655,5.7,75,1,2.7,3.0,Mantle on right end of ledge and follow bolts straight up to an out of view anchor on large shelf area.,"{105930639: 3, 108381135: 3, 105904878: 2}"
Banshee,119909660,Sport,119906403,5.10,90,1,3.5,2.0,"From the third bolt on Spector, float up and right clipping 7 more bolts while wailing over the crux bulge/roofy thing.  Shares an anchor at left end of mossy ledge with Spector.  A completely separate second pitch is being schemed.","{106904776: 4, 105930639: 3}"
Black Mamba,120013050,Trad,119906403,5.10c,300,3,3.0,2.0,Pitch 1 - Climb shallow right facing corner past a bolt before climbing up the blunt arete and stepping left to the face.  Continue facing climbing up past bolts to anchors.  5.10c.  90 feet.  5 bolts.Pitch 2 - Amazing face climbing continues up past bolts and a cam placement to anchors at a sloping stance.  5.10. 100 feet.  Bolts and a medium cam. Pitch 3 - Continue up the ever easing face past a cam placement (same one!) and a bolt to anchors.  5.7.  100 feet.  Bolt and a cam.Rap the route with a single 60 m rope.Name is in homage to Kobe Bryant who died on the day we completed the route.,"{105904878: 3, 106904776: 3}"
Crystal Anniversary,120044893,Trad,119906403,5.10c/d,190,2,4.0,1.0,"A really fun climb with a mix of face (p1) and watergroove (p2). Dries quickly after a rain.Amazing knobs and crystals on P1. Much of the climbing is slightly right of the bolts on P1 until the last two bolts. Delicate and technical movement get you to the first anchor at a big ledge. For P2, move left into the tricky and sustained watergroove. Bring a #2 and 0.4 for this pitch. ",{106449553: 4}
Harmless Nub (Charmless Chub),119909600,Sport,119906403,5.11,100,2,3.0,1.0,Pitch one is 5.9 face passing a moss pad and a small roof.Pitch two has a few 5.11 moves to start on fabulous nubs.Best done as one long pitch.  A 60 barely gets you down!  Be careful if lowering.,{105930639: 3}
Highway 11,119909841,Trad,119906403,5.11,270,2,3.0,2.0,"P1 5.11b 100 ft. Start at horizontal flake then follow bolts up to center of the treeledge. Bolts 1-3 are close together (for good reason) andangle slightly left.  There is a TCU placement after bolt 3 and another optionalcam under last bolt. Expect a run out near the top on5.9ish terrain. P2 5.11a 170 ft. two goes straight up following a groove past some bolts and small gear, then up and slight left on more gearand an easy run out to anchors. Bring a smallrack and TWO 60M ropes to get down!!.","{105930639: 3, 106904776: 3}"
My Religion,119980594,Trad,119906403,5.10,300,3,3.0,1.0,Pitch 1: Climb the right facing wide flake through the bulge. Continue up the face above to the tree ledge. Belay on the right above the first pitch. Stephen Scoff was the first to climb this pitch.  Pitch2: Climb up and right off the ledge through jugs to gain the laser straight groove. Climb past 3 bolts gaining a perfect belay ledge at the base of a crack system. Pitch 3: Climb the crack till it ends and continue up water groove to a two bolt anchor.  Rap to the ledge above pitch 1 using 2 60 meter ropes then from that ledge to the ground with one 60m rope. Alternate walk to another route nearby and rap that route.,{200184575: 3}
Route 66,119909796,Trad,119906403,5.11,200,2,3.0,2.0,"Starts atop large block that is above a dead pine with a singlebolt belay, just right of surreal swirled rock. Blast straightup through thin crux moves then follow the obvious feature up andleft to the right end of the forested ledge. Pitch two goes straight up to a set of anchors.","{105930639: 3, 105904878: 3}"
Spector,119909705,Trad,119906403,5.10,300,3,3.0,1.0,"1.  Hard moves throughout this pitch will jangle your nerves.  This line may be haunted: mid-climb on Halloween Day a hanger mysteriously fell off....  There are lots of scary, slopey knobs to pinch and pull on.   Go up three bolts then follow bolts left into short corner cappped with a small roof.  After bolt above roof is a .75 Camalot placement.  Anchor is on tree ledge to right.  100 feet. 2. 5.9 watergroove up to anchor. 100 feet.  3. 5.6 watergroove to either pine on left or Highway 11 anchor to right.  100 feet. ",{105930639: 3}
Still Waters,120013779,Trad,119906403,5.11,300,3,3.0,1.0,"Still Waters climbs a varied bit of terrain; including a chimney/flake, a shallow corner, a water groove and some feisty face climbing.  Pitch 1 - Climb up a large chimney/flake to a ledge with a tree.  Some determined face climbing past two bolts leads to some pro and the short left facing corner.  Finesse your way up the corner to a stance and a bolt.  A bit of thin slabbing gets you to a ledge with anchors.  5.11.  100 ft.  3 bolts and small gear.Pitch 2 - Crimp, edge and smear your way up the face a bit right past past several bolts (an old one out right) to the left edge of a ledge with anchors.  5.10.  100 feet.  6 bolts.Pitch 3 - Continue up the left edge of a water groove past several bolts to anchors.  5.9.  100 feet.  4 bolts and a small/medium cam.",{105904878: 3}
Silent Valor,119906349,Sport,119906311,5.10,120,1,3.0,2.0,Fun bolted slab.  You need two ropes or a 70m to get down!,"{105930639: 3, 105904878: 3}"
New Perspective,120041194,Trad,120041167,5.7,390,2,3.0,3.0,"P1: 5.7 200 ft. Stick clip high first bolt or walk over to it from the right. Or just go for it. Mostly bolts, but one small piece (nut, tricam, or even a small cam) is needed halfway up between two farther apart boltsP2: 5.5 190 ft. Trends up and left to anchors.","{111903483: 3, 105904878: 3, 106904776: 3}"
Feelin UR Out,108536034,Trad,119449440,5.10,160,1,2.5,2.0,"An good climb even though the lower section is dirty.    Begin at the obvious slab ramp and crack that rises up and left plugging gear as you go. Follow this to the large block and surmount the roof feature. Get some crucial gear here before making the funky standup on the flake. It helps to place a large piece out left to protect a fall here. This will keep you out of danger of hitting the block in the event of a fall. The next part is the thriller (9R), be sure to bring your brush. Find the good holds and give them a solid brush. Make the insecure moves up onto the bulge. Once your standing on the holds, ease your mind and make a few more moves to the bolt. The next section is fun and sustained sloper climbing on much cleaner holds. Make a run to gain a slabby ledge. Plug some more gear before climbing the easy slab to the last bolt. Clip the last bolt and choose your path up the slab. Left or right (easier) are best, going straight up probably adds a number grade or two. Gain a series of slab ledges with bolts.","{108381135: 3, 106449553: 2}"
Local School System,119673319,Trad,119449440,5.12,275,3,3.7,3.0,"This routes first pitch was established by Jeep and Doc. Next Doc and Whitney pushed the second pitch for a few bolts then Harrison and Jack came along and finished pitch 2 and added the third pitch. It was originally climbed at the grade 5.12 A0. Later on Andrew came through, fell at the first bolt, lowered back down, then onsighted the rest of the route rope solo calling it 5.11d.... unbelievably impressive but given the fact I know the guys character undoubtedly true. My partner and I (as did Harrison) still think it’s a solid 5.12. Respect for all the crushers who assembled this route in great style. Every pitch has a different flow making this a fun unique climb. There’s spots where a fall wouldn’t be fun but we both took falls on our leads of pitches 1&2. Pitch 1: Climb the right side of the giant flake. Carefully sneak out and clip the bolt then dive into the sustained open handed slimper fest to a two bolt anchor. This looks much easier from the ground. Very sustained lots of technical foot work and sussing out body position. 5.11+ Pitch 2: Leave the big cam at the belay. This pitch is characterized by several harder boulder problems but unlike pitch 1 you are rewarded with great stances after each problem. Complete the weird cruxes then navigate a few much easier but still tricky short run outs to a two bolt anchor 5.12 Pitch 3: Climb out left from the belay slinging a horn and continue to get underneath the large overhanging bulge. Get some gear at the bottom to protect clipping the bolt then crank the fun big moves on jugs through the overhang. Take your time on the easy terrain as not to fall here and clip the anchors on the perfect belay ledge. Rap the route with a 70m or double rope. 5.11-","{200184575: 4, 106449553: 4, 110376404: 3}"
Peelin' Feelin',108515987,Trad,119449440,5.10c/d,250,2,3.7,3.0,"One of the easier routes on the main face, but don't let it fool you. This one makes you work for it, wishing the next bolt was just a little closer. While the bolts are well spaced, it is by no means a dangerous route, despite what your butt may be telling you.    There is a direct start that comes in from the left with two bolts and one finger sized piece of gear. It is a stout variation, but preferred if you don't have the #6 camalot or don't like offwidths. Getting off the ground is tricky and spicy. The spiciness ends after you clip the first bolt, but the rest of the climbing is thin and sustained. It was suggested that it was 11b, but I would call it closer to 11c/d.     Start at the obvious left-facing offwidth corner. This corner often runs, but can be aided. Power up the corner and onto the face above. You will reach a slabby ledge with a horizontal crack that runs across it and up the right eventually turning into a vertical crack. It is imperative that you belay here on the horizontal. P2, step up and left trending to the first bolt. Once at the first bolt the wall becomes thin and technical crystals and knobs. Enjoy the wild ride to the crux just below a steep bulge. Get past this and get psyched for the final crux of a sustained smear fest. Once past here, enjoy the easy but runout romp straight up in a brown water groove with big holds. Step left to get to the anchors just to the right of a large water streak. There is small gear out right here as a directional to protect your second from a potential swing after unclipping the last bolt.","{106449553: 4, 107832520: 4, 106056907: 3}"
Silent But Violent,113854035,Trad,119449440,5.11c,300,2,3.5,2.0,"A good well-protected adventure straight up the Main Wall. Steep slabby granite at its finest. Lots of sustained climbing on the first pitch. Bring your fanciest dance shoes.Start underneath an overhang at shoulder height. Make a tough move to start. Easy moves lead to the first bolt. Clip the first bolt and start the sustained 10/11 climbing. Follow past another bolt, then some thin gear (offset good here) along with some nuts. More thin gear leads to a bolt. Keep following the arch left past another piece of gear and pull up next to the moss pad. Some more gear leads to a bulge and the bolted crux. A long section of mostly slopey knobs and hard slab leads past several bolts to the anchor. 170'Make some hard moves to the right of the anchor to get off the belay. Clip the first bolt and get into the ramp to the left. Follow slab to crystals and cool waves to another bolt. Another bolt gets you to a cool shallow groove in the slab. A short run leads to a right facing flake corner. Follow the flake to the overhang, step right and finish over the bulge to the final anchor. 120'","{106449553: 4, 106056907: 3}"
Stone Wall Action,108603499,Trad,119449440,5.11,400,4,3.8,6.0,The first technical line done on this wall which was illegal to climb on at the time of FA in early 1990. Good Granite & no crowds at the time to say the least!   The first 3 pitches each will have a crux with the third pitch runout to the belay but on easy / moderate typical southern slab climbing. Four pitches total to the top.,"{106449553: 4, 105833953: 4, 109058226: 4, 108381135: 4, 106904776: 4, 107274463: 3}"
Vomitous Maximus,116109672,Trad,119449440,5.12a,160,1,4.0,1.0,"Allegedly named for Harrison Shull’s dry heaving while drilling on precarious hooks during the first ascent. Although there are a lot of bolts in the beginning and end, some of the most difficult moves are protected by traditional gear. ",{107481504: 4}
Wheelin' and Dealin',111373846,Trad,119449440,5.11,250,2,3.0,2.0,"Start the same as Peelin' Feelin' in either the offwidth or the bolted line to the left. Climb the short pitch and belay on trad gear above the offwidth in the vertical crack.    Follow the short crack up and right until you hit the slab. Make some exciting slab moves until you reach a horizontal break. The pro here is a little tricky and it helps to place a few pieces. Move above this until you can clip the first bolt. Follow two more bolts into the cool wide water groove that is featured with some amazing crystals. Once past the third bolt, the difficulty eases a lot, but the runout really begins. Pull a bulge to get onto the slab apron. Supposedly there is a horn that can be slung for pro. Keep going straight up the water groove and slightly featured terrain (5.5 R/X). Just below the moss pads you can see above, there is a two bolt anchor off to the right. Breathe, you made it!","{106449553: 3, 106056907: 3}"
Bearly Scared,115969180,Sport,119449453,5.10a,95,1,3.0,1.0,"Although this is listed as a sport climb, this isn't a clip up. This is a ground-up bolted route with a little bit of spice. The route is named after a bear encounter and the fact that it is one of the most well-protected climbs at TR. Most of the climbing is on neat edges and crystals, with a few slab moves thrown in.   Start just left of the first bolt and follow good holds to the first bolt. The next two bolts is the thin crux section. Follow 4 more bolts through some thought-provoking terrain. Easy ground leads to the two-bolt anchor.",{106449553: 3}
