name,id,type,area_id,grade,height,pitches,score,votes,description,star_ratings
The Green Room,119195736,Boulder,119288946,V5,0,1,4.0,3.0,"It's probably worth coming to Abbey Pond just to do this problem. Start matched on the crimp rail and make a big move up left to a sloping crimp. Throw a heel up, make a big cross, and then bust progressively harder moves up the arete, culminating in either a big move to a jug or a delicate rock over onto the face. The top out is easy but tends to get a little dirty, so it might be worth cleaning it off before you send.","{109130361: 4, 111055059: 4, 112404909: 4}"
Hustle Bones,119195824,Boulder,119288946,V4,0,1,4.0,3.0,Start low on large positive crimps and a sideways foot out to your right. Move up and left through a series of good crimps and crappy feet until your hands are high enough to get a foot onto the face. Rock over to a super hard to see slot crimp and then up to a huge jug. Top out with an easy but water polished mantle.,"{109130361: 4, 111055059: 4, 200274823: 4}"
Kook Slam,119207293,Boulder,119288946,V3,0,1,3.7,3.0,"An excellent problem on super cool holds. Start as for Green Room, but after the big cross to the sloper, angle right up the sloping rail. Once at a large shelf, get those feet up, grab the sweet wave feature and rock over. Top out as for Green Room","{111055059: 4, 112404909: 4, 109130361: 3}"
Lizard Brain,119195881,Boulder,119288946,V5-6,0,1,3.0,2.0,"Awesome crimp problem with a deadpoint crux. Start matched in a slot at head height and head straight up through a handful of small crimps. The crux revolves around a precise move to a mailbox slot that is definitely harder the shorter you are. From there, trend left on jugs to another slippery mantle. There is potential for a lower start.","{109130361: 3, 111055059: 3}"
The Catamount Express,119289504,Boulder,119288949,V3-4,20,1,3.0,1.0,A nice left to right traverse on the wall up and to the right from the approach slab from the middle tier. The top out of this climb is also the Dow climb for the climbs on the good trouble wall,{111055059: 3}
Good Trouble,119289260,Boulder,119288949,V9,15,1,4.0,1.0,"Probably my favorite climb at abbey pond and maybe easier in better conditions. Start in the choss crack band and crank up into the overhanging rail feature. An undercling, knee pad and several slaps lead to a unique 1.5 finger pocket and a befuddling final crux.",{111055059: 4}
Ivory Tower,119289458,Boulder,119288949,V4+,15,1,2.0,1.0,"From the crescent jug, pull into the side pull, get a high foot and gun for the top and another press to the top ",{111055059: 2}
White Fragility,119289425,Boulder,119288949,V5-,15,1,3.5,2.0,Start sitting on some small crimps in the crumbly rock down low. Pull up into the arete feature and cut right to a long crimp rail. Make a big move to the lip and press it out. Good problem that is detracted by the rock quality down low.,"{107297781: 4, 111055059: 3}"
All Eyez On Me,118843192,Boulder,113379208,V4,15,1,3.0,2.0,"Stand start tall to reach the very base of the tips crack. Bust a couple thin moves with tough feet to a final cruxy stab to where the crack opens up. Probably easier if you are taller. Finish easily. Actually pretty sweet.  I'm sure this thing has been climbed before because the line is so obvious and close to the road; if anyone has FA info, the real name, or a grade let me know and i can update the page. Also, curious if people have more info on the blocs further up the hill!","{112404909: 3, 106927455: 3}"
Peregrine Dihedral,113395259,Trad,113379203,5.9,90,1,2.0,1.0,Left facing dihedral with a nice crack.,{111344408: 2}
Wildcat,119129163,Boulder,119129125,V7,16,1,4.0,1.0,"Sit start just right of the middle of the overhung face in a good crack jug. Move left onto a shelf, and then make a difficult move directly up from the shelf into a large undercling. Get high feet and grab a sidepull edge up and right. Get your right foot out right to brace and bring your left hand up to a crimp. From there, throw your right hand around the corner and work up the lip to the top. Scary top out.",{106927455: 4}
Ralenti,119129212,Boulder,119129183,V9+,12,1,4.0,1.0,Sit start under the small overhang on the downhill side of La Montre with your right hand down low in a crack and your left hand on a high pinch. Make a very hard and big move out to the sloper lip and slap up it to find the best spot to move off of. Get your feet situated and slap your left hand to a sloper crimp to the left of your right hand. Be prepared for your feet to cut. Work through a couple more sloper tension moves to top out.,{106927455: 4}
Gut Twister,119129514,Boulder,119129485,V8,10,1,2.0,1.0,"Sit start under the small overhang on the downhill side of the Lonely Lump with your left hand in a cool circular undercling feature and your right hand on a non-hold sloper crimp higher up and right. Get a right foot far out right and drop knee. Make a big move up to a sloper shelf, match, and then climb up to the top on good holds.",{106927455: 2}
Demi-Sourire,119129584,Boulder,119129235,V7,12,1,3.0,1.0,Stand start on the right-hand side of the vertical face of Smiley on a good edge. Move up and left into thin crimps. Connect with one of the top crimps of Sourire Pur and top out.,{106927455: 3}
Sourire Pur,119129560,Boulder,119129235,V6,12,1,4.0,1.0,"One of the coolest shorter problems in the area. Stand start in horizontal crack jugs and go up right to a perfectly formed vertical sidepull edge. Get high feet out left to keep yourself on the wall and move your left hand up high to a smile-shaped crimp edge. After that, get your feet situated, move your right hand to another crimp, and grab the lip with your left hand just below the very top. The crux is not barn-dooring on the move from the sidepull edge to the crimp edge.",{106927455: 4}
Antichasmotic,119033315,Boulder,119033182,V7+,15,1,3.0,1.0,"Sit start to the left of the hole that From Darkness comes out of on a good edge. Move up the arete a couple of feet on good edges and slopers, then move right into a crack seam just above the pit and below the lip. Match your hands in the seam and then move further right to top out where From Darkness tops out.  IMPORTANT: There is a real danger of falling into the hole. Trust your spotter and be smart. The crux is situated high up and directly above the hole.",{106927455: 3}
From Darkness (Hole Of Shame),119033252,Boulder,119033182,V11-,25,1,4.0,1.0,"Crawl down the hole to the left of the face (nicknamed the ""Hole of Shame"") and find yourself in a small chamber at the true base of Chasmotic. Stand start on good edges and climb out of the hole using interesting beta. The boulders behind you and to your right are off. There are some reachy moves. Once out of the hole, utilize crimps to move up to a half-circle shaped group of edges. Get a high right foot and reach as far as you can up and right to a bad crimp. From there, get another high right foot and move your left hand into a crack-pocket. Dyno to a right-hand edge up and right, then slap the top.  IMPORTANT: You should feel confident before trying this, there is a very real danger of falling into the hole (the cruxes are directly above it). Trust your spotter as well.",{106927455: 4}
Hexahedron,118765476,Boulder,118765458,V2-,8,1,1.0,1.0,"Start down low on the corner (highest point) of the boulder with your feet underneath the small roof and around the right side. Move up to a decent edge with your left hand, then the same with your right. Bring your feet over the edge and stand up to top out on good holds.",{106927455: 1}
Tesseract,118765502,Boulder,118765458,V1,8,1,1.0,1.0,Sit start down low around the corner to the right from Hexahedron on a good edge. Move up into an undercling directly above the edge and bring your left hand up to a sloping hold higher up. Get your feet onto the start edge and use small crimps to reach the top.,{106927455: 1}
Brilliant Cut,118745471,Boulder,118745404,V6,10,1,2.0,1.0,Start with your left hand on a small crimp under the lip and your right finger-of-choice in a tiny pocket under the lip. Move up to the lip off of low feet and perform a strange and difficult mantle/hand-foot match to stand up on the lip. Move off of bad crimps and small feet on a slab to top out.,{106927455: 2}
Diamond In The Choss,118745410,Boulder,118745404,V6-,12,1,3.0,1.0,"Compress the diamond-shaped front of the boulder to the peak. Move off of low holds to the left arete, then move right and up. Top out on the peak.",{106927455: 3}
In The Rough,118745504,Boulder,118745404,V5,12,1,1.0,1.0,Sit Start down in the cave to the left of Brilliant Cut on the edge of the boulder. Move on sharp edges to the lip of the boulder and reach up to a right0hand crimp on a small arete to hand-foot match with your left hand on the lip. Stand up and use the arete to top out.,{106927455: 1}
Fin,118757961,Boulder,118757898,V5,10,1,2.5,2.0,"Starts on the furthest left edge of The Fin, work up the arete to top out.","{200285145: 3, 106927455: 2}"
I'm Not A Seal,118757940,Boulder,118757898,V4,16,1,2.0,1.0,Sit start on the far right of the fin in some pockets and edges. Slap up to the lip and continue along the lip to the very top.,{106927455: 2}
I'm Not A Seal (Low Sit),118757954,Boulder,118757898,V7-,18,1,2.0,2.0,Start at the start of Six-Gilled Shark and work into the regular start of I'm Not A Seal.,"{106927455: 2, 108910397: 2}"
Six-Gilled Shark,118757917,Boulder,118757898,V8,12,1,3.0,2.0,"Sit start low on bad, sharp crimps with low feet. Stand up into a crimpy left-hand undercling and then move your right up to a pocket edge below the lip of the top. Slap your right hand up further to the top. Move your left hand up higher on the undercling edge and then bump your right hand to a good jug at the top. Top out from there.","{106927455: 3, 108910397: 3}"
Frog's Legs,118758034,Boulder,118757984,V5,15,1,1.5,2.0,Start at the base of the ledge on the face closest to the river on good holds. Work to the right and around the arete to top out on The Toad.,"{106927455: 2, 109046071: 1}"
The Frog,118758078,Boulder,118757984,V4,12,1,2.6,5.0,Start at the base of the ledge closest to the river. Climb straight up the middle of the face to the top on small edges and good holds.,"{109130361: 3, 200498435: 3, 109046071: 3, 106927455: 2, 200391175: 2}"
Mr. Bumpy,118758025,Boulder,118757984,V0,8,1,0.7,3.0,Start on a good edge with good feet and work up to top out.,"{106927455: 1, 200391175: 1, 109130361: 0}"
Poison Dart,118757999,Boulder,118757984,V7+,15,1,3.0,1.0,"Start low on small edges with very low feet and compress the corner until you reach the big ledge above the arete. From the slopey ledge, grab a precarious-looking flake and move your feet into a position so that you can reach the next decent flake before the top. Grab the top and move your feet up to the left, then reach further back for a good top out hold. A great compression problem that is oddly difficult.",{106927455: 3}
Slime,118758095,Boulder,118757984,V0+,10,1,1.0,1.0,Close to the very beginning of the ledge uphill from the river. Starts on a good edge and works directly up from there.,{106927455: 1}
The Toad,118758049,Boulder,118757984,V4,12,1,2.3,4.0,Start on the corner arete at the base of the ledge and use small edges and slopers to the top.,"{106927455: 3, 200391175: 3, 109130361: 2, 109046071: 1}"
Genesis,118745362,Boulder,118745336,V9,20,1,4.0,1.0,A long route starting before the very beginning of the roof. You traverse up from the very base of the boulder facing the small valley into the roof and top out at the very edge of the roof. As you turn the corner into the roof moves the holds start to become very thin and unpleasant to hold. Fair warning: the top out will make you look like a whale. Make sure to bring at least three pads for this problem as the landing is steep and rocky.,{106927455: 4}
The Giver,118825633,Boulder,118745336,V9,10,1,3.0,1.0,"Sit start underneath the roof from Genesis on two well-chalked crimps - some of the only holds low on the roof. Make a dynamic move out to a crimp pinch straight above your head with your left hand. From there, swing your right hand into a decent crimp on the Genesis crimp rail. Then, move your left hand with high feet into a bad undercling above your head, make a powerful move to a left-hand side pull higher, bump your right hand again, then bump your left hand to another undercling higher up. From there, bump to the top out.",{106927455: 3}
The Peter Gabriel Variation,118812187,Boulder,118745336,V9-,0,1,4.0,1.0,"Sit start on the same start as Genesis, work the Genesis line of crimps out to where you start to turn underneath the roof on Genesis, instead, top out to the left of the Genesis top out on side pulls and underlings, powerful moves.",{108561660: 4}
Shelf Life,118825670,Boulder,118745336,V2+,8,1,2.0,1.0,"Sit start on a small ledge/boulder across from the large main Hidden Valley boulder. Your start holds are good, a large shelf and a pocket towards the back-right of the shelf. Move up to a smaller shelf with your right hand then bring a foot up to the start. From there, slap up to the lip and top out on the peak.",{106927455: 2}
Crusader,118749428,Boulder,118749415,V0,20,1,2.3,3.0,"Start as far right as you can, this boulder is not very tall. Traverse left on good pinches, pockets, and edges. Top out just past the Eastern Hemlock at the peak of the boulder.","{106927455: 3, 109130361: 2, 200066867: 2}"
The Cyclops,118807204,Boulder,118749415,V5+,7,1,2.5,2.0,"The crux is definitely the start. Sit start nearly laying down, your left hand around the sloper edge below the eye hole. Your right-hand stretches to the far-right arete in line with a good crimp edge down low. Get an awkward high left or right foot on a small crimp or a small foot underneath the small overhang on the bottom of the boulder. You will likely need to toe hook or heel hook around the small arete on the left below the eye. After pulling off the ground, go to a good right-hand crimp edge in line with the eye. Move into the eye and then to the top.","{106927455: 3, 109046071: 2}"
Effigy,118825714,Boulder,118749415,V1,8,1,3.5,2.0,Stand starts far right in a crack and left-hand dish below the crack on the small ledge in the corner of the Holey Land. Then traverse using amazing Hueco-esque pockets to below the tree on the top of the boulder. Top out straight up and to the right of the tree.,"{109046071: 4, 106927455: 3}"
Effigy Sit,118854136,Boulder,118749415,V1+,10,1,2.5,2.0,"Sit start to Effigy, start directly below the stand start with your left hand on an undercling nub low and your right hand in the crack.","{106927455: 3, 109046071: 2}"
The Father,118854093,Boulder,118749415,V0-,10,1,2.0,1.0,Stand start on a good pocket rail with decent feet in the middle of the face. Go straight up using good pockets and edges to top out.,{106927455: 2}
The Manuscript,118825741,Boulder,118749415,V1,8,1,3.0,2.0,Start to the left of Effigy on the same ledge. Sit start on a good jug/pocket rail and make a slightly dynamic movement up to a sloper/jug just below the lip. Top out on tree roots.,"{106927455: 3, 109046071: 3}"
Pamplemousse,118880907,Boulder,118880803,V7,10,1,2.0,1.0,"Sit start on the far right corner of the LRTC boulder, to the right of where Verfont tops out. Your left hand is an edge out far-right and your left hand is a crimp edge low on the arete. Get an awkward toe-heel compression-combo on the arete and lift off the ground to slap a sloper up and to the left on a small lip. Climb straight up the arete with decent feet and interesting pocket holds to top out.",{106927455: 2}
Verfont,118880858,Boulder,118880803,V8-,14,1,3.5,2.0,"Situated on the smaller boulder wedged underneath LRTC to the right, this problem features some cool font-like holds and movements. This is an arm scraper for sure. Start with no feet on two sloper edges on the far left of the small boulder underneath LRTC's overhang. Work up onto a good but sharp fin and then throw out right to catch the side of the boulder. Get a strange high toe hook and bring your other hand to that side as well. Cut your feet and then work slopers all the way up the lip of the boulder to where it turns again, then slap the top for a good jug.","{200285145: 4, 106927455: 3}"
Megalith,118745315,Boulder,118745293,V7+,18,1,3.3,3.0,Start on the far left underneath the top boulder in a chalky crack. Move right underneath the boulder on bad feet and a crappy mix of sloper and crimp holds. Move all the way right until you are able to reach up and over the lip to a good edge. Top out on good holds.,"{106927455: 4, 109328345: 3, 109046071: 3}"
Menhir,118771046,Boulder,118745293,V8-,10,1,2.0,1.0,"Start in the crack where both Monolith and Megalith start, make your way out to the lip of the boulder and into the huge triangle jug like Monolith does, but then get a high left foot on one of the holds underneath that you used for a hand and dyno straight up to the top. Top out is a little bit tricky as there are poor choices for both feet and holds.",{106927455: 2}
Monolith,118745305,Boulder,118745293,V9+,15,1,3.0,1.0,Start on the far left underside of the boulder in a very chalky crack. Move directly out to a side pull edge and traverse the lip of the top boulder. Top out near where the Eastern Hemlock comes close to the rock and close to the finish of Megalith.,{106927455: 3}
Almond Blossoms,118754077,Boulder,118754027,V8-,16,1,3.5,2.0,Start low under the roof on a series of small holds attached to a triangular chunk of rock. Use lower feet and move left to a bad crimp. Get your feet up and make a dynamic move to a right-hand incut-crimp high up. Move your left hand up and then get your feet so that you can begin moving right to top out just past the tree. The top out is slabby with good holds.,"{106927455: 4, 200391175: 3}"
Half Lotus,119187736,Boulder,118754027,V6,10,1,3.0,1.0,"Climb Water Lilies until it is possible to move right to a good crimp at the far left of Almond Blossoms. Cross under this, and traverse right into the finish of Almond Blossoms.   Is it low like Water Lilies? Yes. Is it dabby on the tree like Almond Blossoms? Also yes. But it's longer than both and a good circuit problem.",{108529353: 3}
Water Lilies,118758192,Boulder,118754027,V6-,12,1,2.8,4.0,Starts on the same start as Almond Blossoms and goes left into small crimps and edges. Tops out on a great jug at the top of the problem.,"{106927455: 4, 108529353: 3, 110989228: 2, 109328345: 2}"
Lincoln Logs,118757710,Boulder,118757703,V4,15,1,2.5,2.0,Start in the middle of the face and use various crimps and edges to top out to the left of the tipped over hemlock.,"{200371045: 4, 106927455: 1}"
Lime Climb,118765524,Boulder,118765517,V5,16,1,2.0,1.0,"Start down low and to the left on a small overhung ledge beneath the majority of the boulder. Traverse the ledge to the right and then reach up and over the lip to a good hold. Use a pronounced circular feature on the face of the boulder to move up to a good quartz nodule not far from the top and in line with where you started. From that, get feet up, stand up to a decent large edge, then reach over the top to top out.",{106927455: 2}
The Canal,118776542,Boulder,118749352,V3,8,1,2.0,1.0,"This problem is on the smaller boulder just downstream from the Riverside boulder. Sit start on the side closest to Driftwood Direct, almost down in the water. The start is a small crimp edge, then reach up right to a good sloper pocket on the arete, from there make a dynamic move to the top of the boulder and top out.",{106927455: 2}
Driftwood,118776523,Boulder,118749352,V4-,8,1,2.0,1.0,"Sit start low under the roof (right-hand side of the boulder) on the side of the Riverside boulder opposite the river. The left hand is a good crimp edge and the right hand is an opposing edge down a little lower near the lip. Get a heel-hook around the side and move up to a good crack around the edge, follow it up to the top of the roof and top out on a good jug.","{106927455: 2, 200371045: 2}"
Drumlin,118807246,Boulder,118749352,V0,16,1,2.0,1.0,Start low in the hole on under cling pockets and edges. Move your feet up and use good holds to reach a large positive side pull near the top. Top out on very positive holds. Sort of a PG-13 landing because of the hole.,{106927455: 2}
Good Hook,118807276,Boulder,118749352,V4+,10,1,1.0,1.0,"On the boulder just downstream from the man Riverside boulder. On the slab side. To the right of River Monsters. Sit start in a large under cling pocket with your right hand and use your right foot in the bottom of the same pocket. Brace yourself out left on the slab with your left hand. Power up and bring your right hand up to a crimp edge that runs vertically nearly the whole way up. Bring your left hand up to a similar edge out left, use bad feet to slap into a large sloper near the top of the slab and top out.",{106927455: 1}
Lucy The Newfoundland of Oceania,118794920,Boulder,118749352,V10,25,1,4.0,1.0,"Sit start down low with a left-hand crimp under the roof and a right hand on an undercling low on the arete. Pinch the arete with your legs and lift off the ground to move your right hand into a crack around the side. Move up through the crack to the lip of the boulder into a huge jug. From the jug, traverse the lip the entire way until you get very close to the ground and there is no more roof underneath. Pull up and over with bad crimps and a left hand around a good corner at the end of the traverse. The holds are nearly non-existent on the traverse and it will beat up both your hands, wrists, and shoes.",{106927455: 4}
River Monsters,118795419,Boulder,118749352,V7,14,1,2.0,1.0,"Sit start on an edge down low on the boulder directly downstream from the main Riverside boulder. Move up to a pocket on the arete with your left hand, then get your right foot on the start edge. Bring your right hand slowly up to a vertical crimp edge near the top of the boulder. From that, bring yourself to a standing position on the start hold. Traverse the slab on bad holds just below the top and almost nonexistent feet. Top out on slopers in the upper right-hand corner of the slab. The top is out until you reach the far right-hand corner.",{106927455: 2}
Streamlined,118807231,Boulder,118749352,V7-,14,1,2.0,1.0,The start and mantling up onto the big sloper edge are the crux. Sit start down low to the right of Lucy The Newfoundland of Oceania right next to the river. Use two hands on bad crimp side-pulls with a left foot as low as you can. Pull off the ground to reach up to some small crimps and slopers on the large sloper edge. Do an awkward mantle using various available holds and stand up. You can reach top out holds from the edge. There is a large jug to the left and up on top of the boulder that can be used to help top out.,{106927455: 2}
Wet Feet,118749356,Boulder,118749352,V3,12,1,2.0,1.0,Sit start on the corner of the boulder closest to the edge of the river. Make your way around the corner and up to the top on good pockets.,{106927455: 2}
Arabesque,118762966,Boulder,118762960,V4,18,1,2.3,3.0,"Starts in small vertical cracks near head height with low feet. You may have to gaston. Then you make a powerful move to a large, good edge, get your feet up, grab another good slopey edge, and then get high feet to grab the top where it comes to a ""V"" shape. The top out is a bit daunting as you are pretty high up and there aren't any amazing holds on the top.","{106927455: 3, 200391175: 2, 200285145: 2}"
Mamba,118765551,Boulder,118762960,V10,16,1,4.0,1.0,"One of the coolest routes at Chaffe Falls, looks and feels like its straight out of Fontainebleau. Sit start down low on a right-hand circular sloper feature and a very bad left-hand crimp on the arete. With power and grace, move your hand high to a bad crimp. Bring your left hand up to pinch the arete, bring your right foot up to the start hold, then move your right hand higher up to another bad crimp out right. After that, make a big move around the arete with your left hand to a great hold and top out on decent holds after that.",{106927455: 4}
Snakes Can't Climb,118776504,Boulder,118762960,V5-,10,1,2.0,2.0,"Start low under the lip of a boulder directly to the left of the main Snake Pit boulder. Move your left hand up to a good side-pull crimp, then your right hand to another crimp up right. Get both hands on a good edge on the arete of the boulder and mantle up over the lip. From there, top out on good holds.","{106927455: 2, 200285145: 2}"
Cherry Tree,118757666,Boulder,118757492,V2+,8,1,1.5,2.0,Start to the left of Matsutake standing up. Use the big undercling to get your feet situated then move up to a large edge. Top out above that.,"{200371045: 2, 106927455: 1}"
Kyoto,118757633,Boulder,118757492,V6,12,1,2.7,3.0,"Start close to the start of Shokunin on the good flake to the left of it. Move out left to a thin and sharp, but good crimp. Bring your right hand up to a crimp pinch and then move left into another flake to top out.","{106927455: 3, 108529353: 3, 200391175: 2}"
Matcha,118757681,Boulder,118757492,V2,8,1,2.0,2.0,Sit start on low crimps and work the edges and crimps to the top out.,"{200371045: 3, 106927455: 1}"
Matsutake,118757643,Boulder,118757492,V4-,8,1,1.0,1.0,It starts further to the left of Shokunin and Kyoto on a small edge down low. You will have to scrunch yourself up for this sit-start. Throw up to a bigger ledge and then top out directly above that.,{106927455: 1}
