name,id,type,area_id,grade,height,pitches,score,votes,description,star_ratings
Quartz Crack,112067933,Trad,112064620,5.9,360,4,3.1,26.0,"This is the namesake route on this wall for good reason — a well deserved classic that comes with a sense of adventure. You'll also be the star of the show all day as tourists gawk up at you from the parking lot.  P1 (5.5, ~60'): Go straight up, past 2 bolts to a nice ledge with a new two bolt rap anchor. It's possible (and I recommend) combining this pitch with the next one.  P2 (5.7, 70'): Move left from the anchor and up an easy corner trending back right almost immediately. Near the end of the pitch, continue up steeper terrain past an old pin or two to another nice ledge and a bolted rap anchor.  P3 (5.8, 95'; 5.6R): Move left off the belay again to the obvious crack. Some tricky pro and 3 ancient pins to get started. You'll pass some white quartz through this section that gives the route its name. After 40', run it out over easier terrain to a right facing corner above and a little left (pretty obvious). There are currently some really old, terrible cord slung around a block in this corner. Don't use it. Continue up to a new two-bolt rap anchor just above, under the roof.  P4 (5.9, 100'): Don't skip this pitch. It's the money in my opinion. Traverse low and right until under a corner system and a terrible bolt that can be backed up with a very small cam. Move up from here, passing more ancient relics (and gear options that you should use) through the crux corner. Expect this to either be wet or mossy. Go all the way up this corner to under a roof. Don't traverse right too early. See                P4, traversing too early.  Don't go this way!  You're supposed to be up about 15 ft. higher into the corner above where this climber is, directly under the massive roof above.       for what not to do! Once under the roof, move right to a good ledge and gear/tree anchor.  P4 Aid Variation / Quartz Crack Roof (5.9 C2, 90'): Probably the best aid climb in all of Vermont, this variation follows a thin seam in the roof that the traditional fourth pitch traverses underneath. Begin the same as P4, climbing up into the corner under the roof and traversing climber's right with hands just below the roof. When you reach a thin seam in the roof, marked by a crack that is flared left and a few pitons that may have been the belay for this pitch, begin directly back onto the roof. Follow that seam through to some smaller cam and possibly nut placements, clipping an old piton and button head, as well as a brand new bolt along the way. Use a combination of aid and free moves to come over the roof, set a gear anchor, and then bushwack straight back about 10 - 15 feet for a climbers trail for the rappel.  The aid pitch is incredibly exposed with about 300 feet of air directly beneath you, and is an incredible experience for anyone who aids (or just wants to do this awesome route).  Interesting to note that the P3 belay and entire climb of this pitch is totally protected from any time of rain the notch can throw at you, which can be a fun experience.  Descent: You can rap from any of the first 3 pitches easily. Once you top out, you'll have to hike climber's right on the Beduin Trail a bit to another rap route. It's a pretty obvious trail that may be marked with orange or pink tape. Find a trail skiers right which leads to a nice ledge with two anchors on it. The one closest to the edge will have rap rings. A single 60m rope will take you to the top of the first pitch of Flight of the Manatee and a second rap gets you to the ground a few hundred feet climber's right of the base of Quartz Crack. Additionally, if you have a tagline or climbed as a group of three, a single-strand rappel with a 60m will get you from the top rappel station to the ground in one rappel. It is a true rope stretcher so tie your knots. Lighter climbers may find themselves tiptoeing the ground, so have the heaviest climber go first to help.","{200675548: 4, 200181052: 4, 112098552: 4, 107727480: 4, 200428404: 4, 111659732: 4, 200350797: 3, 200167098: 3, 113077522: 3, 200374061: 3, 109869056: 3, 106852549: 3, 200394444: 3, 200335317: 3, 107560545: 3, 107549114: 3, 111087111: 3, 110395141: 3, 107941356: 3, 110164339: 3, 200234568: 3, 200070186: 3, 107226876: 3, 109284031: 2, 106743674: 2, 107820617: 2}"
Bat Cave,107689674,Boulder,109500619,V4-5,0,1,2.3,6.0,"Start on the lowest part of the foot wide shelf. Figure out where to put your right foot to get off the ground and work your way left using heel hook and through a careful hand match till you reach a pretty good left hand pinch. From her figure out some weird positioning and go for the notch at the lip. Slopey top out right.    ( If you have the NE Bouldering guide i believe this lists as Army of Ants V2. V2 this is not unless there is something I'm majorly overlooking, or if you use the cheater block next to the start. I'm tossed up on what to give it for a grade so take it with a grain of salt. This is my best guess based on a few similarly graded routes I've done in the notch, combined with the little info I've been able to dig up. If you have better info like Name, grade, FA let me know. I just wanted to post it up since its rad.)","{106917454: 3, 105898385: 3, 111204599: 2, 111265335: 2, 110970634: 2, 109328345: 2}"
Penumbra,109503511,Boulder,109500619,V9-10,0,1,3.0,3.0,This tall problem starts on a vertical skinny hold and moves up into sidepull crimps. There are 3 options for sidepulls and use these to get to a slot in a crack. From the slot climb straight up to a heady top out. I think its okay to use the roots at the top to finish since there's no exposed rock on top. Be careful because they are loose.    WARNING: be mindful of your fingers in the slot. If you take a fall you have to consciously pull them out as you're falling or else they will get stuck.,"{108910397: 4, 108765178: 3, 111204599: 2}"
Slapjack,111129121,Boulder,109500619,V6,30,1,2.5,2.0,This is an interesting line that runs up the arete just to the right of penumbra. The sit start is hard enough to be interesting. After gaining the obvious jug hold on the arete you can either mantle and step up and right or continue up the arete. The step up and right continues to the top on lower angle but balancy VERY high moves. This is the only line I've topped out. The proud line follows the arete all the way to the top - which can be top roped (hard - 5.12?) but can't be exited due to massive vegetation.,"{200241423: 3, 110617187: 2}"
Bejesus,106733799,Boulder,109500797,V4-5,0,1,2.2,10.0,This is an obvious face climb that starts on the crimps you see in the photo and stays left of the large holds until you get onto the face which is a little highball and spicy (some nice exposure at the top). ,"{106024037: 3, 108910397: 3, 108085357: 3, 105898385: 2, 110989228: 2, 109328345: 2, 111265335: 2, 106187478: 2, 106709875: 2, 111204599: 1}"
Brother John,106784645,Boulder,109500797,V8,14,1,1.8,5.0,"Start sitting in a hole, using a good left and decent right crimp in a crack feature. Stab your way into a good left hand crimp and a vicious right hand quartz razor. A big move to a jug, some tree and boulder avoidance technique, and an easier but tallish topout finish the process. Hard, sharp, and a little squeezed.","{108910397: 3, 106187478: 2, 109804610: 2, 111204599: 1, 200155321: 1}"
Holy Bejesus,110547084,Boulder,109500797,V4,0,1,2.0,2.0,Almost identical climb to Bejesus despite using none of the same holds except starting feet. Start on two underclings 3 feet to the left of the Bejesus start. Reach up for a crimp rail and match on it then climb straight up on more crimps avoiding the Bejesus crimps and then do the high finish for Bejesus after you reach a fin shaped hold up high.,"{108910397: 2, 106709875: 2}"
Slider,117899896,Boulder,109500797,V6+,19,1,2.0,1.0,"An excellent climb that suffers a bit from a tight location! Sit start in the corner of the overhang to the right of Brother John. The right hand is on a large jug feature and left hand is down and left on a large incut crimp. Pull-on and make a big lock-off out left before figuring out a delicate and technical sequence up the slopey dihedral. Find a good spot in the dihedral and make a crux lockoff over the bulge to a good hold.  From here, a few more long reaches between large holds gains easier slabby terrain and an easy topout.",{111265335: 2}
Tomes Arete,111680255,Boulder,109500797,V4,0,1,2.3,3.0,Stand start for Brother John. Start off on line of jugs to the right of the tree and climb up and right to the arete and top out using the slopey arete and jugs.,"{108910397: 3, 106709875: 2, 200241423: 2}"
Biscuit,107204031,Boulder,109500587,V2,0,1,3.1,62.0,A classic problem with great movement. Sit start with your left hand with an incut sidepull at the base of the cool crystal streak and your right with a good edge. Stand up to a good flake further up on the face before matching. Get high feet and reach for a jug up and right. Top out on huge jugs. The best of it's grade in smuggs (assuming the fin is a 1).,"{110956309: 4, 109611408: 4, 109467833: 4, 200235962: 4, 110989228: 4, 106229519: 4, 110190315: 4, 108765178: 4, 106507389: 4, 108012440: 4, 200335317: 4, 109017895: 4, 200285084: 4, 109869056: 4, 200155321: 4, 106646308: 3, 107232016: 3, 112131475: 3, 107739229: 3, 108910397: 3, 112006024: 3, 200374248: 3, 109328345: 3, 107003581: 3, 112797688: 3, 112335098: 3, 109804610: 3, 200462073: 3, 107346586: 3, 200557201: 3, 200160054: 3, 108106981: 3, 200384668: 3, 112238723: 3, 108085357: 3, 109225181: 3, 108257055: 3, 107385412: 3, 106709875: 3, 107214214: 3, 107201572: 3, 106397425: 3, 106303677: 3, 106702886: 3, 106729355: 3, 111893262: 3, 108026348: 3, 110522591: 3, 112084565: 3, 200084381: 3, 110395141: 3, 200087166: 3, 109182219: 3, 200115762: 2, 106917454: 2, 111204599: 2, 107009084: 2, 200312756: 2, 200241423: 2, 108087249: 2, 109130361: 2, 111265335: 2}"
Bisquick,119244380,Boulder,109500587,V2+,14,1,2.0,2.0,"Sit start with your left had on an undercling/pistol grip and right hand on a side pull in the crack featured used at the base of biscuit.  Pull on and make a big move to a good edge and crimp. Find a way to work you feet to where your hands are and work your way through smalls crimps to a good top out.  Feels harder than Biscuit,Brewski arete, Patton arete, but easier than primate so I guess V3-? We’ll see where consensus ends up.","{109017895: 2, 200135688: 2}"
The Doghouse,107204043,Boulder,109500587,V1,0,1,2.0,14.0,"Sit start, move straight up to L-shaped feature.","{200285084: 3, 108106981: 3, 108910397: 3, 109869056: 2, 200160054: 2, 109017895: 2, 108026348: 2, 106709875: 2, 106397425: 2, 106917454: 2, 106729355: 2, 106951068: 1, 106303677: 1, 200335317: 1}"
Gravy,109503500,Boulder,109500587,V1-,0,1,2.0,10.0,"I know this isn't called Gravy, but I am unsure of the name.     Same start as for Local Hero, but climb right into the flake in the middle of the boulder. Get feet and stand up tall to a jug on the lip and top out.","{108910397: 2, 109804610: 2, 200557201: 2, 200160054: 2, 108106981: 2, 106709875: 2, 200265263: 2, 107232016: 2, 108026348: 2, 109869056: 2}"
Gravy Arete,109503504,Boulder,109500587,V1+,0,1,2.5,6.0,"I think this is supposed to start to the right of the flake that the other 2 climbs on this boulder start on. I usually just use the same start as for Local Hero but I traverse right straight to the arete, then climb up.    Once you get the arete climb carefully using small holds and the arete. Watch out for lichen up top, but there is still good holds.","{108910397: 3, 108106981: 3, 200557201: 3, 200285084: 3, 108026348: 2, 106709875: 1}"
The Local Hero,107204052,Boulder,109500587,V0,0,1,1.8,14.0,"Sit start on flake, move left and up.","{109869056: 3, 108910397: 3, 200160054: 2, 108106981: 2, 107201572: 2, 110989228: 2, 109017895: 2, 108026348: 2, 108765178: 2, 106709875: 1, 106951068: 1, 106303677: 1, 106917454: 1, 106729355: 1}"
The Long Way Home,112124715,Boulder,109500587,V6,50,1,3.0,1.0,"This is to the best of my knowledge the longest boulder problem in the notch at 30 moves in total.     Walk uphill from the Biscuit Boulder to the obvious wall above. This wall has problems like The Turning Worm, Who Gets the Chicken, as well as newer problems like Set the Controls and Preacher.      When you see the wall walk along the base around the corner to an obvious undercling that makes the first (sit start) move. From there traverse right to left around the corner using a series of undercling and edge holds until you can gain the obvious large off width crack that forms the top out exit.     This may have been first done by Jon Tome (Tome's Roof) but I think this is the first send from the far right. Named in part after my youngest daughter who despite being only a few miles away is a long way from home.",{110617187: 3}
Mashed Potatoes sit,113532358,Boulder,109500587,V8,0,1,2.0,1.0,The big scary overhang to the right of Biscuit. Start low in the middle on some edges and climb right and up on underclings and try to gain the big shelf that makes the stand start. Needs some cleaning to top out safely.    Has a V4 stand start.,{108910397: 2}
Yoga Master,113633629,Boulder,109500587,V10-11,0,1,2.0,1.0,This is the roof to the right of Long Way Home. It has 3 blade-like rails on the roof.    Start with a slopey left hand and a right hand on a sharp crimp and figure out how to climb the blades out to the slab and top out on the highball.,{108910397: 2}
The Yosemite Problem,113511527,Boulder,109500587,V5,0,1,1.5,6.0,An eliminate. Climbs up thin crimps on the face of Biscuit. Avoid the good holds on biscuit (the rail on the quartz feature and the jug next to it) and avoid the right arete. Most of the crimps are quartz half pad crimps.     Pretty fun for an eliminate.,"{108910397: 2, 112131475: 2, 108026348: 2, 111204599: 1, 106709875: 1, 200241423: 1}"
Bloody Sit,119327034,Boulder,109500743,V11,8,1,2.0,2.0,This is the same as Bloody Sunday except you start on the in-cut jug a foot or two below the normal start.,"{200834076: 3, 200155321: 1}"
Bloody Sunday,109201530,Boulder,109500743,V10-,0,1,3.7,12.0,The leftmost climb on the Nemesis boulder. The original Bill Patton start goes at V10 and starts on a juggy edge and a weird undercling and goes straight to the hard gaston move.     The sit start is more of a laydown start and starts on the right side of the shelf. First move is gaston to the V10's undercling start hold. This goes at soft V11.,"{200062051: 4, 200391175: 4, 109467833: 4, 200246855: 4, 200115762: 4, 110970634: 4, 108765178: 4, 111204599: 4, 112131475: 3, 112425011: 3, 200155321: 3, 108910397: 3}"
The Bone Doctor,115681652,Boulder,109500743,V3-4,12,1,2.5,2.0,"Sit start on the uneven landing matched on the arete or with a small hold out right. Pull on and move up and right traversing the sloping lip using meathooks, pinches and slopers. Keep climbing above the scary landing and execute a committing topout that is shared with ""Bloody Sunday"".","{111265335: 3, 111204599: 2}"
Filet of Finger,109180434,Boulder,109500743,V7-8,0,1,2.8,30.0,Originally posted as 'Nemesis Direct'    Starts directly left of Nemesis under the square jug. Figure the feet out to pull off the ground with an undercling and edge and fire for the square jug. Get the undercling under the jug and work your way into Nemesis and top out as for Nemesis.,"{113437089: 4, 111265335: 3, 110989228: 3, 109369300: 3, 200115762: 3, 200063072: 3, 200062051: 3, 109804610: 3, 200241423: 3, 112425011: 3, 200155321: 3, 200259273: 3, 200088732: 3, 110970634: 3, 108910397: 3, 106861759: 3, 106957118: 3, 108380929: 3, 111204599: 3, 108765178: 3, 106912253: 3, 109182219: 3, 110522591: 3, 107009084: 3, 200400692: 2, 109411750: 2, 111932954: 2, 106729355: 2, 200246855: 2, 108226496: 1}"
Life Saver,119035648,Boulder,109500743,V10,0,1,2.0,1.0,Start on a very incut crimp with your right and a low hidden undercling with your left. Pick your feet and pop to the jugs and hold the swing. Finish Nemesis traverse. Very fun. ,{108910397: 2}
Mindstream,113509355,Boulder,109500743,V12-,0,1,2.0,2.0,Starts on edges above the lower Bloody Sunday start. Climbs up and right to that weird bowl feature on the overhang. Gaston the edge and crimp the ball. Ninja up your heel. Finish Nemesis. ,"{108910397: 2, 111204599: 2}"
Misery Direct,111976545,Boulder,109500743,V5+,0,1,2.6,17.0,"From the start jug get the underclings (only the first 2 are necessary), put your foot on the start hold and fire up to the lip with your right hand. Get the other hold to the left on the lip with your left hand and figure out how to top out. Possible to top out without using the roots on top.","{112425011: 4, 112238723: 4, 200241423: 3, 108026348: 3, 111168950: 3, 200115762: 3, 109405838: 3, 112131475: 3, 108765178: 3, 107009084: 2, 200530726: 2, 200061232: 2, 111265335: 2, 111204599: 2, 106709875: 2, 110989228: 2, 108910397: 2}"
Misery Left,109504792,Boulder,109500743,V6,0,1,1.9,7.0,"2016 update: found new beta, this line is now an eliminate. Do this line without using the lip directly above the start to do the 7 variation.  I believe this starts on a low jug. Make a powerful move to a right hand undercling and quickly get the left hand undercling. Bump left to another undercling and work your way left to the matching left/right crimps. Figure out a way to get the high jug and top out.    Despite the name its worth trying, the holds hurt a bit but the movements are great.","{112131475: 3, 106709875: 2, 111265335: 2, 108026348: 2, 112238723: 2, 108910397: 1, 111204599: 1}"
Nemesis Traverse,106558970,Boulder,109500743,V5,0,1,2.9,32.0,"The ""Nemesis Traverse"" is marked by a hard start, followed by a fun traverse, and then a necky finish.    Sit start this problem on the far right side of the boulder/roof directly in front of the lot.      Figure out how you are going to master the start, then get into the fun traverse on mostly large hold.      As your endurance dwindles, begin to think about how you're going to turn the roof at the far left end.  Mantel, thrutch, and claw your way over the roof at the end, and celebrate.","{111265335: 4, 112425011: 4, 111168950: 4, 106134707: 4, 200088732: 4, 106103271: 4, 105898385: 4, 106751248: 4, 111932954: 4, 200115762: 3, 109405838: 3, 112797688: 3, 106729355: 3, 200155321: 3, 200794606: 3, 108026348: 3, 110970634: 3, 109804610: 3, 112131475: 3, 110522591: 3, 106709875: 3, 108085357: 3, 106187478: 2, 108765178: 2, 109130361: 2, 109328345: 2, 110989228: 2, 111204599: 2, 109182219: 2, 109467833: 2, 108257055: 1, 108910397: 1}"
Oral Surgery,119049692,Boulder,109500743,V6,12,1,2.0,1.0,"A fun party trick parking lot dyno found on the middle of the overhanging Bonedoctor boulder. It lies in between ""Mindstream"" and ""Filet of Finger"" and just left of another new dyno named ""Life Saver"".  Stand start with a pair of high holds about 8-10 inches apart from each other. The left hand is a slopey diagnol edge, whereas the right hand is a quartz pocket-like edge. Pull off the ground with difficulty and toss up to a good hold on the lip. Hold the wild swing and climb up and left on the sloping lip of the boulder to the apex before rocking over the top.",{111265335: 2}
Better than the fingertip lockdown,109503944,Boulder,109500231,V7-8,0,1,2.4,7.0,"Sit start the large crack 4-5ft right of arête, traverse left to start of Fingertip Lockdown, and climb up","{109405838: 4, 200241423: 3, 111204599: 2, 111265335: 2, 112131475: 2, 113437089: 2, 112935042: 2}"
Brews For Bros,119665721,Boulder,109500231,V6,17,1,3.0,1.0,"A great technical crimp face that leads into the highball of ""Brewski Arete"".Sit start low with a large hold for the left hand and a smaller hold for the right hand. Choose from some large feet and pull up to some quality crimpers and work out a sequence that leads to a big move to the chakstine found on the jug of ""Brewski Arete"". Stay tight in order to come in for a match then roll around onto the right side of the arete. Reach up to some good holds and reach for the arete and work your way up the slightly exposed highball to the top of the boulder.",{111265335: 3}
Brewski Arete,109201746,Boulder,109500231,V3,0,1,2.3,12.0,Located on the Brewski Boulder by the info hut.    This might be 2 climbs. I've always climbed this by starting on the high hand holds on the arete and coming around the corner onto the face/slab and climbing that using the left arete and edges.     Bill Patton told me he climbs the left side of the arrete and doesn't climb to the face. He said what I do is what Slivers (V8) climbs into but using the arete is off for that climb. I've always loved the way I do it and it still feels about V3ish.,"{200335317: 3, 108106981: 3, 109017895: 3, 108026348: 3, 110989228: 3, 111265335: 3, 112131475: 2, 200241423: 2, 108910397: 2, 111204599: 1, 106709875: 1, 108085357: 1}"
Brewski left,119017841,Boulder,109500231,V1+,10,1,2.0,1.0,"Start standing up with a good left hand side pull and a high right hand crimp. Figure out your feet, shoot for the juggy lip, and top out. Only a few moves long but not bad. ",{200335317: 2}
Eldunari,119775144,Boulder,109500231,V7-8,16,1,3.0,1.0,"Stand start with a small left hand crimp sidepull found on the arete, and a low right hand undercling. Figure out some feet and pull into the wall. A delicate yet powerful right hand move snags a decent sloping rail. Once here a huge move up gains the jug on ""Brewski Arete"". Once on this jug, continue straight up using the arete and a few hidden holds on the face to a juggy topout and easy downclimb.",{111265335: 3}
Fingertip Lockdown,109503926,Boulder,109500231,V5,0,1,2.0,9.0,Stand start the right arete of the face that is towards the road.     This climb has been described as an injury waiting to happen.,"{109405838: 3, 109804610: 3, 111204599: 2, 111265335: 2, 113437089: 2, 200241423: 2, 109467833: 2, 108910397: 1, 112131475: 1}"
The Fingertip Shutdown,117554204,Boulder,109500231,V9,15,1,2.5,2.0,"Sit start under the overhanging arete with the left-hand low on a gaston found on the arete and the right hand slightly higher on a friction dependent quartz side-pull rail. Pull onto the wall with a vast amount of tension before powering up to higher holds on the arete then continue climbing until a few crimps can be gained and eventually a set of finger-locks. Continue climbing up with a few more precarious moves that lead to an easier finish.   This climb is the full sit-start on the arete that climbs into the  ""Fingertip Lockdown"".","{111265335: 3, 109467833: 2}"
The Pregame,119049793,Boulder,109500231,V1,0,1,3.0,2.0,"Start sitting with a large left-hand sidepull and a bad right-hand slopey edge. Using the large foot, stand up to a decent hold up the dihedral, then smack for the jugs on the arete. Topout early or follow the lip/ arete up and right for more movement.  This climb is a nice addition to the boulder and is a proper warm-up.","{111265335: 3, 109017895: 3}"
Seltzers For Softies,119049757,Boulder,109500231,V6,11,1,3.0,1.0,An awesome delicate and technical face climb on small edges and gastons.  Sit-start with a low left hand jug sidepull and right hand 2 feet to the right on a more slopey pinch. Find a set of feet that work and pull on to the wall. Finesse your way up the small edges and a few slopey holds until you can make a long reach up to the juggy arete of the boulder. Once here a few moves up and right on the lip leads to an easy rock over.,{111265335: 3}
Slivers,109201755,Boulder,109500231,V8,0,1,2.0,3.0,"On the Brewski boulder. This climb starts on the left side of the slab, just to the left of the bulge. Find 2 micro-crimps/edges and pick feet to pull off them and get up into some edges. Use the edges on the left side by the arete, but the arete is off.","{110617187: 3, 108910397: 2, 111204599: 1}"
White Dwarf,113411620,Boulder,109500231,V11+,0,1,3.0,1.0,Four hard moves all stacked on top of each other. Start standing with two underclings and make a hard pull off the ground and toss left hand up to a smooth pinch with a good thumb catch. From here set your feet up and make the crux throw to the giant gaston above. Finish up by matching the gaston and doing one last desperate move above the bulge to a crimp high above. A contender for one of the hardest boulder problems in Smuggler's Notch.,{111204599: 3}
White Dwarf left,113511196,Boulder,109500231,V8-9,0,1,2.5,6.0,"Start with a right hand on the blocky White Dwarf hold and a left hand on a high undercling. Do a big move out left to a sidepull and figure out how to bump or cross right and finish straight up.    Has a V11 sit start. Do the White Dwarf first move, then figure out how to match the blocky hold and get the undercling start hold for the stand.    V8 if you start with 1 hand on the block and 1 hand on the undercling, V9 if you start matched on the block and go to the undercling for the first move.","{108910397: 3, 109467833: 3, 112425011: 3, 111204599: 2, 110989228: 2, 200155321: 2}"
Chickenhead,110815919,Boulder,110815875,V4,15,1,3.0,1.0,"A proud line!   Climb straight up the slab. At the top reach up and behind you to a huge jug. Match your hands, continue straight up on huge flakes, then make a rather committing top out..",{107201572: 3}
Bivalve,108263424,Boulder,108263419,V2,0,1,2.3,6.0,"Start deep in the cave on the lower,left leaning,  of two rails.  Pop up to the next rail and follow jugs to the highpoint of the boulder.    Folks taller than 5'7"" may have a tough time keeping their backs off the ground at the start of this problem.","{109017895: 3, 200146024: 3, 106951068: 2, 108106981: 2, 200335317: 2, 200557201: 2}"
