name,id,type,area_id,grade,height,pitches,score,votes,description,star_ratings
Spliff,112098864,Trad,106826351,5.9,100,1,2.0,2.0,"Start of the slab below the high bolt on the far right end of the cliff. Climb the easy slab to an overlap with a corner crack above. surmount the overlap and climb the crack with some cool moves to a ledge on the left. Continue up the slabby face past a bolt and crucial #1 Camelot, then pull the bulge with some delicate moves to a nice ledge at the top of the cliff. Belay of trees, enjoy the view, then walk down on climbers right.","{109406122: 2, 108321835: 2}"
Who's Your Daddy,106826361,Sport,106826351,5.12c,50,1,3.8,11.0,"A marvelous route. Stick clip/be a little bit brave, then climb low 5.11 for several moves. After clipping, embark on an energy-sapping sequence of opposing sidepulls. Clipping the third draw can be tough, and a vigilant belayer will be able to keep you off the ground should you choose to skip it. Once under the roof, stand tall and ram your hand into the yawning abyss (who's your daddy indeed!). A good knee bar provides pause before the tough, powerful crux that can be done a few ways. Mantle, take advantage of a good rest, and regroup for the last thing you wanted: a difficult slab.","{106544981: 4, 106890179: 4, 109431524: 4, 107503776: 4, 13777: 4, 106115675: 4, 106743674: 4, 106440358: 4, 112354658: 4, 105898385: 3, 106024037: 3}"
Worthless Stud,106840145,Trad,106826351,5.11,0,1,2.9,10.0,Tricky climbing past plentiful bolts yields to good rest before the looming roof. Climb quickly through big jugs on steep terrain to reach a hard move guarding the upper slab. Move past tricky climbing and a mono/pocket/fingerlock to reach the chains (fixed nut and another might be useful).,"{106024037: 4, 108992625: 4, 112354658: 3, 106890179: 3, 106743674: 3, 106751248: 3, 13777: 3, 106418097: 2, 106440358: 2, 105898385: 2}"
A Major,110537576,Trad,106083757,5.10a/b,70,1,2.6,18.0,"The lefthand side of the A cracks. Follow right leaning cracks and flakes, and then finish on A Minor.","{108106981: 3, 200335317: 3, 200084683: 3, 109869056: 3, 200383658: 3, 108529353: 3, 200152826: 3, 200149547: 3, 110491515: 3, 108321835: 3, 109017895: 2, 200428404: 2, 110395141: 2, 200137270: 2, 111650893: 2, 108148696: 2, 106889934: 2, 107549114: 2}"
A Minor,106083760,Trad,106083757,5.10a,70,1,2.8,42.0,"The polished finger/hand crack that dominates the right side of the ""A""-shaped rock at the height of the climbers trail.    A tricky start to gain the crack then cruiser to the top.  This route may feel a little pumpy if you are not using your feet wisely!","{200750676: 4, 200462073: 4, 107120057: 3, 110904961: 3, 109047137: 3, 106852549: 3, 110164339: 3, 200383658: 3, 112404909: 3, 200255881: 3, 108106981: 3, 200335317: 3, 200137270: 3, 200084683: 3, 200428404: 3, 200252454: 3, 200657506: 3, 111087111: 3, 108321835: 3, 108307042: 3, 107682087: 3, 107544240: 3, 106889934: 3, 107237276: 3, 106957118: 3, 106549436: 3, 106230078: 3, 107560545: 3, 105898385: 3, 111650893: 3, 110989228: 3, 107377680: 3, 109568693: 2, 106751248: 2, 200149547: 2, 109411750: 2, 200152826: 2, 108529353: 2, 110395141: 2, 109431524: 2, 109869056: 2, 108148696: 1}"
A-Sharp,107325316,Trad,106083757,5.7,0,1,1.9,33.0,Climb a blocky dihedral to a ledge. Then continue up either on the slab face on your left or using the flake on your right.  Straightforward and fun.,"{200229438: 3, 200536699: 3, 110728444: 3, 200692562: 3, 106741672: 3, 200252454: 3, 109414386: 2, 200149547: 2, 200248447: 2, 200383658: 2, 108106981: 2, 109869056: 2, 200064270: 2, 200428404: 2, 200426442: 2, 107232890: 2, 110337843: 2, 108775232: 2, 108200547: 2, 108321835: 2, 111650893: 2, 111066391: 2, 106679659: 2, 110989228: 2, 110395141: 2, 112038160: 2, 106751248: 1, 108307042: 1, 200309087: 1, 108148696: 1, 111087111: 1, 200406385: 1, 200427395: 0}"
The Chalk Stops Here,114458418,Trad,106083757,5.10c,90,1,2.3,3.0,After the pin... the chalk stops... crimps and pressure toes,"{200426442: 3, 108106981: 2, 200137270: 2}"
Crack of All Trades,117989015,Trad,106083757,5.11d,30,1,3.0,2.0,"Large beginning crack to left of Wavy Goodbye, follow crack to right into finger crack on the traverse.","{109431524: 3, 200137270: 3}"
Dogzilla,110549444,Trad,106083757,5.9+,80,1,2.5,13.0,"Pull two bulges, mostly 5.8 territory and then up to the blank face which will lend you a few (or more if you are shorter) good 5.10 range moves. Once you catch and mantle to the big bar on the right you are through it. Easy climbing to the top.    Peckman's guidebook has it at 11-, was told they changed it to 5.9, I'll keep it at that. I'd say it warrants a 10a/b rating just because of a couple moves, but I'll leave that to the consensus.","{200374061: 3, 200137270: 3, 200536699: 3, 200428404: 3, 200130477: 3, 200383658: 3, 108106981: 2, 109017895: 2, 200149547: 2, 111087111: 2, 110395141: 2, 111650893: 2, 108148696: 2}"
The Flake,119258463,Boulder,106083757,V2-3,10,1,2.0,1.0,"Start on the lowest part of the flake, then follow a series of crimps without using the edge until a dynamic move to the top. Good to warm up the fingers.",{200751676: 2}
Frogs in Space,118981783,Trad,106083757,5.10b,75,1,3.0,1.0,"Just another roof 3 star climb at lower. follow crack and corner system of sticks and stones, below roof move right and take it as a left facing corner. climb another crack onto the face of the wall. Gets dirty up top. 2 bolt anchors.",{108106981: 3}
Gates of Eden,113372959,Trad,106083757,5.10b,50,1,3.0,10.0,"There are a few ways to start the climb, all which have their challenges.  The direct way is straight up a funky crack, puling over a slight bulge onto a ramp.  The ramp ends at the left side of a roof. I found the crux to be the traverse under the roof to it's right side, where you gain some sweet flakes up a left leaning thin ramp to a two bolt anchor.  The climb is steeper than it looks!  Expect a good pump if you don't use the rests.","{200137270: 4, 107232890: 3, 200064270: 3, 200084683: 3, 109869056: 3, 109568693: 3, 108106981: 3, 111087111: 3, 200428404: 3, 109017895: 2}"
Hailstorm,108222851,Trad,106083757,5.10a,100,1,2.8,5.0,No text - use the 'Improve This Page' link to add something useful!,"{110728444: 4, 111650893: 3, 109017895: 3, 107549114: 2, 109869056: 2}"
Harvest Moon,106957126,Trad,106083757,5.8-,80,1,3.0,57.0,"The route begins at the far right end of the cliff band on a broken face below the obvious right-facing, crescent-shaped flake.","{200112937: 4, 109485507: 4, 110989228: 4, 110728444: 4, 200137270: 4, 200383658: 4, 111650893: 4, 200229438: 4, 200226210: 4, 109017895: 4, 200165620: 4, 200062261: 3, 108106981: 3, 200426442: 3, 200117844: 3, 200449036: 3, 200215756: 3, 200248447: 3, 200374061: 3, 200350797: 3, 200335317: 3, 200064270: 3, 109869056: 3, 112512394: 3, 200536699: 3, 200578675: 3, 200364082: 3, 200266279: 3, 200149547: 3, 110337843: 3, 112330857: 3, 108148696: 3, 109431524: 3, 108708188: 3, 108234321: 3, 106679659: 3, 105898385: 3, 106982653: 3, 106957118: 3, 107549114: 3, 110120909: 3, 112012030: 3, 109136692: 3, 111835438: 3, 110395141: 3, 110491515: 3, 108321835: 2, 106743674: 2, 106751248: 2, 107560545: 2, 107237276: 2, 109411750: 2, 110789920: 2, 106852549: 2, 107544240: 2, 111087111: 2, 106889934: 2}"
Highlight,117989034,Sport,106083757,5.12,45,1,0.0,,"sharp flakes to face and anchor,",
"Hush, Mama Thrush",106083774,Trad,106083757,5.8,90,1,3.4,63.0,"On the right side of the middle section of the cliff, is this diamond-in-the-rough.      Locate the ramp-like feature roughly 20 feet off the ground with a blocky--usually wet--start.  Gain the ramp and make some tedious, and slippery moves up to the small roof.  Place some gear, move up over the small overhang using some finger holds to a stance that forces you move up through additional finger moves with slippery feet.  This yields a surprisingly fun finger crack that takes you to the top.","{113460078: 4, 108106981: 4, 108148696: 4, 200335317: 4, 112038160: 4, 112330857: 4, 200441261: 4, 110337843: 4, 200165620: 4, 109017895: 4, 110164339: 4, 200152826: 4, 200117844: 4, 200374061: 4, 112512394: 4, 200226210: 4, 200426442: 4, 110395141: 4, 107560545: 4, 106957118: 4, 200406385: 4, 200462073: 4, 106751248: 4, 106540977: 4, 106230078: 4, 106154776: 4, 106917454: 4, 107664300: 4, 110494556: 4, 106889934: 4, 111087111: 4, 107544240: 4, 108234321: 4, 106852549: 3, 109431524: 3, 109869056: 3, 200261852: 3, 200167098: 3, 200536699: 3, 200350797: 3, 200383658: 3, 107354086: 3, 200428404: 3, 108321835: 3, 106235451: 3, 106743674: 3, 107682087: 3, 108307042: 3, 108775232: 3, 110120909: 3, 110491515: 3, 110789920: 3, 112404909: 3, 109411750: 3, 105898385: 3, 111796230: 3, 111885912: 3, 111650893: 3, 106418097: 2, 107237276: 2, 110728444: 2, 106982653: 2, 200084683: 2}"
In the Pines,106147029,Trad,106083757,5.6,100,2,2.0,29.0,"Climb the easy off width to ledge (often wet), step left for a single pitch of more off width or belay. Step further left to a giant flake. Climb the right side to a left facing dihedral with ok gear (5.7),or at base of dihedral break left for a bolt (5.7)and the top.","{110728444: 3, 108321835: 3, 107941356: 3, 200258516: 3, 200374061: 3, 109869056: 3, 106852549: 2, 111650893: 2, 111087111: 2, 112107732: 2, 111728102: 2, 109017895: 2, 108106981: 2, 200226210: 2, 107787060: 2, 106889934: 2, 106917454: 2, 107560545: 2, 106146984: 2, 107953310: 2, 106751248: 2, 106787715: 2, 107237276: 2, 200383658: 2, 106957118: 1, 106982653: 1, 106230078: 1, 108234321: 1, 107941247: 1}"
Ladyslippers,117002755,Sport,106083757,5.10b/c,80,1,2.6,10.0,"Pull the opening bulge straight up and over the high first bolt.  Thin hands and a fun-to-unravel sequence leads to a solid stance to clip the second bolt.  Mellow but nevertheless enjoyable ground leads to a thin right-leaning seam.  Access the seam using good body positioning and balance as the grade picks back up.    Follow and use the seam to gain access to the face above.  Choose your path wisely through the crux (directly up and over the first bolt on the face) on razor sharp crimps and feet that get progressively smaller.    Make the next clip from a delicate stance and you’re home free.  One more bolt and a blocky run out to the anchor.  If you’re in the lichen at any point, you’re off route.","{200335317: 3, 200692562: 3, 200137270: 3, 200557201: 3, 111087111: 3, 200559866: 3, 200540857: 3, 107560545: 2, 200428404: 2, 11062: 1}"
Making Babies,106147024,Trad,106083757,5.5,0,1,2.2,29.0,Crux is the step from the ledge above chimney to the slabs.,"{200252454: 4, 112038160: 4, 113436649: 3, 200170380: 3, 108321835: 3, 200215756: 3, 200266279: 3, 111087111: 2, 107941356: 2, 200078397: 2, 107920500: 2, 200064270: 2, 200557201: 2, 200428404: 2, 110494556: 2, 106917454: 2, 110904961: 2, 107560545: 2, 106549436: 2, 106982653: 2, 107237276: 2, 107261560: 2, 108200547: 2, 110728444: 2, 109047137: 2, 107120057: 2, 109869056: 2, 109431524: 1, 106751248: 1}"
Orbital Mechanics,119573420,Trad,106083757,5.11b,90,1,3.0,1.0,"From the top of ""The Flake"" straight up past pins and bolts (same start as Orgasmic), continue straight up past a small overhang, past a small pine tree (stay right of Frogs in Space), to thin face moves at the top.",{200915116: 3}
Orgasmic,119573231,Trad,106083757,5.9,90,1,3.0,1.0,"From the top of ""The Flake"", straight up past pins and a bolt (Orbital Mechanics shares these opening moves), then right to a small inside corner.  Follow this up and right to a good stance below a bulge.  Some people belay here, making two short pitches instead of one long one (the FA was done as two). Up over the bulge onto thin face moves, past a bolt (originally a fixed pin placed on lead) and continue to the top. ",{200915116: 3}
Playing the Slots,117634357,Trad,106083757,5.8+,50,1,2.0,2.0,"A good climb with spaced protection. Not particularly recommended for a fledgling 5.7/8 leader, but a good romp otherwise. The grade was recently bumped to 5.8+.Climb up to a right facing shark fin flake. Small gear is possible here, though testing it too vigorously is not recommended. Move up to a ledge, place some good gear, then continue up the face past a bolt to a fixed anchor on a ledge. Rappel or climb any of the routes above to top out.","{109869056: 2, 200335317: 2}"
Say Goodnight Dick,113373428,Trad,106083757,5.9,40,1,3.0,20.0,I didn't find one particular crux as the whole route felt the same.,"{200252454: 4, 108321835: 4, 200536699: 3, 200137270: 3, 200790750: 3, 107232890: 3, 200597713: 3, 200557201: 3, 200309087: 3, 200559866: 3, 200374061: 3, 111087111: 3, 109017895: 3, 200152826: 3, 200215756: 3, 200383658: 3, 200258516: 3, 200335317: 3, 109869056: 2, 106852549: 2}"
The Slip,107105434,Trad,106083757,5.10,25,1,3.0,1.0,"Follow the obvious right leaning crack up the short face making use of the sharp pockets and other features to the right.  Interesting rock with great holds seemingly molded to the human hand at times.    This is a really fun climb, just wished it was longer.  Could be a high ball (I would suspect it going at around V1/2 if you stuck to the crack), but the landing is a slab that goes for about 15 feet down hill, would be sketchy.",{106982653: 3}
Snake Skin Slab,110537559,Trad,106083757,5.6,60,1,2.5,30.0,"Difficult to protect on lead, but a good beginner toprope. Follow thin cracks up the face, then left to the arete, and then back right to the face.","{200248447: 4, 112038160: 4, 110728444: 3, 200383927: 3, 200266279: 3, 106154776: 3, 113436649: 3, 200335317: 3, 110337843: 3, 106741672: 3, 200229438: 3, 107239710: 3, 200064270: 3, 200252454: 3, 200374061: 3, 109869056: 2, 200428404: 2, 109568693: 2, 107549114: 2, 111650893: 2, 111087111: 2, 109441887: 2, 111885912: 2, 107120057: 2, 109017895: 2, 107941356: 2, 108106981: 2, 108321835: 2, 108148696: 1, 108275373: 1}"
Steel Feathers,107236226,Trad,106083757,5.10,130,1,2.5,19.0,"Steel Feathers climbs the steep wall equipped with several well-spaced bolts (3rd hanger is missing) directly to the left of ""Hush Mama Thrush"".        A bouldery start gains a nice series of flakes, a high-step off a frighteningly hollow flake leads to several hard and balancy moves above the hanger-less bolt.  Gain a ""thank god"" flake/ledge, mantel, then either continue straight up (minimal gear, and 2 more bolts), or move right to join with the upper section of ""Hush"".  Though following the last couple of bolts and sparse gear keeps the route independent, stepping right to join HMT is equally (if not a better option!) nice.      The route ends at 2 bolts shared with HMT.","{107544240: 4, 108148696: 3, 110337843: 3, 110491515: 3, 111087111: 3, 109431524: 3, 200117844: 3, 112512394: 3, 107237276: 3, 200084683: 2, 112038160: 2, 111650893: 2, 108321835: 2, 107560545: 2, 110395141: 2, 107682087: 2, 106957118: 2, 105898385: 2, 108106981: 2}"
Sticks and Stones,107272787,Trad,106083757,5.10b,90,1,3.0,24.0,"What a fine line, and perhaps one of the earliest routes at LWB.  Start 10 feet to the right of ""Tea in the Sahara"" at a thin crack.  Follow this until you reach the right side of the roof (same roof as the one for ""Tea...""), pull this, then move slightly left into the upper left-facing corner system.     The route ends at a two-bolt anchor on a nice, spacious ledge.  Walk off is to the climber's right, or rap with two 60 meter ropes.","{107549114: 4, 110728444: 4, 108321835: 4, 200335317: 4, 109869056: 3, 200383658: 3, 200084683: 3, 112330857: 3, 111087111: 3, 111650893: 3, 200064270: 3, 110164339: 3, 107560545: 3, 110120909: 3, 105898385: 3, 106889934: 3, 107544240: 3, 109431524: 3, 108148696: 3, 108106981: 3, 110395141: 2, 107682087: 2, 111933951: 2, 106418097: 2}"
Tea in the Sahara,106531832,Trad,106083757,5.10b,90,1,2.9,20.0,"Just right of large dirty right-facing corner, sits one of Bolton's finest lines, ""Tea in the Sahara"".  At 10b, and over 100 feet long, this mixed gear/bolt protected face/roof climb is a proud lead.     Thin and thoughtful moves up the face gets to you an imposing roof.  The roof, if tackled just right, won't feel too difficult, though if you're mentally taxed, then getting to the next bolt may feel challenging.  After a couple more bolts, gain the small left-facing corner protected with gear.  A few hard moves protected by one more bolt guard the top out.        Gear:   draws (some double length), and a small rack to #1 will suffice for the upper corner.","{108321835: 4, 107544240: 4, 106957118: 4, 106751248: 3, 111650893: 3, 110395141: 3, 111933951: 3, 108148696: 3, 107682087: 3, 109466205: 3, 106540977: 3, 105898385: 3, 106423391: 3, 200064270: 3, 108106981: 3, 110789920: 2, 106418097: 2, 107560545: 2, 106743674: 2, 109431524: 1}"
Tricycle Parade,119898646,Trad,106083757,5.9,80,1,1.0,1.0,"Climb the face to the right of In The Pines, moving past some fun and interesting undercling flakes. At the bulge, I'm 99% sure you stay with the underclings and move right toward the scrubby trees and back over to the 2-ring anchor.Note: I have only ever top-roped this route (it shares an anchor with In The Pines, and is a worthwhile extra pitch) and I doubt there is any decent gear. It's listed in Rakkup as a trad route, so who knows!",{200374061: 1}
Wavey Good-Bye,106083770,Trad,106083757,5.7,40,1,2.3,34.0,"A very nice--albeit short--dihedral climb.      It doesn't get much more obvious than this--climb the tight and steep corner until it is possible to escape left.      Be thoughtful with your gear placements on this route, as schist has a tendency to spit things out!","{200316681: 4, 200462073: 3, 200252454: 3, 200374061: 3, 106852549: 3, 200248447: 3, 111796230: 3, 111650893: 3, 110728444: 3, 106982653: 3, 109485507: 3, 200427395: 2, 106751248: 2, 200215756: 2, 106549436: 2, 106423391: 2, 107920500: 2, 200064270: 2, 200137270: 2, 106230078: 2, 200152826: 2, 108148696: 2, 200264323: 2, 108200547: 2, 108321835: 2, 105898385: 2, 111682684: 2, 111087111: 2, 106957118: 2, 109017895: 2, 106917454: 2, 109869056: 1, 106889934: 1, 110789920: 1}"
"What's up, doc?",107150386,Trad,106083757,5.9,80,1,2.7,11.0,"Starts just left of the arete between wavey goodbye and a-minor. Climb the arete to a small horizontal ledge beneath the handcrack of “say goodnight dick.” From here, move left to finish next to the wavey goodbye corner. Poor protection, often done as a top rope climb ","{107544240: 4, 107953310: 3, 200374061: 3, 109414386: 3, 108148696: 3, 111650893: 3, 108321835: 3, 200167098: 3, 200149547: 2, 106125538: 2, 111087111: 1}"
A.C.A.B.,119827970,Trad,119667484,5.9,50,1,3.0,2.0,"One of the best 5.9 trad lines in Bolton, if only it was taller.Climb up the easy corner on big holds through the zig-zagging crack with excellent locks. Surmount a ledge to a stance with tricky gear to the right of a small tree which guards the final moves up to a two-bolt anchor on a nice ledge.It stands for All Climbs Are Bastards, officer.","{109431524: 3, 200223405: 3}"
Abolish ICE,119828023,Sport,119667484,5.11a,90,1,2.0,1.0,"For now this remains the dirtiest FA I've ever done although the top is still very fun. Can easily be climbed into from the bottom of Smash the Patriarchy to avoid the munge and more cleaning is planned soon.The easier of the two roof lines, work up low-angle terrain to reach face climbing above. Good holds pull through the roof with a funny hip-bar rest to reach the face above and a two-bolt anchor. ",{109431524: 2}
Black Masks and Gasoline Project,119828001,Sport,119667484,5.12c,0,1,2.0,1.0,A tall route with a burly crux. Sadly it's virtually always wet but is worthwhile if you catch it dry!Climb a low angle slab to a stance and continue up as the terrain steepens. Gain a second stance below the big roof and chalk up. Those good holds in the roof don't last as tiny crimps gain the face above. Two-bolt anchor.,{109431524: 2}
Burnin' and Lootin',119827945,Trad,119667484,5.10a,30,1,1.0,1.0,A fun route but short.Climb the roof crack made easier with excellent feet to stem with. Lock into a bomber jam at the roof while you pull the lip to gain the anchor above.,{109431524: 1}
Don't Need a Weatherman,119827957,Trad,119667484,5.8,80,1,2.0,1.0,An unexpected bit of long face climbing on gear.Climb the low angle-left leaning ramp to the crack in the overlap. Surmount the overlap and trend right along the easiest terrain to reach a stance below the face. Excellent face climbing with good holds leads to a two-bolt anchor trending left.,{109431524: 2}
Gender is a Myth Project,119827989,Sport,119667484,5.11+,70,1,3.0,1.0,"Start up to a stance below the bulge, crank up on perfect incut crimps to a desperate mantle before continuing up the exposed arete as the terrain continues to ease. Two-bolt anchor. ",{109431524: 3}
"Hands Up, Don't Shoot",119827978,Sport,119667484,5.11b,70,1,3.0,2.0,"A difficult but quality boulder problem off the ground gains a ledge. From the ledge continue up through a techy section to a steeper crux above to reach a crack with mediocre jams and eventually a two-bolt anchor.The boulder problem, while quality, can be avoided by starting on A.C.A.B. which would bring the rating down to about 10d.","{109431524: 3, 200223405: 3}"
Molotov,119827983,Sport,119667484,5.11c,70,1,2.0,1.0,Climb through a hard start with a knee bar and some powerful laybacking to surmount the overlap. Eventually the jugs appear and the climb gets easier and higher quality. A short finger crack gains off-vertical climbing with good holds and a fun finish. Classic bolton 5.11.,{109431524: 2}
Reigning Cats and Dogmas,119910033,Trad,119667484,5.8,110,1,2.0,1.0,A very fun route that needs a little more cleaning but that makes a great introduction to 5.8 trad for a budding leader.Start on a boulder at the base of the gully and clip a bolt. Pull onto the face with difficulty to reach an intermittent crack with excellent holds. Gain the slab above and wander between gear placements and a few bolts to the steeper finish and a mantle. A more comfortable belay is from the trees but a two-bolt rappel anchor is available.,{109431524: 2}
Smash the Patriarchy,119674213,Sport,119667484,5.10b,100,1,3.0,2.0,Nice and tall with a fun small roof at the top. One of the first routes to dry.Climb the vertical face up to a stance below the small roof. Big holds through the roof lead to a two-bolt anchor.  Note: a 60-meter rope is needed.,"{109431524: 3, 200223405: 3}"
Solidarity,119828051,Sport,119667484,5.7+,70,1,3.5,2.0,"An excellent, tall bit of face climbing with jugs everywhere.Work up the easy, left-facing ramp to pull onto the face. Fun slots lead to a step left and a fun line of incut crimps to an anchor on the tallest section of the cliff.","{200223405: 4, 109431524: 3}"
Which Side Are You On?,119674176,Sport,119667484,5.7,90,1,4.0,2.0,An incredible beginner sport climb that takes you up a steep ramp with featured rock and fun moves.,"{109431524: 4, 200223405: 4}"
Ribbit Ridge,110802573,Trad,110802568,5.6,160,2,2.3,4.0,"Good, easy slab on a clean face. Only a few 5.6 moves.  P1 Start at the middle of the base on the ledge, head up to the ramp moving right. Straight up and right over a couple bolt protected bulges. Traverse a few feet right and up two a two-bolt anchor, a little runout but on very easy (5.3) terrain. ~90ft    P2 Second pitch, not as good imo, entails a diagonal run up and left following the easy to spot bolts. Rap rings slung to a tree lower on the right or shared anchor at the top left across the slab. ~70ft    Extra bonus: blueberries on the route, wicked tasty snack on your way up","{200167098: 3, 108148696: 2, 107560545: 2, 109017895: 2}"
"Captain's Crack (Exotic Nut Selection, E.N.S.)",107789865,Trad,107582365,5.8-,180,2,2.2,15.0,"Another hidden gem at Double Upper.  You can do this as one long pitch but I think it's better as two.    Pitch 1 runs up and slightly right on easy slabs, passing a few bolts (with optional gear in between) then past a short tricky steeper spot to get to a two-bolt belay/rap anchor.    Pitch 2 moves up steeper ground past two bolts to an overlap, then up the left-facing bottomless corner.  Then breaking right up easy ground to the spacious, pleasant ledge.  The view from here is superb.  Two raps with a single 60m rope will get you back down, via the first pitch anchor. ","{106804809: 3, 110494556: 3, 106423391: 3, 106852549: 3, 109568693: 3, 200189307: 2, 200167098: 2, 110395141: 2, 111087111: 2, 109411750: 2, 111650893: 2, 106889934: 2, 107560545: 2, 106743674: 1, 200406385: 1}"
Heavy Weather,109059586,Trad,107582365,5.9,90,1,2.4,7.0,"Hike up to the main wall at Double Upper (or alternatively, climb Cadet's Corner) and go to the far right end of the ledge (beyond Ladybug and Night Crawlers) to a left facing chimney/flake system. Scramble up through brush toward the chimney/flake and locate a bolt about 25' up the slab above.  Head up the slab, clip the bolt, pull a techy crux into a small left facing corner.  Get gear then climb past 4 bolts and another series of technical moves.  Jog slightly right to a corner/roof system.  Place gear and pull the roof. Move back slightly left above the roof to a bolt anchor on a nice ledge. Rap from here with a 60M rope (be sure to locate the middle of the rope or tie knots in the ends)  or move left 15' on the ledge and finish up P2 (5.6?,80' gear; shared with P2 of NightCrawlers  at the top)","{107560545: 3, 107549114: 3, 200167098: 3, 108321790: 2, 109431524: 2, 111087111: 2, 200350797: 2}"
